Date;Region;Symbol;SessionUTC;AnalysisUTC;Version;Up;Down;ReferenciaBias;TCIM_Vies;TCIM_Score;TCIM_Motivos;TCIM_Alertas;Erro
27/11/2025;America;XAUUSD;2025-11-27T13:30:00+00:00;2025-11-27T13:15:00+00:00;1.2.3;0.099;0.011;COMPRA;FORA;-1.0;"Tendência: Neutro (Slopes das EMAs estão próximos de zero (lateral).; Confirmação H1: EMA50 inclinada para cima (+0.5).) | Contexto: Desfavorável (Preço abaixo da VWAP (-1).; Preço abaixo da EMA50 (-0.5).) | Impulso: Fraco (ADX=12.2 abaixo de 22 (0).) | Mitigação: Sem alertas (Volatilidade dentro do intervalo esperado.)";Nenhum alerta crítico.;
27/11/2025;Asia;USDJPY;2025-11-27T00:00:00+00:00;2025-11-26T23:30:00+00:00;1.2.1;0.104;0.084;COMPRA;FORA;-1.0;"Tendência: Neutro (Slopes das EMAs estão próximos de zero (lateral).; Confirmação H1: EMA50 inclinada para cima (+0.5).) | Contexto: Desfavorável (Preço abaixo da VWAP (-1).; Preço abaixo da EMA50 (-0.5).) | Impulso: Fraco (ADX=10.7 abaixo de 15 (0).) | Mitigação: Sem alertas (Volatilidade dentro do intervalo esperado.)";Nenhum alerta crítico.;
27/11/2025;Europe;EURUSD;2025-11-27T07:00:00+00:00;2025-11-27T06:30:00+00:00;1.2.2;0.1;0.087;COMPRA;FORA;0.0;"Tendência: Neutro (Slopes das EMAs estão próximos de zero (lateral).; Confirmação H1: EMA50 inclinada para cima (+0.5).) | Contexto: Neutro (Preço abaixo da VWAP (-1).; Preço acima da EMA50 (+0.5).) | Impulso: Fraco (ADX=12.9 abaixo de 14 (0).) | Mitigação: Sem alertas (Volatilidade dentro do intervalo esperado.)";Nenhum alerta crítico.;
26/11/2025;America;XAUUSD;2025-11-26T13:30:00+00:00;2025-11-26T13:15:00+00:00;1.2.3;0.097;0.079;COMPRA;FORA;0.0;"Tendência: Alta moderada (EMAs apontando para cima, mas preço perdeu uma das médias.; Confirmação H1: EMA50 inclinada para cima (+0.5).) | Contexto: Desfavorável (Preço abaixo da VWAP (-1).; Preço abaixo da EMA50 (-0.5).) | Impulso: Fraco (ADX=14.1 abaixo de 22 (0).) | Mitigação: Sem alertas (Volatilidade dentro do intervalo esperado.)";Nenhum alerta crítico.;
26/11/2025;Asia;USDJPY;2025-11-26T00:00:00+00:00;2025-11-25T23:30:00+00:00;1.2.1;0.106;0.084;COMPRA;FORA;0.0;"Tendência: Baixa moderada (Tendência de baixa nos slopes, porém preço tenta se manter acima.; Confirmação H1: EMA50 inclinada para baixo (-0.5).) | Contexto: Neutro (Preço acima da VWAP intradiária (+1).; Preço abaixo da EMA50 (-0.5).) | Impulso: Moderado (ADX=15.8 entre 15-20 (+1).) | Mitigação: Sem alertas (Volatilidade dentro do intervalo esperado.)";Nenhum alerta crítico.;
26/11/2025;Europe;EURUSD;2025-11-26T07:00:00+00:00;2025-11-26T06:30:00+00:00;1.2.2;-1.002;0.099;VENDA;FORA;0.0;"Tendência: Neutro (Slopes das EMAs estão próximos de zero (lateral).; Confirmação H1: EMA50 inclinada para cima (+0.5).) | Contexto: Neutro (Preço acima da VWAP intradiária (+1).; Preço acima da EMA50 (+0.5).; Preco esticado > 1.9x ATR distante da EMA50 (-1).; Distancia > 3.0x ATR -> sinal vetado.) | Impulso: Forte (ADX=27.7 acima de 22 (+2).) | Mitigação: Sem alertas (Volatilidade dentro do intervalo esperado.)";Contexto: preço afastado demais da média (risco de correção). | Contexto extremo: afastamento excedeu limite configurado. Sinal cancelado.;
25/11/2025;America;XAUUSD;2025-11-25T13:30:00+00:00;2025-11-25T13:15:00+00:00;1.2.3;0.206;0.085;COMPRA;FORA;-1.0;"Tendência: Baixa (Slope EMA20/EMA50 negativos e preço abaixo das médias.; Confirmação H1: EMA50 inclinada para cima (+0.5).) | Contexto: Neutro (Preço acima da VWAP intradiária (+1).; Preço abaixo da EMA50 (-0.5).) | Impulso: Fraco (ADX=19.9 abaixo de 22 (0).) | Mitigação: Sem alertas (Volatilidade dentro do intervalo esperado.)";Nenhum alerta crítico.;
25/11/2025;Asia;USDJPY;2025-11-25T00:00:00+00:00;2025-11-24T23:30:00+00:00;1.2.1;-0.158;0.078;VENDA;COMPRA;3.0;"Tendência: Neutro (Slopes das EMAs estão próximos de zero (lateral).; Confirmação H1: EMA50 inclinada para cima (+0.5).) | Contexto: Favorável (Preço acima da VWAP intradiária (+1).; Preço acima da EMA50 (+0.5).) | Impulso: Moderado (ADX=18.2 entre 15-20 (+1).) | Mitigação: Sem alertas (Volatilidade dentro do intervalo esperado.)";Nenhum alerta crítico.;
25/11/2025;Europe;EURUSD;2025-11-25T07:00:00+00:00;2025-11-25T06:30:00+00:00;1.2.2;0.129;0.102;COMPRA;FORA;-0.5;"Tendência: Neutro (Slopes das EMAs estão próximos de zero (lateral).; Confirmação H1: slope neutro.) | Contexto: Desfavorável (Preço abaixo da VWAP (-1).; Preço abaixo da EMA50 (-0.5).) | Impulso: Moderado (ADX=19.4 entre 14-22 (+1).) | Mitigação: Sem alertas (Volatilidade dentro do intervalo esperado.)";Nenhum alerta crítico.;
24/11/2025;America;XAUUSD;2025-11-24T13:30:00+00:00;2025-11-24T13:15:00+00:00;1.2.3;0.103;0.079;COMPRA;COMPRA;4.0;"Tendência: Alta (Slope EMA20/EMA50 positivos e preço sustentado acima das médias.; Confirmação H1: EMA50 inclinada para baixo (-0.5).) | Contexto: Favorável (Preço acima da VWAP intradiária (+1).; Preço acima da EMA50 (+0.5).) | Impulso: Moderado (ADX=28.1 entre 22-30 (+1).) | Mitigação: Sem alertas (Volatilidade dentro do intervalo esperado.)";Nenhum alerta crítico.;
24/11/2025;Asia;USDJPY;2025-11-24T00:00:00+00:00;2025-11-23T23:30:00+00:00;1.2.1;-0.018;-0.042;COMPRA;FORA;0.0;"Tendência: Baixa moderada (Tendência de baixa nos slopes, porém preço tenta se manter acima.; Confirmação H1: EMA50 inclinada para baixo (-0.5).) | Contexto: Neutro (Preço acima da VWAP intradiária (+1).; Preço abaixo da EMA50 (-0.5).) | Impulso: Moderado (ADX=16.7 entre 15-20 (+1).) | Mitigação: Sem alertas (Volatilidade dentro do intervalo esperado.)";Nenhum alerta crítico.;
24/11/2025;Europe;EURUSD;2025-11-24T07:00:00+00:00;2025-11-24T06:30:00+00:00;1.2.2;0.11;0.131;VENDA;COMPRA;2.5;"Tendência: Neutro (Slopes das EMAs estão próximos de zero (lateral).; Confirmação H1: slope neutro.) | Contexto: Favorável (Preço acima da VWAP intradiária (+1).; Preço acima da EMA50 (+0.5).) | Impulso: Forte (ADX=26.3 acima de 22 (+2).) | Mitigação: Atencao: pavio exagerado (Volatilidade dentro do intervalo esperado.; Pavio exagerado no candle atual (-1).)";Mitigacao: pavio exagerado no candle atual.;
21/11/2025;America;XAUUSD;2025-11-21T13:30:00+00:00;2025-11-21T13:15:00+00:00;1.2.3;0.099;0.085;COMPRA;FORA;0.0;"Tendência: Baixa moderada (Tendência de baixa nos slopes, porém preço tenta se manter acima.; Confirmação H1: EMA50 inclinada para baixo (-0.5).) | Contexto: Favorável (Preço acima da VWAP intradiária (+1).; Preço acima da EMA50 (+0.5).) | Impulso: Fraco (ADX=20.1 abaixo de 22 (0).) | Mitigação: Sem alertas (Volatilidade dentro do intervalo esperado.)";Nenhum alerta crítico.;
21/11/2025;Asia;USDJPY;2025-11-21T00:00:00+00:00;2025-11-20T23:30:00+00:00;1.2.1;-0.084;0.074;VENDA;FORA;0.0;"Tendência: Neutro (Slopes das EMAs estão próximos de zero (lateral).; Confirmação H1: EMA50 inclinada para cima (+0.5).) | Contexto: Desfavorável (Preço abaixo da VWAP (-1).; Preço abaixo da EMA50 (-0.5).) | Impulso: Moderado (ADX=18.0 entre 15-20 (+1).) | Mitigação: Sem alertas (Volatilidade dentro do intervalo esperado.)";Nenhum alerta crítico.;
21/11/2025;Europe;EURUSD;2025-11-21T07:00:00+00:00;2025-11-21T06:30:00+00:00;1.2.2;0.016;0.101;VENDA;FORA;0.5;"Tendência: Neutro (Slopes das EMAs estão próximos de zero (lateral).; Confirmação H1: slope neutro.) | Contexto: Neutro (Preço acima da VWAP intradiária (+1).; Preço acima da EMA50 (+0.5).; Preco esticado > 1.9x ATR distante da EMA50 (-1).) | Impulso: Fraco (ADX=13.7 abaixo de 14 (0).) | Mitigação: Sem alertas (Volatilidade dentro do intervalo esperado.)";Contexto: preço afastado demais da média (risco de correção).;
20/11/2025;America;XAUUSD;2025-11-20T13:30:00+00:00;2025-11-20T13:15:00+00:00;1.2.3;0.096;0.09;COMPRA;FORA;0.0;"Tendência: Baixa moderada (Tendência de baixa nos slopes, porém preço tenta se manter acima.; Confirmação H1: EMA50 inclinada para baixo (-0.5).) | Contexto: Favorável (Preço acima da VWAP intradiária (+1).; Preço acima da EMA50 (+0.5).) | Impulso: Fraco (ADX=16.5 abaixo de 22 (0).) | Mitigação: Sem alertas (Volatilidade dentro do intervalo esperado.)";Nenhum alerta crítico.;
20/11/2025;Asia;USDJPY;2025-11-20T00:00:00+00:00;2025-11-19T23:30:00+00:00;1.2.1;0.108;-0.173;COMPRA;FORA;0.0;"Tendência: Alta (Slope EMA20/EMA50 positivos e preço sustentado acima das médias.; Confirmação H1: EMA50 inclinada para cima (+0.5).) | Contexto: Neutro (Preço acima da VWAP intradiária (+1).; Preço acima da EMA50 (+0.5).; Preco esticado > 1.5x ATR distante da EMA50 (-1).) | Impulso: Forte (ADX=45.4 acima de 20 (+2).) | Mitigação: Risco: volatilidade extrema (Candle atual > 2.0x ATR (-2).; Pavio exagerado no candle atual (-1).; Mitigação forte: pavio exagerado + preço afastado demais da média. Sinal vetado.)";Contexto: preço afastado demais da média (risco de correção). | Volatilidade excessiva detectada (candle > 2.0x ATR). | Mitigacao: pavio exagerado no candle atual. | Sinal vetado por mitigação (pavio exagerado + preço afastado da média).;
20/11/2025;Europe;EURUSD;2025-11-20T07:00:00+00:00;2025-11-20T06:30:00+00:00;1.2.2;0.2;0.096;COMPRA;COMPRA;2.0;"Tendência: Neutro (Slopes das EMAs estão próximos de zero (lateral).; Confirmação H1: EMA50 inclinada para baixo (-0.5).) | Contexto: Neutro (Preço acima da VWAP intradiária (+1).; Preço abaixo da EMA50 (-0.5).) | Impulso: Forte (ADX=26.6 acima de 22 (+2).) | Mitigação: Sem alertas (Volatilidade dentro do intervalo esperado.)";Nenhum alerta crítico.;
19/11/2025;America;XAUUSD;2025-11-19T13:30:00+00:00;2025-11-19T13:15:00+00:00;1.2.3;0.116;0.08;COMPRA;FORA;0.0;"Tendência: Alta (Slope EMA20/EMA50 positivos e preço sustentado acima das médias.; Confirmação H1: EMA50 inclinada para cima (+0.5).) | Contexto: Neutro (Preço acima da VWAP intradiária (+1).; Preço acima da EMA50 (+0.5).; Preco esticado > 2.5x ATR distante da EMA50 (-1).; Distancia > 3.0x ATR -> sinal vetado.) | Impulso: Forte (ADX=38.2 acima de 30 (+2).) | Mitigação: Sem alertas (Volatilidade dentro do intervalo esperado.; Mitigação forte: contexto esticado com score elevado. Sinal vetado.)";Contexto: preço afastado demais da média (risco de correção). | Contexto extremo: afastamento excedeu limite configurado. Sinal cancelado. | Sinal vetado por mitigação (preço afastado + score alto).;
19/11/2025;Asia;USDJPY;2025-11-19T00:00:00+00:00;2025-11-18T23:30:00+00:00;1.2.1;-0.125;0.077;VENDA;FORA;1.5;"Tendência: Alta (Slope EMA20/EMA50 positivos e preço sustentado acima das médias.; Confirmação H1: EMA50 inclinada para cima (+0.5).) | Contexto: Neutro (Preço acima da VWAP intradiária (+1).; Preço acima da EMA50 (+0.5).; Preco esticado > 1.5x ATR distante da EMA50 (-1).) | Impulso: Fraco (ADX=12.6 abaixo de 15 (0).) | Mitigação: Atenção: mercado travado (Candle atual < 0.8x ATR (-1).)";Contexto: preço afastado demais da média (risco de correção). | Baixa volatilidade: range < 0.8x ATR.;
19/11/2025;Europe;EURUSD;2025-11-19T07:00:00+00:00;2025-11-19T06:30:00+00:00;1.2.2;0.074;0.106;VENDA;COMPRA;3.5;"Tendência: Neutro (Slopes das EMAs estão próximos de zero (lateral).; Confirmação H1: slope neutro.) | Contexto: Favorável (Preço acima da VWAP intradiária (+1).; Preço acima da EMA50 (+0.5).) | Impulso: Forte (ADX=22.0 acima de 22 (+2).) | Mitigação: Sem alertas (Volatilidade dentro do intervalo esperado.)";Nenhum alerta crítico.;
18/11/2025;America;XAUUSD;2025-11-18T13:30:00+00:00;2025-11-18T13:15:00+00:00;1.2.3;0.099;0.097;COMPRA;FORA;0.0;"Tendência: Alta moderada (EMAs apontando para cima, mas preço perdeu uma das médias.; Confirmação H1: EMA50 inclinada para baixo (-0.5).) | Contexto: Desfavorável (Preço abaixo da VWAP (-1).; Preço abaixo da EMA50 (-0.5).) | Impulso: Moderado (ADX=25.0 entre 22-30 (+1).) | Mitigação: Sem alertas (Volatilidade dentro do intervalo esperado.)";Nenhum alerta crítico.;
18/11/2025;Asia;USDJPY;2025-11-18T00:00:00+00:00;2025-11-17T23:30:00+00:00;1.2.1;-0.154;0.078;VENDA;FORA;0.0;"Tendência: Alta (Slope EMA20/EMA50 positivos e preço sustentado acima das médias.; Confirmação H1: EMA50 inclinada para cima (+0.5).) | Contexto: Neutro (Preço acima da VWAP intradiária (+1).; Preço acima da EMA50 (+0.5).; Preco esticado > 1.5x ATR distante da EMA50 (-1).) | Impulso: Moderado (ADX=16.6 entre 15-20 (+1).) | Mitigação: Atencao: pavio exagerado (Volatilidade dentro do intervalo esperado.; Pavio exagerado no candle atual (-1).; Mitigação forte: pavio exagerado + preço afastado demais da média. Sinal vetado.)";Contexto: preço afastado demais da média (risco de correção). | Mitigacao: pavio exagerado no candle atual. | Sinal vetado por mitigação (pavio exagerado + preço afastado da média).;
18/11/2025;Europe;EURUSD;2025-11-18T07:00:00+00:00;2025-11-18T06:30:00+00:00;1.2.2;0.121;0.098;COMPRA;FORA;1.5;"Tendência: Neutro (Slopes das EMAs estão próximos de zero (lateral).; Confirmação H1: slope neutro.) | Contexto: Favorável (Preço acima da VWAP intradiária (+1).; Preço acima da EMA50 (+0.5).) | Impulso: Fraco (ADX=13.1 abaixo de 14 (0).) | Mitigação: Sem alertas (Volatilidade dentro do intervalo esperado.)";Nenhum alerta crítico.;
17/11/2025;America;XAUUSD;2025-11-17T13:30:00+00:00;2025-11-17T13:15:00+00:00;1.2.3;0.101;0.082;COMPRA;VENDA;-3.5;"Tendência: Baixa (Slope EMA20/EMA50 negativos e preço abaixo das médias.; Confirmação H1: EMA50 inclinada para baixo (-0.5).) | Contexto: Desfavorável (Preço abaixo da VWAP (-1).; Preço abaixo da EMA50 (-0.5).) | Impulso: Fraco (ADX=12.0 abaixo de 22 (0).) | Mitigação: Sem alertas (Volatilidade dentro do intervalo esperado.)";Nenhum alerta crítico.;
17/11/2025;Asia;USDJPY;2025-11-17T00:00:00+00:00;2025-11-16T23:30:00+00:00;1.2.1;0.095;-0.283;COMPRA;FORA;1.0;"Tendência: Alta moderada (EMAs apontando para cima, mas preço perdeu uma das médias.; Confirmação H1: EMA50 inclinada para baixo (-0.5).) | Contexto: Favorável (Preço acima da VWAP intradiária (+1).; Preço acima da EMA50 (+0.5).) | Impulso: Fraco (ADX=11.5 abaixo de 15 (0).) | Mitigação: Atencao: pavio exagerado (Volatilidade dentro do intervalo esperado.; Pavio exagerado no candle atual (-1).)";Mitigacao: pavio exagerado no candle atual.;
17/11/2025;Europe;EURUSD;2025-11-17T07:00:00+00:00;2025-11-17T06:30:00+00:00;1.2.2;-1.011;0.079;VENDA;FORA;0.0;"Tendência: Neutro (Slopes das EMAs estão próximos de zero (lateral).; Confirmação H1: slope neutro.) | Contexto: Desfavorável (Preço abaixo da VWAP (-1).; Preço abaixo da EMA50 (-0.5).; Preco esticado > 1.9x ATR distante da EMA50 (-1).; Distancia > 3.0x ATR -> sinal vetado.) | Impulso: Forte (ADX=40.1 acima de 22 (+2).) | Mitigação: Sem alertas (Volatilidade dentro do intervalo esperado.)";Contexto: preço afastado demais da média (risco de correção). | Contexto extremo: afastamento excedeu limite configurado. Sinal cancelado.;
14/11/2025;America;XAUUSD;2025-11-14T13:30:00+00:00;2025-11-14T13:15:00+00:00;1.2.3;0.123;0.083;COMPRA;FORA;0.0;"Tendência: Baixa (Slope EMA20/EMA50 negativos e preço abaixo das médias.; Confirmação H1: EMA50 inclinada para cima (+0.5).) | Contexto: Desfavorável (Preço abaixo da VWAP (-1).; Preço abaixo da EMA50 (-0.5).; Preco esticado > 2.5x ATR distante da EMA50 (-1).; Distancia > 3.0x ATR -> sinal vetado.) | Impulso: Forte (ADX=43.7 acima de 30 (+2).) | Mitigação: Sem alertas (Volatilidade dentro do intervalo esperado.)";Contexto: preço afastado demais da média (risco de correção). | Contexto extremo: afastamento excedeu limite configurado. Sinal cancelado.;
14/11/2025;Asia;USDJPY;2025-11-14T00:00:00+00:00;2025-11-13T23:30:00+00:00;1.2.1;-0.233;0.08;VENDA;COMPRA;2.0;"Tendência: Neutro (Slopes das EMAs estão próximos de zero (lateral).; Confirmação H1: EMA50 inclinada para cima (+0.5).) | Contexto: Favorável (Preço acima da VWAP intradiária (+1).; Preço acima da EMA50 (+0.5).) | Impulso: Fraco (ADX=14.8 abaixo de 15 (0).) | Mitigação: Sem alertas (Volatilidade dentro do intervalo esperado.)";Nenhum alerta crítico.;
14/11/2025;Europe;EURUSD;2025-11-14T07:00:00+00:00;2025-11-14T06:30:00+00:00;1.2.2;-1.015;0.096;VENDA;COMPRA;3.0;"Tendência: Neutro (Slopes das EMAs estão próximos de zero (lateral).; Confirmação H1: EMA50 inclinada para cima (+0.5).) | Contexto: Favorável (Preço acima da VWAP intradiária (+1).; Preço acima da EMA50 (+0.5).) | Impulso: Moderado (ADX=14.6 entre 14-22 (+1).) | Mitigação: Sem alertas (Volatilidade dentro do intervalo esperado.)";Nenhum alerta crítico.;
13/11/2025;America;XAUUSD;2025-11-13T13:30:00+00:00;2025-11-13T13:15:00+00:00;1.2.3;-1.015;0.112;VENDA;FORA;0.0;"Tendência: Alta (Slope EMA20/EMA50 positivos e preço sustentado acima das médias.; Confirmação H1: EMA50 inclinada para cima (+0.5).) | Contexto: Neutro (Preço acima da VWAP intradiária (+1).; Preço acima da EMA50 (+0.5).; Preco esticado > 2.5x ATR distante da EMA50 (-1).; Distancia > 3.0x ATR -> sinal vetado.) | Impulso: Moderado (ADX=25.5 entre 22-30 (+1).) | Mitigação: Sem alertas (Volatilidade dentro do intervalo esperado.)";Contexto: preço afastado demais da média (risco de correção). | Contexto extremo: afastamento excedeu limite configurado. Sinal cancelado.;
13/11/2025;Asia;USDJPY;2025-11-13T00:00:00+00:00;2025-11-12T23:30:00+00:00;1.2.1;0.086;0.088;VENDA;COMPRA;3.5;"Tendência: Alta (Slope EMA20/EMA50 positivos e preço sustentado acima das médias.; Confirmação H1: EMA50 inclinada para cima (+0.5).) | Contexto: Favorável (Preço acima da VWAP intradiária (+1).; Preço acima da EMA50 (+0.5).) | Impulso: Fraco (ADX=14.1 abaixo de 15 (0).) | Mitigação: Sem alertas (Volatilidade dentro do intervalo esperado.)";Nenhum alerta crítico.;
13/11/2025;Europe;EURUSD;2025-11-13T07:00:00+00:00;2025-11-13T06:30:00+00:00;1.2.2;0.092;-1.022;COMPRA;FORA;-1.5;"Tendência: Neutro (Slopes das EMAs estão próximos de zero (lateral).; Confirmação H1: slope neutro.) | Contexto: Desfavorável (Preço abaixo da VWAP (-1).; Preço abaixo da EMA50 (-0.5).) | Impulso: Fraco (ADX=13.0 abaixo de 14 (0).) | Mitigação: Sem alertas (Volatilidade dentro do intervalo esperado.)";Nenhum alerta crítico.;
12/11/2025;America;XAUUSD;2025-11-12T13:30:00+00:00;2025-11-12T13:15:00+00:00;1.2.3;0.1;-1.005;COMPRA;COMPRA;3.5;"Tendência: Alta (Slope EMA20/EMA50 positivos e preço sustentado acima das médias.; Confirmação H1: EMA50 inclinada para cima (+0.5).) | Contexto: Favorável (Preço acima da VWAP intradiária (+1).; Preço acima da EMA50 (+0.5).) | Impulso: Fraco (ADX=14.7 abaixo de 22 (0).) | Mitigação: Sem alertas (Volatilidade dentro do intervalo esperado.)";Nenhum alerta crítico.;
12/11/2025;Asia;USDJPY;2025-11-12T00:00:00+00:00;2025-11-11T23:30:00+00:00;1.2.1;0.099;-0.2;COMPRA;COMPRA;3.5;"Tendência: Alta (Slope EMA20/EMA50 positivos e preço sustentado acima das médias.; Confirmação H1: EMA50 inclinada para cima (+0.5).) | Contexto: Favorável (Preço acima da VWAP intradiária (+1).; Preço acima da EMA50 (+0.5).) | Impulso: Fraco (ADX=14.2 abaixo de 15 (0).) | Mitigação: Sem alertas (Volatilidade dentro do intervalo esperado.)";Nenhum alerta crítico.;
12/11/2025;Europe;EURUSD;2025-11-12T07:00:00+00:00;2025-11-12T06:30:00+00:00;1.2.2;-1.048;0.099;VENDA;FORA;1.5;"Tendência: Neutro (Slopes das EMAs estão próximos de zero (lateral).; Confirmação H1: slope neutro.) | Contexto: Neutro (Preço acima da VWAP intradiária (+1).; Preço abaixo da EMA50 (-0.5).) | Impulso: Moderado (ADX=18.2 entre 14-22 (+1).) | Mitigação: Sem alertas (Volatilidade dentro do intervalo esperado.)";Nenhum alerta crítico.;
11/11/2025;America;XAUUSD;2025-11-11T13:30:00+00:00;2025-11-11T13:15:00+00:00;1.2.3;-0.544;0.08;VENDA;FORA;1.0;"Tendência: Alta moderada (EMAs apontando para cima, mas preço perdeu uma das médias.; Confirmação H1: EMA50 inclinada para cima (+0.5).) | Contexto: Neutro (Preço abaixo da VWAP (-1).; Preço acima da EMA50 (+0.5).) | Impulso: Fraco (ADX=14.4 abaixo de 22 (0).) | Mitigação: Sem alertas (Volatilidade dentro do intervalo esperado.)";Nenhum alerta crítico.;
11/11/2025;Asia;USDJPY;2025-11-11T00:00:00+00:00;2025-11-10T23:30:00+00:00;1.2.1;0.104;-0.229;COMPRA;COMPRA;4.5;"Tendência: Alta (Slope EMA20/EMA50 positivos e preço sustentado acima das médias.; Confirmação H1: EMA50 inclinada para cima (+0.5).) | Contexto: Favorável (Preço acima da VWAP intradiária (+1).; Preço acima da EMA50 (+0.5).) | Impulso: Moderado (ADX=16.1 entre 15-20 (+1).) | Mitigação: Sem alertas (Volatilidade dentro do intervalo esperado.)";Nenhum alerta crítico.;
11/11/2025;Europe;EURUSD;2025-11-11T07:00:00+00:00;2025-11-11T06:30:00+00:00;1.2.2;0.142;-0.999;COMPRA;COMPRA;2.5;"Tendência: Neutro (Slopes das EMAs estão próximos de zero (lateral).; Confirmação H1: slope neutro.) | Contexto: Favorável (Preço acima da VWAP intradiária (+1).; Preço acima da EMA50 (+0.5).) | Impulso: Moderado (ADX=21.6 entre 14-22 (+1).) | Mitigação: Sem alertas (Volatilidade dentro do intervalo esperado.)";Nenhum alerta crítico.;
10/11/2025;America;XAUUSD;2025-11-10T13:30:00+00:00;2025-11-10T13:15:00+00:00;1.2.3;0.115;0.078;COMPRA;FORA;0.0;"Tendência: Alta (Slope EMA20/EMA50 positivos e preço sustentado acima das médias.; Confirmação H1: EMA50 inclinada para cima (+0.5).) | Contexto: Neutro (Preço acima da VWAP intradiária (+1).; Preço acima da EMA50 (+0.5).; Preco esticado > 2.5x ATR distante da EMA50 (-1).; Distancia > 3.0x ATR -> sinal vetado.) | Impulso: Forte (ADX=50.2 acima de 30 (+2).) | Mitigação: Sem alertas (Volatilidade dentro do intervalo esperado.; Mitigação forte: contexto esticado com score elevado. Sinal vetado.)";Contexto: preço afastado demais da média (risco de correção). | Contexto extremo: afastamento excedeu limite configurado. Sinal cancelado. | Sinal vetado por mitigação (preço afastado + score alto).;
10/11/2025;Asia;USDJPY;2025-11-10T00:00:00+00:00;2025-11-09T23:30:00+00:00;1.2.1;0.006;-0.04;COMPRA;COMPRA;4.0;"Tendência: Alta (Slope EMA20/EMA50 positivos e preço sustentado acima das médias.; Confirmação H1: EMA50 inclinada para baixo (-0.5).) | Contexto: Neutro (Preço acima da VWAP intradiária (+1).; Preço acima da EMA50 (+0.5).; Preco esticado > 1.5x ATR distante da EMA50 (-1).) | Impulso: Forte (ADX=26.4 acima de 20 (+2).) | Mitigação: Sem alertas (Volatilidade dentro do intervalo esperado.)";Contexto: preço afastado demais da média (risco de correção).;
10/11/2025;Europe;EURUSD;2025-11-10T07:00:00+00:00;2025-11-10T06:30:00+00:00;1.2.2;0.091;-1.021;COMPRA;COMPRA;3.0;"Tendência: Neutro (Slopes das EMAs estão próximos de zero (lateral).; Confirmação H1: EMA50 inclinada para cima (+0.5).) | Contexto: Favorável (Preço acima da VWAP intradiária (+1).; Preço acima da EMA50 (+0.5).) | Impulso: Moderado (ADX=16.0 entre 14-22 (+1).) | Mitigação: Sem alertas (Volatilidade dentro do intervalo esperado.)";Nenhum alerta crítico.;
07/11/2025;America;XAUUSD;2025-11-07T13:30:00+00:00;2025-11-07T13:15:00+00:00;1.2.3;0.1039;0.092;COMPRA;FORA;0.0;"Tendência: Alta moderada (EMAs apontando para cima, mas preço perdeu uma das médias.; Confirmação H1: EMA50 inclinada para cima (+0.5).) | Contexto: Desfavorável (Preço abaixo da VWAP (-1).; Preço abaixo da EMA50 (-0.5).) | Impulso: Fraco (ADX=11.7 abaixo de 22 (0).) | Mitigação: Sem alertas (Volatilidade dentro do intervalo esperado.)";Nenhum alerta crítico.;
07/11/2025;Asia;USDJPY;2025-11-07T00:00:00+00:00;2025-11-06T23:30:00+00:00;1.2.1;-0.0004;-0.0366;COMPRA;VENDA;-2.0;"Tendência: Baixa (Slope EMA20/EMA50 negativos e preço abaixo das médias.; Confirmação H1: EMA50 inclinada para baixo (-0.5).) | Contexto: Desfavorável (Preço abaixo da VWAP (-1).; Preço abaixo da EMA50 (-0.5).; Preco esticado > 1.5x ATR distante da EMA50 (-1).) | Impulso: Forte (ADX=32.2 acima de 20 (+2).) | Mitigação: Sem alertas (Volatilidade dentro do intervalo esperado.)";Contexto: preço afastado demais da média (risco de correção).;
07/11/2025;Europe;EURUSD;2025-11-07T07:00:00+00:00;2025-11-07T06:30:00+00:00;1.2.2;0.094;0.072;COMPRA;FORA;1.0;"Tendência: Neutro (Slopes das EMAs estão próximos de zero (lateral).; Confirmação H1: EMA50 inclinada para cima (+0.5).) | Contexto: Desfavorável (Preço abaixo da VWAP (-1).; Preço abaixo da EMA50 (-0.5).) | Impulso: Forte (ADX=24.8 acima de 22 (+2).) | Mitigação: Sem alertas (Volatilidade dentro do intervalo esperado.)";Nenhum alerta crítico.;
06/11/2025;America;XAUUSD;2025-11-06T13:30:00+00:00;2025-11-06T13:15:00+00:00;1.2.3;-1.0256;0.0852;VENDA;COMPRA;3.0;"Tendência: Alta moderada (EMAs apontando para cima, mas preço perdeu uma das médias.; Confirmação H1: EMA50 inclinada para cima (+0.5).) | Contexto: Neutro (Preço abaixo da VWAP (-1).; Preço acima da EMA50 (+0.5).) | Impulso: Forte (ADX=33.6 acima de 30 (+2).) | Mitigação: Sem alertas (Volatilidade dentro do intervalo esperado.)";Nenhum alerta crítico.;
06/11/2025;Asia;USDJPY;2025-11-06T00:00:00+00:00;2025-11-05T23:30:00+00:00;1.2.1;0.0807;0.1088;VENDA;COMPRA;3.0;"Tendência: Alta moderada (EMAs apontando para cima, mas preço perdeu uma das médias.; Confirmação H1: EMA50 inclinada para cima (+0.5).) | Contexto: Neutro (Preço abaixo da VWAP (-1).; Preço acima da EMA50 (+0.5).) | Impulso: Forte (ADX=20.9 acima de 20 (+2).) | Mitigação: Sem alertas (Volatilidade dentro do intervalo esperado.)";Nenhum alerta crítico.;
06/11/2025;Europe;EURUSD;2025-11-06T07:00:00+00:00;2025-11-06T06:30:00+00:00;1.2.2;0.096;0.107;VENDA;FORA;0.0;"Tendência: Neutro (Slopes das EMAs estão próximos de zero (lateral).; Confirmação H1: slope neutro.) | Contexto: Neutro (Preço acima da VWAP intradiária (+1).; Preço acima da EMA50 (+0.5).; Preco esticado > 1.9x ATR distante da EMA50 (-1).; Distancia > 3.0x ATR -> sinal vetado.) | Impulso: Forte (ADX=38.0 acima de 22 (+2).) | Mitigação: Atencao: pavio exagerado (Volatilidade dentro do intervalo esperado.; Pavio exagerado no candle atual (-1).; Mitigação forte: pavio exagerado + preço afastado demais da média. Sinal vetado.)";Contexto: preço afastado demais da média (risco de correção). | Contexto extremo: afastamento excedeu limite configurado. Sinal cancelado. | Mitigacao: pavio exagerado no candle atual. | Sinal vetado por mitigação (pavio exagerado + preço afastado da média).;
05/11/2025;America;XAUUSD;2025-11-05T13:30:00+00:00;2025-11-05T13:15:00+00:00;1.2.3;0.1005;0.0963;COMPRA;FORA;1.0;"Tendência: Neutro (Slopes das EMAs estão próximos de zero (lateral).; Confirmação H1: EMA50 inclinada para baixo (-0.5).) | Contexto: Favorável (Preço acima da VWAP intradiária (+1).; Preço acima da EMA50 (+0.5).) | Impulso: Fraco (ADX=20.9 abaixo de 22 (0).) | Mitigação: Sem alertas (Volatilidade dentro do intervalo esperado.)";Nenhum alerta crítico.;
05/11/2025;Asia;USDJPY;2025-11-05T00:00:00+00:00;2025-11-04T23:30:00+00:00;1.2.1;0.0825;-0.29;COMPRA;COMPRA;4.0;"Tendência: Alta (Slope EMA20/EMA50 positivos e preço sustentado acima das médias.; Confirmação H1: EMA50 inclinada para baixo (-0.5).) | Contexto: Favorável (Preço acima da VWAP intradiária (+1).; Preço acima da EMA50 (+0.5).) | Impulso: Moderado (ADX=17.5 entre 15-20 (+1).) | Mitigação: Sem alertas (Volatilidade dentro do intervalo esperado.)";Nenhum alerta crítico.;
05/11/2025;Europe;EURUSD;2025-11-05T07:00:00+00:00;2025-11-05T06:30:00+00:00;1.2.2;0.088;-0.01;COMPRA;COMPRA;2.0;"Tendência: Neutro (Slopes das EMAs estão próximos de zero (lateral).; Confirmação H1: EMA50 inclinada para baixo (-0.5).) | Contexto: Favorável (Preço acima da VWAP intradiária (+1).; Preço acima da EMA50 (+0.5).) | Impulso: Moderado (ADX=20.4 entre 14-22 (+1).) | Mitigação: Sem alertas (Volatilidade dentro do intervalo esperado.)";Nenhum alerta crítico.;
04/11/2025;America;XAUUSD;2025-11-04T13:30:00+00:00;2025-11-04T13:15:00+00:00;1.2.3;0.1151;-0.2284;COMPRA;FORA;-1.0;"Tendência: Alta moderada (EMAs apontando para cima, mas preço perdeu uma das médias.; Confirmação H1: EMA50 inclinada para baixo (-0.5).) | Contexto: Desfavorável (Preço abaixo da VWAP (-1).; Preço abaixo da EMA50 (-0.5).) | Impulso: Fraco (ADX=12.5 abaixo de 22 (0).) | Mitigação: Sem alertas (Volatilidade dentro do intervalo esperado.)";Nenhum alerta crítico.;
04/11/2025;Asia;USDJPY;2025-11-04T00:00:00+00:00;2025-11-03T23:30:00+00:00;1.2.1;0.0094;-0.0118;COMPRA;COMPRA;3.5;"Tendência: Alta (Slope EMA20/EMA50 positivos e preço sustentado acima das médias.; Confirmação H1: EMA50 inclinada para cima (+0.5).) | Contexto: Favorável (Preço acima da VWAP intradiária (+1).; Preço acima da EMA50 (+0.5).) | Impulso: Fraco (ADX=10.3 abaixo de 15 (0).) | Mitigação: Sem alertas (Volatilidade dentro do intervalo esperado.)";Nenhum alerta crítico.;
04/11/2025;Europe;EURUSD;2025-11-04T07:00:00+00:00;2025-11-04T06:30:00+00:00;1.2.2;0.103;0.099;COMPRA;COMPRA;2.0;"Tendência: Neutro (Slopes das EMAs estão próximos de zero (lateral).; Confirmação H1: EMA50 inclinada para baixo (-0.5).) | Contexto: Favorável (Preço acima da VWAP intradiária (+1).; Preço acima da EMA50 (+0.5).) | Impulso: Moderado (ADX=16.0 entre 14-22 (+1).) | Mitigação: Sem alertas (Volatilidade dentro do intervalo esperado.)";Nenhum alerta crítico.;
03/11/2025;America;XAUUSD;2025-11-03T13:30:00+00:00;2025-11-03T13:15:00+00:00;1.2.3;0.1009;0.084;COMPRA;FORA;1.0;"Tendência: Baixa moderada (Tendência de baixa nos slopes, porém preço tenta se manter acima.; Confirmação H1: EMA50 inclinada para cima (+0.5).) | Contexto: Favorável (Preço acima da VWAP intradiária (+1).; Preço acima da EMA50 (+0.5).) | Impulso: Fraco (ADX=13.0 abaixo de 22 (0).) | Mitigação: Sem alertas (Volatilidade dentro do intervalo esperado.)";Nenhum alerta crítico.;
03/11/2025;Asia;USDJPY;2025-11-03T00:00:00+00:00;2025-11-02T23:30:00+00:00;1.2.1;0.1026;-0.3642;COMPRA;FORA;-1.0;"Tendência: Baixa moderada (Tendência de baixa nos slopes, porém preço tenta se manter acima.; Confirmação H1: EMA50 inclinada para cima (+0.5).) | Contexto: Favorável (Preço acima da VWAP intradiária (+1).; Preço acima da EMA50 (+0.5).) | Impulso: Fraco (ADX=14.3 abaixo de 15 (0).) | Mitigação: Risco: volatilidade extrema (Candle atual > 2.0x ATR (-2).)";Volatilidade excessiva detectada (candle > 2.0x ATR).;
03/11/2025;Europe;EURUSD;2025-11-03T07:00:00+00:00;2025-11-03T06:30:00+00:00;1.2.2;-1.038;0.089;VENDA;COMPRA;2.0;"Tendência: Neutro (Slopes das EMAs estão próximos de zero (lateral).; Confirmação H1: EMA50 inclinada para baixo (-0.5).) | Contexto: Favorável (Preço acima da VWAP intradiária (+1).; Preço acima da EMA50 (+0.5).) | Impulso: Moderado (ADX=15.0 entre 14-22 (+1).) | Mitigação: Sem alertas (Volatilidade dentro do intervalo esperado.)";Nenhum alerta crítico.;
31/10/2025;America;XAUUSD;2025-10-31T13:30:00+00:00;2025-10-31T13:15:00+00:00;1.2.3;-0.3201;0.1021;VENDA;COMPRA;2.0;"Tendência: Neutro (Slopes das EMAs estão próximos de zero (lateral).; Confirmação H1: EMA50 inclinada para cima (+0.5).) | Contexto: Favorável (Preço acima da VWAP intradiária (+1).; Preço acima da EMA50 (+0.5).) | Impulso: Fraco (ADX=16.3 abaixo de 22 (0).) | Mitigação: Sem alertas (Volatilidade dentro do intervalo esperado.)";Nenhum alerta crítico.;
31/10/2025;Asia;USDJPY;2025-10-31T00:00:00+00:00;2025-10-30T23:30:00+00:00;1.2.1;0.1041;0.0805;COMPRA;FORA;0.0;"Tendência: Neutro (Slopes das EMAs estão próximos de zero (lateral).; Confirmação H1: EMA50 inclinada para cima (+0.5).) | Contexto: Neutro (Preço abaixo da VWAP (-1).; Preço acima da EMA50 (+0.5).) | Impulso: Fraco (ADX=11.4 abaixo de 15 (0).) | Mitigação: Sem alertas (Volatilidade dentro do intervalo esperado.)";Nenhum alerta crítico.;
31/10/2025;Europe;EURUSD;2025-10-31T07:00:00+00:00;2025-10-31T06:30:00+00:00;1.2.2;0.114;-1.005;COMPRA;FORA;-1.0;"Tendência: Neutro (Slopes das EMAs estão próximos de zero (lateral).; Confirmação H1: EMA50 inclinada para baixo (-0.5).) | Contexto: Desfavorável (Preço abaixo da VWAP (-1).; Preço abaixo da EMA50 (-0.5).) | Impulso: Moderado (ADX=17.4 entre 14-22 (+1).) | Mitigação: Sem alertas (Volatilidade dentro do intervalo esperado.)";Nenhum alerta crítico.;
30/10/2025;America;XAUUSD;2025-10-30T13:30:00+00:00;2025-10-30T13:15:00+00:00;1.2.3;0.0248;-0.0648;COMPRA;FORA;-1.0;"Tendência: Alta moderada (EMAs apontando para cima, mas preço perdeu uma das médias.; Confirmação H1: EMA50 inclinada para baixo (-0.5).) | Contexto: Desfavorável (Preço abaixo da VWAP (-1).; Preço abaixo da EMA50 (-0.5).) | Impulso: Fraco (ADX=16.1 abaixo de 22 (0).) | Mitigação: Sem alertas (Volatilidade dentro do intervalo esperado.)";Nenhum alerta crítico.;
30/10/2025;Asia;USDJPY;2025-10-30T00:00:00+00:00;2025-10-29T23:30:00+00:00;1.2.1;0.1075;-0.4283;COMPRA;FORA;1.5;"Tendência: Alta (Slope EMA20/EMA50 positivos e preço sustentado acima das médias.; Confirmação H1: slope neutro.) | Contexto: Desfavorável (Preço abaixo da VWAP (-1).; Preço acima da EMA50 (+0.5).; Preco esticado > 1.5x ATR distante da EMA50 (-1).) | Impulso: Forte (ADX=29.6 acima de 20 (+2).) | Mitigação: Atenção: mercado travado (Candle atual < 0.8x ATR (-1).)";Contexto: preço afastado demais da média (risco de correção). | Baixa volatilidade: range < 0.8x ATR.;
30/10/2025;Europe;EURUSD;2025-10-30T07:00:00+00:00;2025-10-30T06:30:00+00:00;1.2.2;-0.997;0.122;VENDA;COMPRA;3.5;"Tendência: Neutro (Slopes das EMAs estão próximos de zero (lateral).; Confirmação H1: slope neutro.) | Contexto: Favorável (Preço acima da VWAP intradiária (+1).; Preço acima da EMA50 (+0.5).) | Impulso: Forte (ADX=23.3 acima de 22 (+2).) | Mitigação: Sem alertas (Volatilidade dentro do intervalo esperado.)";Nenhum alerta crítico.;
29/10/2025;America;XAUUSD;2025-10-29T13:30:00+00:00;2025-10-29T13:15:00+00:00;1.2.3;-0.4994;0.083;VENDA;FORA;0.0;"Tendência: Alta (Slope EMA20/EMA50 positivos e preço sustentado acima das médias.; Confirmação H1: EMA50 inclinada para baixo (-0.5).) | Contexto: Neutro (Preço acima da VWAP intradiária (+1).; Preço acima da EMA50 (+0.5).; Preco esticado > 2.5x ATR distante da EMA50 (-1).; Distancia > 3.0x ATR -> sinal vetado.) | Impulso: Forte (ADX=41.9 acima de 30 (+2).) | Mitigação: Atenção: mercado travado (Candle atual < 0.7x ATR (-1).; Mitigação forte: contexto esticado com score elevado. Sinal vetado.)";Contexto: preço afastado demais da média (risco de correção). | Contexto extremo: afastamento excedeu limite configurado. Sinal cancelado. | Baixa volatilidade: range < 0.7x ATR. | Sinal vetado por mitigação (preço afastado + score alto).;
29/10/2025;Asia;USDJPY;2025-10-29T00:00:00+00:00;2025-10-28T23:30:00+00:00;1.2.1;0.1022;0.0869;COMPRA;FORA;-1.5;"Tendência: Baixa (Slope EMA20/EMA50 negativos e preço abaixo das médias.; Confirmação H1: EMA50 inclinada para baixo (-0.5).) | Contexto: Neutro (Preço acima da VWAP intradiária (+1).; Preço abaixo da EMA50 (-0.5).) | Impulso: Fraco (ADX=8.8 abaixo de 15 (0).) | Mitigação: Sem alertas (Volatilidade dentro do intervalo esperado.)";Nenhum alerta crítico.;
29/10/2025;Europe;EURUSD;2025-10-29T07:00:00+00:00;2025-10-29T06:30:00+00:00;1.2.2;0.101;0.112;VENDA;FORA;0.0;"Tendência: Neutro (Slopes das EMAs estão próximos de zero (lateral).; Confirmação H1: slope neutro.) | Contexto: Desfavorável (Preço abaixo da VWAP (-1).; Preço abaixo da EMA50 (-0.5).; Preco esticado > 1.9x ATR distante da EMA50 (-1).; Distancia > 3.0x ATR -> sinal vetado.) | Impulso: Forte (ADX=35.6 acima de 22 (+2).) | Mitigação: Atencao: pavio exagerado (Volatilidade dentro do intervalo esperado.; Pavio exagerado no candle atual (-1).; Mitigação forte: pavio exagerado + preço afastado demais da média. Sinal vetado.)";Contexto: preço afastado demais da média (risco de correção). | Contexto extremo: afastamento excedeu limite configurado. Sinal cancelado. | Mitigacao: pavio exagerado no candle atual. | Sinal vetado por mitigação (pavio exagerado + preço afastado da média).;
28/10/2025;America;XAUUSD;2025-10-28T13:30:00+00:00;2025-10-28T13:15:00+00:00;1.2.3;0.1002;-0.1372;COMPRA;FORA;-0.5;"Tendência: Baixa (Slope EMA20/EMA50 negativos e preço abaixo das médias.; Confirmação H1: EMA50 inclinada para baixo (-0.5).) | Contexto: Neutro (Preço acima da VWAP intradiária (+1).; Preço abaixo da EMA50 (-0.5).; Preco esticado > 2.5x ATR distante da EMA50 (-1).) | Impulso: Forte (ADX=37.3 acima de 30 (+2).) | Mitigação: Sem alertas (Volatilidade dentro do intervalo esperado.)";Contexto: preço afastado demais da média (risco de correção).;
28/10/2025;Asia;USDJPY;2025-10-28T00:00:00+00:00;2025-10-27T23:30:00+00:00;1.2.1;0.072;0.0805;VENDA;VENDA;-2.5;"Tendência: Baixa (Slope EMA20/EMA50 negativos e preço abaixo das médias.; Confirmação H1: EMA50 inclinada para cima (+0.5).) | Contexto: Desfavorável (Preço abaixo da VWAP (-1).; Preço abaixo da EMA50 (-0.5).; Preco esticado > 1.5x ATR distante da EMA50 (-1).) | Impulso: Forte (ADX=31.5 acima de 20 (+2).) | Mitigação: Atenção: mercado travado (Candle atual < 0.8x ATR (-1).)";Contexto: preço afastado demais da média (risco de correção). | Baixa volatilidade: range < 0.8x ATR.;
28/10/2025;Europe;EURUSD;2025-10-28T07:00:00+00:00;2025-10-28T06:30:00+00:00;1.2.2;0.152;0.091;COMPRA;COMPRA;2.5;"Tendência: Neutro (Slopes das EMAs estão próximos de zero (lateral).; Confirmação H1: slope neutro.) | Contexto: Neutro (Preço acima da VWAP intradiária (+1).; Preço acima da EMA50 (+0.5).; Preco esticado > 1.9x ATR distante da EMA50 (-1).) | Impulso: Forte (ADX=40.2 acima de 22 (+2).) | Mitigação: Sem alertas (Volatilidade dentro do intervalo esperado.)";Contexto: preço afastado demais da média (risco de correção).;
27/10/2025;America;XAUUSD;2025-10-27T13:30:00+00:00;2025-10-27T13:15:00+00:00;1.2.3;0.0834;0.0914;VENDA;FORA;1.0;"Tendência: Baixa moderada (Tendência de baixa nos slopes, porém preço tenta se manter acima.; Confirmação H1: EMA50 inclinada para baixo (-0.5).) | Contexto: Neutro (Preço acima da VWAP intradiária (+1).; Preço abaixo da EMA50 (-0.5).) | Impulso: Forte (ADX=49.2 acima de 30 (+2).) | Mitigação: Sem alertas (Volatilidade dentro do intervalo esperado.)";Nenhum alerta crítico.;
27/10/2025;Asia;USDJPY;2025-10-27T00:00:00+00:00;2025-10-26T23:30:00+00:00;1.2.1;0.1034;-0.4179;COMPRA;COMPRA;4.5;"Tendência: Alta (Slope EMA20/EMA50 positivos e preço sustentado acima das médias.; Confirmação H1: EMA50 inclinada para cima (+0.5).) | Contexto: Neutro (Preço acima da VWAP intradiária (+1).; Preço acima da EMA50 (+0.5).; Preco esticado > 1.5x ATR distante da EMA50 (-1).) | Impulso: Forte (ADX=20.0 acima de 20 (+2).) | Mitigação: Sem alertas (Volatilidade dentro do intervalo esperado.)";Contexto: preço afastado demais da média (risco de correção).;
27/10/2025;Europe;EURUSD;2025-10-27T07:00:00+00:00;2025-10-27T06:30:00+00:00;1.2.2;0.107;0.116;VENDA;COMPRA;2.5;"Tendência: Neutro (Slopes das EMAs estão próximos de zero (lateral).; Confirmação H1: slope neutro.) | Contexto: Favorável (Preço acima da VWAP intradiária (+1).; Preço acima da EMA50 (+0.5).) | Impulso: Moderado (ADX=14.6 entre 14-22 (+1).) | Mitigação: Sem alertas (Volatilidade dentro do intervalo esperado.)";Nenhum alerta crítico.;
24/10/2025;America;XAUUSD;2025-10-24T13:30:00+00:00;2025-10-24T13:15:00+00:00;1.2.3;0.1106;-0.2828;COMPRA;VENDA;-2.0;"Tendência: Baixa (Slope EMA20/EMA50 negativos e preço abaixo das médias.; Confirmação H1: EMA50 inclinada para baixo (-0.5).) | Contexto: Desfavorável (Preço abaixo da VWAP (-1).; Preço abaixo da EMA50 (-0.5).; Preco esticado > 2.5x ATR distante da EMA50 (-1).) | Impulso: Forte (ADX=41.9 acima de 30 (+2).) | Mitigação: Sem alertas (Volatilidade dentro do intervalo esperado.)";Contexto: preço afastado demais da média (risco de correção).;
24/10/2025;Asia;USDJPY;2025-10-24T00:00:00+00:00;2025-10-23T23:30:00+00:00;1.2.1;0.1011;-0.1806;COMPRA;FORA;-1.0;"Tendência: Neutro (Slopes das EMAs estão próximos de zero (lateral).; Confirmação H1: EMA50 inclinada para cima (+0.5).) | Contexto: Desfavorável (Preço abaixo da VWAP (-1).; Preço abaixo da EMA50 (-0.5).) | Impulso: Fraco (ADX=14.0 abaixo de 15 (0).) | Mitigação: Sem alertas (Volatilidade dentro do intervalo esperado.)";Nenhum alerta crítico.;
24/10/2025;Europe;EURUSD;2025-10-24T07:00:00+00:00;2025-10-24T06:30:00+00:00;1.2.2;0.092;0.1134;VENDA;FORA;-1.5;"Tendência: Neutro (Slopes das EMAs estão próximos de zero (lateral).; Confirmação H1: slope neutro.) | Contexto: Desfavorável (Preço abaixo da VWAP (-1).; Preço abaixo da EMA50 (-0.5).) | Impulso: Moderado (ADX=20.9 entre 14-22 (+1).) | Mitigação: Atenção: mercado travado (Candle atual < 0.7x ATR (-1).)";Baixa volatilidade: range < 0.7x ATR.;
23/10/2025;America;XAUUSD;2025-10-23T13:30:00+00:00;2025-10-23T13:15:00+00:00;1.2.3;0.1032;0.0821;COMPRA;FORA;0.0;"Tendência: Alta moderada (EMAs apontando para cima, mas preço perdeu uma das médias.; Confirmação H1: EMA50 inclinada para baixo (-0.5).) | Contexto: Neutro (Preço abaixo da VWAP (-1).; Preço acima da EMA50 (+0.5).) | Impulso: Fraco (ADX=11.7 abaixo de 22 (0).) | Mitigação: Sem alertas (Volatilidade dentro do intervalo esperado.)";Nenhum alerta crítico.;
23/10/2025;Asia;USDJPY;2025-10-23T00:00:00+00:00;2025-10-22T23:30:00+00:00;1.2.1;0.102;0.0795;COMPRA;FORA;0.0;"Tendência: Alta moderada (EMAs apontando para cima, mas preço perdeu uma das médias.; Confirmação H1: EMA50 inclinada para cima (+0.5).) | Contexto: Desfavorável (Preço abaixo da VWAP (-1).; Preço abaixo da EMA50 (-0.5).) | Impulso: Fraco (ADX=12.7 abaixo de 15 (0).) | Mitigação: Sem alertas (Volatilidade dentro do intervalo esperado.)";Nenhum alerta crítico.;
23/10/2025;Europe;EURUSD;2025-10-23T07:00:00+00:00;2025-10-23T06:30:00+00:00;1.2.2;0.0901;0.117;VENDA;FORA;1.5;"Tendência: Neutro (Slopes das EMAs estão próximos de zero (lateral).; Confirmação H1: slope neutro.) | Contexto: Neutro (Preço acima da VWAP intradiária (+1).; Preço abaixo da EMA50 (-0.5).) | Impulso: Forte (ADX=24.1 acima de 22 (+2).) | Mitigação: Atenção: mercado travado (Candle atual < 0.7x ATR (-1).)";Baixa volatilidade: range < 0.7x ATR.;
22/10/2025;America;XAUUSD;2025-10-22T13:30:00+00:00;2025-10-22T13:15:00+00:00;1.2.3;0.1006;0.0838;COMPRA;FORA;0.0;"Tendência: Baixa (Slope EMA20/EMA50 negativos e preço abaixo das médias.; Confirmação H1: EMA50 inclinada para baixo (-0.5).) | Contexto: Desfavorável (Preço abaixo da VWAP (-1).; Preço abaixo da EMA50 (-0.5).; Preco esticado > 2.5x ATR distante da EMA50 (-1).; Distancia > 3.0x ATR -> sinal vetado.) | Impulso: Forte (ADX=38.9 acima de 30 (+2).) | Mitigação: Sem alertas (Volatilidade dentro do intervalo esperado.)";Contexto: preço afastado demais da média (risco de correção). | Contexto extremo: afastamento excedeu limite configurado. Sinal cancelado.;
22/10/2025;Asia;USDJPY;2025-10-22T00:00:00+00:00;2025-10-21T23:30:00+00:00;1.2.1;0.1013;0.0799;COMPRA;FORA;-1.0;"Tendência: Alta moderada (EMAs apontando para cima, mas preço perdeu uma das médias.; Confirmação H1: EMA50 inclinada para cima (+0.5).) | Contexto: Desfavorável (Preço abaixo da VWAP (-1).; Preço acima da EMA50 (+0.5).; Preco esticado > 1.5x ATR distante da EMA50 (-1).) | Impulso: Fraco (ADX=8.0 abaixo de 15 (0).) | Mitigação: Atenção: mercado travado (Candle atual < 0.8x ATR (-1).)";Contexto: preço afastado demais da média (risco de correção). | Baixa volatilidade: range < 0.8x ATR.;
22/10/2025;Europe;EURUSD;2025-10-22T07:00:00+00:00;2025-10-22T06:30:00+00:00;1.2.2;0.0926;0.0915;COMPRA;COMPRA;2.0;"Tendência: Neutro (Slopes das EMAs estão próximos de zero (lateral).; Confirmação H1: EMA50 inclinada para baixo (-0.5).) | Contexto: Favorável (Preço acima da VWAP intradiária (+1).; Preço acima da EMA50 (+0.5).) | Impulso: Moderado (ADX=18.1 entre 14-22 (+1).) | Mitigação: Sem alertas (Volatilidade dentro do intervalo esperado.)";Nenhum alerta crítico.;
21/10/2025;America;XAUUSD;2025-10-21T13:30:00+00:00;2025-10-21T13:15:00+00:00;1.2.3;0.1034;0.0899;COMPRA;FORA;0.0;"Tendência: Baixa (Slope EMA20/EMA50 negativos e preço abaixo das médias.; Confirmação H1: EMA50 inclinada para cima (+0.5).) | Contexto: Desfavorável (Preço abaixo da VWAP (-1).; Preço abaixo da EMA50 (-0.5).; Preco esticado > 2.5x ATR distante da EMA50 (-1).; Distancia > 3.0x ATR -> sinal vetado.) | Impulso: Forte (ADX=57.2 acima de 30 (+2).) | Mitigação: Sem alertas (Volatilidade dentro do intervalo esperado.)";Contexto: preço afastado demais da média (risco de correção). | Contexto extremo: afastamento excedeu limite configurado. Sinal cancelado.;
21/10/2025;Asia;USDJPY;2025-10-21T00:00:00+00:00;2025-10-20T23:30:00+00:00;1.2.1;0.1054;0.0891;COMPRA;COMPRA;3.5;"Tendência: Alta (Slope EMA20/EMA50 positivos e preço sustentado acima das médias.; Confirmação H1: EMA50 inclinada para cima (+0.5).) | Contexto: Favorável (Preço acima da VWAP intradiária (+1).; Preço acima da EMA50 (+0.5).) | Impulso: Fraco (ADX=8.5 abaixo de 15 (0).) | Mitigação: Sem alertas (Volatilidade dentro do intervalo esperado.)";Nenhum alerta crítico.;
21/10/2025;Europe;EURUSD;2025-10-21T07:00:00+00:00;2025-10-21T06:30:00+00:00;1.2.2;0.0869;0.1049;VENDA;FORA;0.0;"Tendência: Neutro (Slopes das EMAs estão próximos de zero (lateral).; Confirmação H1: slope neutro.) | Contexto: Desfavorável (Preço abaixo da VWAP (-1).; Preço abaixo da EMA50 (-0.5).; Preco esticado > 1.9x ATR distante da EMA50 (-1).) | Impulso: Forte (ADX=32.5 acima de 22 (+2).) | Mitigação: Sem alertas (Volatilidade dentro do intervalo esperado.)";Contexto: preço afastado demais da média (risco de correção).;
20/10/2025;America;XAUUSD;2025-10-20T13:30:00+00:00;2025-10-20T13:15:00+00:00;1.2.3;0.125;0.097;COMPRA;COMPRA;3.0;"Tendência: Alta (Slope EMA20/EMA50 positivos e preço sustentado acima das médias.; Confirmação H1: EMA50 inclinada para baixo (-0.5).) | Contexto: Favorável (Preço acima da VWAP intradiária (+1).; Preço acima da EMA50 (+0.5).) | Impulso: Fraco (ADX=11.9 abaixo de 22 (0).) | Mitigação: Sem alertas (Volatilidade dentro do intervalo esperado.)";Nenhum alerta crítico.;
20/10/2025;Asia;USDJPY;2025-10-20T00:00:00+00:00;2025-10-19T23:30:00+00:00;1.2.1;0.1113;0.0827;COMPRA;COMPRA;2.0;"Tendência: Alta (Slope EMA20/EMA50 positivos e preço sustentado acima das médias.; Confirmação H1: EMA50 inclinada para baixo (-0.5).) | Contexto: Neutro (Preço acima da VWAP intradiária (+1).; Preço acima da EMA50 (+0.5).; Preco esticado > 1.5x ATR distante da EMA50 (-1).) | Impulso: Forte (ADX=22.9 acima de 20 (+2).) | Mitigação: Risco: volatilidade extrema (Candle atual > 2.0x ATR (-2).)";Contexto: preço afastado demais da média (risco de correção). | Volatilidade excessiva detectada (candle > 2.0x ATR).;
20/10/2025;Europe;EURUSD;2025-10-20T07:00:00+00:00;2025-10-20T06:30:00+00:00;1.2.2;0.0912;0.1232;VENDA;FORA;1.5;"Tendência: Neutro (Slopes das EMAs estão próximos de zero (lateral).; Confirmação H1: slope neutro.) | Contexto: Favorável (Preço acima da VWAP intradiária (+1).; Preço acima da EMA50 (+0.5).) | Impulso: Fraco (ADX=13.4 abaixo de 14 (0).) | Mitigação: Sem alertas (Volatilidade dentro do intervalo esperado.)";Nenhum alerta crítico.;
17/10/2025;America;XAUUSD;2025-10-17T13:30:00+00:00;2025-10-17T13:15:00+00:00;1.2.3;0.1067;0.0923;COMPRA;FORA;0.0;"Tendência: Baixa (Slope EMA20/EMA50 negativos e preço abaixo das médias.; Confirmação H1: EMA50 inclinada para cima (+0.5).) | Contexto: Desfavorável (Preço abaixo da VWAP (-1).; Preço abaixo da EMA50 (-0.5).; Preco esticado > 2.5x ATR distante da EMA50 (-1).; Distancia > 3.0x ATR -> sinal vetado.) | Impulso: Forte (ADX=42.2 acima de 30 (+2).) | Mitigação: Sem alertas (Volatilidade dentro do intervalo esperado.)";Contexto: preço afastado demais da média (risco de correção). | Contexto extremo: afastamento excedeu limite configurado. Sinal cancelado.;
17/10/2025;Asia;USDJPY;2025-10-17T00:00:00+00:00;2025-10-16T23:30:00+00:00;1.2.1;0.0996;0.0843;COMPRA;FORA;-0.5;"Tendência: Baixa (Slope EMA20/EMA50 negativos e preço abaixo das médias.; Confirmação H1: EMA50 inclinada para baixo (-0.5).) | Contexto: Neutro (Preço acima da VWAP intradiária (+1).; Preço abaixo da EMA50 (-0.5).; Preco esticado > 1.5x ATR distante da EMA50 (-1).) | Impulso: Forte (ADX=43.0 acima de 20 (+2).) | Mitigação: Sem alertas (Volatilidade dentro do intervalo esperado.)";Contexto: preço afastado demais da média (risco de correção).;
17/10/2025;Europe;EURUSD;2025-10-17T07:00:00+00:00;2025-10-17T06:30:00+00:00;1.2.2;0.0967;0.129;VENDA;FORA;0.0;"Tendência: Neutro (Slopes das EMAs estão próximos de zero (lateral).; Confirmação H1: EMA50 inclinada para cima (+0.5).) | Contexto: Neutro (Preço acima da VWAP intradiária (+1).; Preço acima da EMA50 (+0.5).; Preco esticado > 1.9x ATR distante da EMA50 (-1).; Distancia > 3.0x ATR -> sinal vetado.) | Impulso: Forte (ADX=26.0 acima de 22 (+2).) | Mitigação: Sem alertas (Volatilidade dentro do intervalo esperado.)";Contexto: preço afastado demais da média (risco de correção). | Contexto extremo: afastamento excedeu limite configurado. Sinal cancelado.;
16/10/2025;America;XAUUSD;2025-10-16T13:30:00+00:00;2025-10-16T13:15:00+00:00;1.2.3;0.1106;-1.031;COMPRA;COMPRA;3.5;"Tendência: Alta (Slope EMA20/EMA50 positivos e preço sustentado acima das médias.; Confirmação H1: EMA50 inclinada para cima (+0.5).) | Contexto: Favorável (Preço acima da VWAP intradiária (+1).; Preço acima da EMA50 (+0.5).) | Impulso: Fraco (ADX=15.2 abaixo de 22 (0).) | Mitigação: Sem alertas (Volatilidade dentro do intervalo esperado.)";Nenhum alerta crítico.;
16/10/2025;Asia;USDJPY;2025-10-16T00:00:00+00:00;2025-10-15T23:30:00+00:00;1.2.1;-0.3662;0.0799;VENDA;VENDA;-3.0;"Tendência: Baixa (Slope EMA20/EMA50 negativos e preço abaixo das médias.; Confirmação H1: EMA50 inclinada para baixo (-0.5).) | Contexto: Desfavorável (Preço abaixo da VWAP (-1).; Preço abaixo da EMA50 (-0.5).; Preco esticado > 1.5x ATR distante da EMA50 (-1).) | Impulso: Forte (ADX=27.3 acima de 20 (+2).) | Mitigação: Atenção: mercado travado (Candle atual < 0.8x ATR (-1).)";Contexto: preço afastado demais da média (risco de correção). | Baixa volatilidade: range < 0.8x ATR.;
16/10/2025;Europe;EURUSD;2025-10-16T07:00:00+00:00;2025-10-16T06:30:00+00:00;1.2.2;0.0963;0.092;COMPRA;COMPRA;2.0;"Tendência: Neutro (Slopes das EMAs estão próximos de zero (lateral).; Confirmação H1: EMA50 inclinada para cima (+0.5).) | Contexto: Neutro (Preço abaixo da VWAP (-1).; Preço acima da EMA50 (+0.5).) | Impulso: Forte (ADX=36.5 acima de 22 (+2).) | Mitigação: Sem alertas (Volatilidade dentro do intervalo esperado.)";Nenhum alerta crítico.;
15/10/2025;America;XAUUSD;2025-10-15T13:30:00+00:00;2025-10-15T13:15:00+00:00;1.2.3;0.1092;0.0851;COMPRA;COMPRA;2.5;"Tendência: Alta (Slope EMA20/EMA50 positivos e preço sustentado acima das médias.; Confirmação H1: EMA50 inclinada para cima (+0.5).) | Contexto: Neutro (Preço abaixo da VWAP (-1).; Preço acima da EMA50 (+0.5).) | Impulso: Moderado (ADX=29.6 entre 22-30 (+1).) | Mitigação: Sem alertas (Volatilidade dentro do intervalo esperado.)";Nenhum alerta crítico.;
15/10/2025;Asia;USDJPY;2025-10-15T00:00:00+00:00;2025-10-14T23:30:00+00:00;1.2.1;-0.1134;0.078;VENDA;FORA;-1.0;"Tendência: Baixa moderada (Tendência de baixa nos slopes, porém preço tenta se manter acima.; Confirmação H1: EMA50 inclinada para baixo (-0.5).) | Contexto: Neutro (Preço acima da VWAP intradiária (+1).; Preço abaixo da EMA50 (-0.5).) | Impulso: Moderado (ADX=17.6 entre 15-20 (+1).) | Mitigação: Atencao: pavio exagerado (Volatilidade dentro do intervalo esperado.; Pavio exagerado no candle atual (-1).)";Mitigacao: pavio exagerado no candle atual.;
15/10/2025;Europe;EURUSD;2025-10-15T07:00:00+00:00;2025-10-15T06:30:00+00:00;1.2.2;0.1004;0.0986;COMPRA;FORA;0.0;"Tendência: Neutro (Slopes das EMAs estão próximos de zero (lateral).; Confirmação H1: slope neutro.) | Contexto: Neutro (Preço acima da VWAP intradiária (+1).; Preço acima da EMA50 (+0.5).; Preco esticado > 1.9x ATR distante da EMA50 (-1).; Distancia > 3.0x ATR -> sinal vetado.) | Impulso: Forte (ADX=36.0 acima de 22 (+2).) | Mitigação: Sem alertas (Volatilidade dentro do intervalo esperado.)";Contexto: preço afastado demais da média (risco de correção). | Contexto extremo: afastamento excedeu limite configurado. Sinal cancelado.;
14/10/2025;America;XAUUSD;2025-10-14T13:30:00+00:00;2025-10-14T13:15:00+00:00;1.2.3;0.1128;-0.3727;COMPRA;FORA;1.0;"Tendência: Alta moderada (EMAs apontando para cima, mas preço perdeu uma das médias.; Confirmação H1: EMA50 inclinada para cima (+0.5).) | Contexto: Neutro (Preço abaixo da VWAP (-1).; Preço acima da EMA50 (+0.5).) | Impulso: Moderado (ADX=22.0 entre 22-30 (+1).) | Mitigação: Atenção: mercado travado (Candle atual < 0.7x ATR (-1).)";Baixa volatilidade: range < 0.7x ATR.;
14/10/2025;Asia;USDJPY;2025-10-14T00:00:00+00:00;2025-10-13T23:30:00+00:00;1.2.1;-0.0094;-0.0205;COMPRA;FORA;0.0;"Tendência: Alta moderada (EMAs apontando para cima, mas preço perdeu uma das médias.; Confirmação H1: EMA50 inclinada para baixo (-0.5).) | Contexto: Desfavorável (Preço abaixo da VWAP (-1).; Preço abaixo da EMA50 (-0.5).) | Impulso: Moderado (ADX=18.8 entre 15-20 (+1).) | Mitigação: Sem alertas (Volatilidade dentro do intervalo esperado.)";Nenhum alerta crítico.;
14/10/2025;Europe;EURUSD;2025-10-14T07:00:00+00:00;2025-10-14T06:30:00+00:00;1.2.2;0.1261;0.098;COMPRA;COMPRA;2.5;"Tendência: Neutro (Slopes das EMAs estão próximos de zero (lateral).; Confirmação H1: slope neutro.) | Contexto: Neutro (Preço acima da VWAP intradiária (+1).; Preço acima da EMA50 (+0.5).; Preco esticado > 1.9x ATR distante da EMA50 (-1).) | Impulso: Forte (ADX=32.7 acima de 22 (+2).) | Mitigação: Sem alertas (Volatilidade dentro do intervalo esperado.)";Contexto: preço afastado demais da média (risco de correção).;
13/10/2025;America;XAUUSD;2025-10-13T13:30:00+00:00;2025-10-13T13:15:00+00:00;1.2.3;0.1014;-1.0032;COMPRA;COMPRA;3.0;"Tendência: Alta moderada (EMAs apontando para cima, mas preço perdeu uma das médias.; Confirmação H1: EMA50 inclinada para cima (+0.5).) | Contexto: Neutro (Preço abaixo da VWAP (-1).; Preço acima da EMA50 (+0.5).) | Impulso: Forte (ADX=40.7 acima de 30 (+2).) | Mitigação: Sem alertas (Volatilidade dentro do intervalo esperado.)";Nenhum alerta crítico.;
13/10/2025;Asia;USDJPY;2025-10-13T00:00:00+00:00;2025-10-12T23:30:00+00:00;1.2.1;-0.075;0.0792;VENDA;COMPRA;2.0;"Tendência: Baixa moderada (Tendência de baixa nos slopes, porém preço tenta se manter acima.; Confirmação H1: EMA50 inclinada para baixo (-0.5).) | Contexto: Favorável (Preço acima da VWAP intradiária (+1).; Preço acima da EMA50 (+0.5).) | Impulso: Forte (ADX=42.2 acima de 20 (+2).) | Mitigação: Sem alertas (Volatilidade dentro do intervalo esperado.)";Nenhum alerta crítico.;
13/10/2025;Europe;EURUSD;2025-10-13T07:00:00+00:00;2025-10-13T06:30:00+00:00;1.2.2;0.0986;0.0975;COMPRA;COMPRA;3.5;"Tendência: Neutro (Slopes das EMAs estão próximos de zero (lateral).; Confirmação H1: slope neutro.) | Contexto: Favorável (Preço acima da VWAP intradiária (+1).; Preço acima da EMA50 (+0.5).) | Impulso: Forte (ADX=34.8 acima de 22 (+2).) | Mitigação: Sem alertas (Volatilidade dentro do intervalo esperado.)";Nenhum alerta crítico.;
10/10/2025;America;XAUUSD;2025-10-10T13:30:00+00:00;2025-10-10T13:15:00+00:00;1.2.3;0.33;0.0853;COMPRA;FORA;0.0;"Tendência: Alta moderada (EMAs apontando para cima, mas preço perdeu uma das médias.; Confirmação H1: EMA50 inclinada para baixo (-0.5).) | Contexto: Neutro (Preço abaixo da VWAP (-1).; Preço acima da EMA50 (+0.5).) | Impulso: Fraco (ADX=21.7 abaixo de 22 (0).) | Mitigação: Sem alertas (Volatilidade dentro do intervalo esperado.)";Nenhum alerta crítico.;
10/10/2025;Asia;USDJPY;2025-10-10T00:00:00+00:00;2025-10-09T23:30:00+00:00;1.2.1;-0.2085;0.0797;VENDA;COMPRA;2.0;"Tendência: Alta moderada (EMAs apontando para cima, mas preço perdeu uma das médias.; Confirmação H1: EMA50 inclinada para cima (+0.5).) | Contexto: Neutro (Preço abaixo da VWAP (-1).; Preço acima da EMA50 (+0.5).) | Impulso: Moderado (ADX=16.6 entre 15-20 (+1).) | Mitigação: Sem alertas (Volatilidade dentro do intervalo esperado.)";Nenhum alerta crítico.;
10/10/2025;Europe;EURUSD;2025-10-10T07:00:00+00:00;2025-10-10T06:30:00+00:00;1.2.2;0.0919;0.1444;VENDA;COMPRA;2.0;"Tendência: Neutro (Slopes das EMAs estão próximos de zero (lateral).; Confirmação H1: EMA50 inclinada para baixo (-0.5).) | Contexto: Favorável (Preço acima da VWAP intradiária (+1).; Preço acima da EMA50 (+0.5).) | Impulso: Moderado (ADX=20.1 entre 14-22 (+1).) | Mitigação: Sem alertas (Volatilidade dentro do intervalo esperado.)";Nenhum alerta crítico.;
09/10/2025;America;XAUUSD;2025-10-09T13:30:00+00:00;2025-10-09T13:15:00+00:00;1.2.3;0.1227;0.0804;COMPRA;COMPRA;2.5;"Tendência: Alta (Slope EMA20/EMA50 positivos e preço sustentado acima das médias.; Confirmação H1: EMA50 inclinada para cima (+0.5).) | Contexto: Favorável (Preço acima da VWAP intradiária (+1).; Preço acima da EMA50 (+0.5).) | Impulso: Fraco (ADX=15.3 abaixo de 22 (0).) | Mitigação: Atenção: mercado travado (Candle atual < 0.7x ATR (-1).)";Baixa volatilidade: range < 0.7x ATR.;
09/10/2025;Asia;USDJPY;2025-10-09T00:00:00+00:00;2025-10-08T23:30:00+00:00;1.2.1;0.1019;-0.236;COMPRA;FORA;0.0;"Tendência: Neutro (Slopes das EMAs estão próximos de zero (lateral).; Confirmação H1: EMA50 inclinada para cima (+0.5).) | Contexto: Desfavorável (Preço abaixo da VWAP (-1).; Preço abaixo da EMA50 (-0.5).) | Impulso: Forte (ADX=23.3 acima de 20 (+2).) | Mitigação: Atenção: mercado travado (Candle atual < 0.8x ATR (-1).)";Baixa volatilidade: range < 0.8x ATR.;
09/10/2025;Europe;EURUSD;2025-10-09T07:00:00+00:00;2025-10-09T06:30:00+00:00;1.2.2;-1.0109;0.0943;VENDA;COMPRA;2.0;"Tendência: Neutro (Slopes das EMAs estão próximos de zero (lateral).; Confirmação H1: EMA50 inclinada para baixo (-0.5).) | Contexto: Neutro (Preço acima da VWAP intradiária (+1).; Preço acima da EMA50 (+0.5).; Preco esticado > 1.9x ATR distante da EMA50 (-1).) | Impulso: Forte (ADX=28.6 acima de 22 (+2).) | Mitigação: Sem alertas (Volatilidade dentro do intervalo esperado.)";Contexto: preço afastado demais da média (risco de correção).;
08/10/2025;America;XAUUSD;2025-10-08T13:30:00+00:00;2025-10-08T13:15:00+00:00;1.2.3;0.1099;0.0858;COMPRA;FORA;1.5;"Tendência: Alta (Slope EMA20/EMA50 positivos e preço sustentado acima das médias.; Confirmação H1: EMA50 inclinada para cima (+0.5).) | Contexto: Desfavorável (Preço abaixo da VWAP (-1).; Preço acima da EMA50 (+0.5).; Preco esticado > 2.5x ATR distante da EMA50 (-1).) | Impulso: Moderado (ADX=24.2 entre 22-30 (+1).) | Mitigação: Sem alertas (Volatilidade dentro do intervalo esperado.)";Contexto: preço afastado demais da média (risco de correção).;
08/10/2025;Asia;USDJPY;2025-10-08T00:00:00+00:00;2025-10-07T23:30:00+00:00;1.2.1;-0.008;0.0878;VENDA;COMPRA;2.5;"Tendência: Alta (Slope EMA20/EMA50 positivos e preço sustentado acima das médias.; Confirmação H1: EMA50 inclinada para cima (+0.5).) | Contexto: Desfavorável (Preço abaixo da VWAP (-1).; Preço acima da EMA50 (+0.5).; Preco esticado > 1.5x ATR distante da EMA50 (-1).) | Impulso: Forte (ADX=47.1 acima de 20 (+2).) | Mitigação: Sem alertas (Volatilidade dentro do intervalo esperado.)";Contexto: preço afastado demais da média (risco de correção).;
08/10/2025;Europe;EURUSD;2025-10-08T07:00:00+00:00;2025-10-08T06:30:00+00:00;1.2.2;0.0963;0.0963;COMPRA;FORA;0.0;"Tendência: Baixa (Slope EMA20/EMA50 negativos e preço abaixo das médias.; Confirmação H1: EMA50 inclinada para baixo (-0.5).) | Contexto: Desfavorável (Preço abaixo da VWAP (-1).; Preço abaixo da EMA50 (-0.5).; Preco esticado > 1.9x ATR distante da EMA50 (-1).; Distancia > 3.0x ATR -> sinal vetado.) | Impulso: Forte (ADX=49.5 acima de 22 (+2).) | Mitigação: Sem alertas (Volatilidade dentro do intervalo esperado.)";Contexto: preço afastado demais da média (risco de correção). | Contexto extremo: afastamento excedeu limite configurado. Sinal cancelado.;
07/10/2025;America;XAUUSD;2025-10-07T13:30:00+00:00;2025-10-07T13:15:00+00:00;1.2.3;0.1031;0.0961;COMPRA;FORA;1.0;"Tendência: Baixa moderada (Tendência de baixa nos slopes, porém preço tenta se manter acima.; Confirmação H1: EMA50 inclinada para cima (+0.5).) | Contexto: Favorável (Preço acima da VWAP intradiária (+1).; Preço acima da EMA50 (+0.5).) | Impulso: Fraco (ADX=15.3 abaixo de 22 (0).) | Mitigação: Sem alertas (Volatilidade dentro do intervalo esperado.)";Nenhum alerta crítico.;
07/10/2025;Asia;USDJPY;2025-10-07T00:00:00+00:00;2025-10-06T23:30:00+00:00;1.2.1;0.1031;-0.3365;COMPRA;COMPRA;4.5;"Tendência: Alta (Slope EMA20/EMA50 positivos e preço sustentado acima das médias.; Confirmação H1: EMA50 inclinada para cima (+0.5).) | Contexto: Neutro (Preço acima da VWAP intradiária (+1).; Preço acima da EMA50 (+0.5).; Preco esticado > 1.5x ATR distante da EMA50 (-1).) | Impulso: Forte (ADX=20.1 acima de 20 (+2).) | Mitigação: Sem alertas (Volatilidade dentro do intervalo esperado.)";Contexto: preço afastado demais da média (risco de correção).;
07/10/2025;Europe;EURUSD;2025-10-07T07:00:00+00:00;2025-10-07T06:30:00+00:00;1.2.2;-0.657;0.097;VENDA;FORA;-1.0;"Tendência: Neutro (Slopes das EMAs estão próximos de zero (lateral).; Confirmação H1: slope neutro.) | Contexto: Desfavorável (Preço abaixo da VWAP (-1).; Preço abaixo da EMA50 (-0.5).; Preco esticado > 1.9x ATR distante da EMA50 (-1).) | Impulso: Moderado (ADX=19.9 entre 14-22 (+1).) | Mitigação: Sem alertas (Volatilidade dentro do intervalo esperado.)";Contexto: preço afastado demais da média (risco de correção).;
06/10/2025;America;XAUUSD;2025-10-06T13:30:00+00:00;2025-10-06T13:15:00+00:00;1.2.3;0.1104;-0.333;COMPRA;COMPRA;2.5;"Tendência: Alta (Slope EMA20/EMA50 positivos e preço sustentado acima das médias.; Confirmação H1: EMA50 inclinada para cima (+0.5).) | Contexto: Neutro (Preço abaixo da VWAP (-1).; Preço acima da EMA50 (+0.5).) | Impulso: Moderado (ADX=23.1 entre 22-30 (+1).) | Mitigação: Sem alertas (Volatilidade dentro do intervalo esperado.)";Nenhum alerta crítico.;
06/10/2025;Asia;USDJPY;2025-10-06T00:00:00+00:00;2025-10-05T23:30:00+00:00;1.2.1;0.1063;-0.223;COMPRA;COMPRA;2.5;"Tendência: Alta (Slope EMA20/EMA50 positivos e preço sustentado acima das médias.; Confirmação H1: EMA50 inclinada para cima (+0.5).) | Contexto: Desfavorável (Preço abaixo da VWAP (-1).; Preço acima da EMA50 (+0.5).; Preco esticado > 1.5x ATR distante da EMA50 (-1).) | Impulso: Forte (ADX=27.8 acima de 20 (+2).) | Mitigação: Sem alertas (Volatilidade dentro do intervalo esperado.)";Contexto: preço afastado demais da média (risco de correção).;
06/10/2025;Europe;EURUSD;2025-10-06T07:00:00+00:00;2025-10-06T06:30:00+00:00;1.2.2;-1.0054;0.0957;VENDA;FORA;-0.5;"Tendência: Neutro (Slopes das EMAs estão próximos de zero (lateral).; Confirmação H1: slope neutro.) | Contexto: Desfavorável (Preço abaixo da VWAP (-1).; Preço abaixo da EMA50 (-0.5).) | Impulso: Moderado (ADX=21.3 entre 14-22 (+1).) | Mitigação: Sem alertas (Volatilidade dentro do intervalo esperado.)";Nenhum alerta crítico.;
03/10/2025;America;XAUUSD;2025-10-03T13:30:00+00:00;2025-10-03T13:15:00+00:00;1.2.3;0.1096;0.0838;COMPRA;FORA;1.0;"Tendência: Alta (Slope EMA20/EMA50 positivos e preço sustentado acima das médias.; Confirmação H1: EMA50 inclinada para baixo (-0.5).) | Contexto: Neutro (Preço abaixo da VWAP (-1).; Preço acima da EMA50 (+0.5).) | Impulso: Fraco (ADX=15.6 abaixo de 22 (0).) | Mitigação: Sem alertas (Volatilidade dentro do intervalo esperado.)";Nenhum alerta crítico.;
03/10/2025;Asia;USDJPY;2025-10-03T00:00:00+00:00;2025-10-02T23:30:00+00:00;1.2.1;0.0117;0.0888;VENDA;COMPRA;2.0;"Tendência: Alta moderada (EMAs apontando para cima, mas preço perdeu uma das médias.; Confirmação H1: EMA50 inclinada para baixo (-0.5).) | Contexto: Neutro (Preço abaixo da VWAP (-1).; Preço acima da EMA50 (+0.5).) | Impulso: Forte (ADX=22.6 acima de 20 (+2).) | Mitigação: Sem alertas (Volatilidade dentro do intervalo esperado.)";Nenhum alerta crítico.;
03/10/2025;Europe;EURUSD;2025-10-03T07:00:00+00:00;2025-10-03T06:30:00+00:00;1.2.2;0.101;0.096;COMPRA;FORA;-1.5;"Tendência: Neutro (Slopes das EMAs estão próximos de zero (lateral).; Confirmação H1: slope neutro.) | Contexto: Desfavorável (Preço abaixo da VWAP (-1).; Preço abaixo da EMA50 (-0.5).) | Impulso: Fraco (ADX=11.0 abaixo de 14 (0).) | Mitigação: Sem alertas (Volatilidade dentro do intervalo esperado.)";Nenhum alerta crítico.;
02/10/2025;America;XAUUSD;2025-10-02T13:30:00+00:00;2025-10-02T13:15:00+00:00;1.2.3;-1.0185;0.0988;VENDA;FORA;0.0;"Tendência: Alta (Slope EMA20/EMA50 positivos e preço sustentado acima das médias.; Confirmação H1: EMA50 inclinada para cima (+0.5).) | Contexto: Neutro (Preço acima da VWAP intradiária (+1).; Preço acima da EMA50 (+0.5).; Preco esticado > 2.5x ATR distante da EMA50 (-1).; Distancia > 3.0x ATR -> sinal vetado.) | Impulso: Forte (ADX=33.4 acima de 30 (+2).) | Mitigação: Sem alertas (Volatilidade dentro do intervalo esperado.; Mitigação forte: contexto esticado com score elevado. Sinal vetado.)";Contexto: preço afastado demais da média (risco de correção). | Contexto extremo: afastamento excedeu limite configurado. Sinal cancelado. | Sinal vetado por mitigação (preço afastado + score alto).;
02/10/2025;Asia;USDJPY;2025-10-02T00:00:00+00:00;2025-10-01T23:30:00+00:00;1.2.1;-0.3297;0.0817;VENDA;VENDA;-3.0;"Tendência: Neutro (Slopes das EMAs estão próximos de zero (lateral).; Confirmação H1: EMA50 inclinada para baixo (-0.5).) | Contexto: Desfavorável (Preço abaixo da VWAP (-1).; Preço abaixo da EMA50 (-0.5).) | Impulso: Fraco (ADX=13.5 abaixo de 15 (0).) | Mitigação: Atenção: mercado travado (Candle atual < 0.8x ATR (-1).)";Baixa volatilidade: range < 0.8x ATR.;
02/10/2025;Europe;EURUSD;2025-10-02T07:00:00+00:00;2025-10-02T06:30:00+00:00;1.2.2;0.0989;0.0928;COMPRA;FORA;-1.5;"Tendência: Neutro (Slopes das EMAs estão próximos de zero (lateral).; Confirmação H1: slope neutro.) | Contexto: Desfavorável (Preço abaixo da VWAP (-1).; Preço abaixo da EMA50 (-0.5).) | Impulso: Fraco (ADX=11.5 abaixo de 14 (0).) | Mitigação: Sem alertas (Volatilidade dentro do intervalo esperado.)";Nenhum alerta crítico.;
01/10/2025;America;XAUUSD;2025-10-01T13:30:00+00:00;2025-10-01T13:15:00+00:00;1.2.3;0.1026;0.0811;COMPRA;FORA;0.5;"Tendência: Alta (Slope EMA20/EMA50 positivos e preço sustentado acima das médias.; Confirmação H1: EMA50 inclinada para cima (+0.5).) | Contexto: Neutro (Preço abaixo da VWAP (-1).; Preço acima da EMA50 (+0.5).) | Impulso: Fraco (ADX=19.5 abaixo de 22 (0).) | Mitigação: Atenção: mercado travado (Candle atual < 0.7x ATR (-1).)";Baixa volatilidade: range < 0.7x ATR.;
01/10/2025;Asia;USDJPY;2025-10-01T00:00:00+00:00;2025-09-30T23:30:00+00:00;1.2.1;0.1025;-0.1098;COMPRA;FORA;1.0;"Tendência: Neutro (Slopes das EMAs estão próximos de zero (lateral).; Confirmação H1: EMA50 inclinada para baixo (-0.5).) | Contexto: Neutro (Preço acima da VWAP intradiária (+1).; Preço abaixo da EMA50 (-0.5).) | Impulso: Moderado (ADX=19.1 entre 15-20 (+1).) | Mitigação: Sem alertas (Volatilidade dentro do intervalo esperado.)";Nenhum alerta crítico.;
01/10/2025;Europe;EURUSD;2025-10-01T07:00:00+00:00;2025-10-01T06:30:00+00:00;1.2.2;0.0911;-1.0277;COMPRA;FORA;0.0;"Tendência: Neutro (Slopes das EMAs estão próximos de zero (lateral).; Confirmação H1: slope neutro.) | Contexto: Neutro (Preço acima da VWAP intradiária (+1).; Preço acima da EMA50 (+0.5).; Preco esticado > 1.9x ATR distante da EMA50 (-1).; Distancia > 3.0x ATR -> sinal vetado.) | Impulso: Moderado (ADX=16.0 entre 14-22 (+1).) | Mitigação: Atencao: pavio exagerado (Volatilidade dentro do intervalo esperado.; Pavio exagerado no candle atual (-1).; Mitigação forte: pavio exagerado + preço afastado demais da média. Sinal vetado.)";Contexto: preço afastado demais da média (risco de correção). | Contexto extremo: afastamento excedeu limite configurado. Sinal cancelado. | Mitigacao: pavio exagerado no candle atual. | Sinal vetado por mitigação (pavio exagerado + preço afastado da média).;
30/09/2025;America;XAUUSD;2025-09-30T13:30:00+00:00;2025-09-30T13:15:00+00:00;1.2.3;0.1006;0.087;COMPRA;VENDA;-2.0;"Tendência: Baixa (Slope EMA20/EMA50 negativos e preço abaixo das médias.; Confirmação H1: EMA50 inclinada para cima (+0.5).) | Contexto: Desfavorável (Preço abaixo da VWAP (-1).; Preço abaixo da EMA50 (-0.5).) | Impulso: Forte (ADX=47.4 acima de 30 (+2).) | Mitigação: Atenção: mercado travado (Candle atual < 0.7x ATR (-1).)";Baixa volatilidade: range < 0.7x ATR.;
30/09/2025;Asia;USDJPY;2025-09-30T00:00:00+00:00;2025-09-29T23:30:00+00:00;1.2.1;-0.0705;0.0828;VENDA;VENDA;-2.0;"Tendência: Neutro (Slopes das EMAs estão próximos de zero (lateral).; Confirmação H1: EMA50 inclinada para baixo (-0.5).) | Contexto: Desfavorável (Preço abaixo da VWAP (-1).; Preço abaixo da EMA50 (-0.5).) | Impulso: Fraco (ADX=14.1 abaixo de 15 (0).) | Mitigação: Sem alertas (Volatilidade dentro do intervalo esperado.)";Nenhum alerta crítico.;
30/09/2025;Europe;EURUSD;2025-09-30T07:00:00+00:00;2025-09-30T06:30:00+00:00;1.2.2;0.1024;-0.6061;COMPRA;COMPRA;2.5;"Tendência: Neutro (Slopes das EMAs estão próximos de zero (lateral).; Confirmação H1: slope neutro.) | Contexto: Favorável (Preço acima da VWAP intradiária (+1).; Preço acima da EMA50 (+0.5).) | Impulso: Moderado (ADX=17.5 entre 14-22 (+1).) | Mitigação: Sem alertas (Volatilidade dentro do intervalo esperado.)";Nenhum alerta crítico.;
29/09/2025;America;XAUUSD;2025-09-29T13:30:00+00:00;2025-09-29T13:15:00+00:00;1.2.3;0.1062;0.0862;COMPRA;FORA;0.0;"Tendência: Alta (Slope EMA20/EMA50 positivos e preço sustentado acima das médias.; Confirmação H1: EMA50 inclinada para cima (+0.5).) | Contexto: Neutro (Preço acima da VWAP intradiária (+1).; Preço acima da EMA50 (+0.5).; Preco esticado > 2.5x ATR distante da EMA50 (-1).; Distancia > 3.0x ATR -> sinal vetado.) | Impulso: Forte (ADX=33.8 acima de 30 (+2).) | Mitigação: Sem alertas (Volatilidade dentro do intervalo esperado.; Mitigação forte: contexto esticado com score elevado. Sinal vetado.)";Contexto: preço afastado demais da média (risco de correção). | Contexto extremo: afastamento excedeu limite configurado. Sinal cancelado. | Sinal vetado por mitigação (preço afastado + score alto).;
29/09/2025;Asia;USDJPY;2025-09-29T00:00:00+00:00;2025-09-28T23:30:00+00:00;1.2.1;-0.0483;0.0852;VENDA;FORA;-1.0;"Tendência: Baixa (Slope EMA20/EMA50 negativos e preço abaixo das médias.; Confirmação H1: EMA50 inclinada para cima (+0.5).) | Contexto: Neutro (Preço acima da VWAP intradiária (+1).; Preço abaixo da EMA50 (-0.5).) | Impulso: Moderado (ADX=16.4 entre 15-20 (+1).) | Mitigação: Atencao: pavio exagerado (Volatilidade dentro do intervalo esperado.; Pavio exagerado no candle atual (-1).)";Mitigacao: pavio exagerado no candle atual.;
29/09/2025;Europe;EURUSD;2025-09-29T07:00:00+00:00;2025-09-29T06:30:00+00:00;1.2.2;0.1183;0.1018;COMPRA;FORA;0.0;"Tendência: Neutro (Slopes das EMAs estão próximos de zero (lateral).; Confirmação H1: slope neutro.) | Contexto: Neutro (Preço acima da VWAP intradiária (+1).; Preço acima da EMA50 (+0.5).; Preco esticado > 1.9x ATR distante da EMA50 (-1).; Distancia > 3.0x ATR -> sinal vetado.) | Impulso: Forte (ADX=38.0 acima de 22 (+2).) | Mitigação: Sem alertas (Volatilidade dentro do intervalo esperado.)";Contexto: preço afastado demais da média (risco de correção). | Contexto extremo: afastamento excedeu limite configurado. Sinal cancelado.;
26/09/2025;America;XAUUSD;2025-09-26T13:30:00+00:00;2025-09-26T13:15:00+00:00;1.2.3;0.1049;-0.1672;COMPRA;FORA;0.0;"Tendência: Alta moderada (EMAs apontando para cima, mas preço perdeu uma das médias.; Confirmação H1: EMA50 inclinada para baixo (-0.5).) | Contexto: Neutro (Preço abaixo da VWAP (-1).; Preço acima da EMA50 (+0.5).) | Impulso: Fraco (ADX=10.9 abaixo de 22 (0).) | Mitigação: Sem alertas (Volatilidade dentro do intervalo esperado.)";Nenhum alerta crítico.;
26/09/2025;Asia;USDJPY;2025-09-26T00:00:00+00:00;2025-09-25T23:30:00+00:00;1.2.1;0.1041;0.0879;COMPRA;COMPRA;2.5;"Tendência: Alta (Slope EMA20/EMA50 positivos e preço sustentado acima das médias.; Confirmação H1: EMA50 inclinada para cima (+0.5).) | Contexto: Desfavorável (Preço abaixo da VWAP (-1).; Preço acima da EMA50 (+0.5).; Preco esticado > 1.5x ATR distante da EMA50 (-1).) | Impulso: Forte (ADX=33.1 acima de 20 (+2).) | Mitigação: Sem alertas (Volatilidade dentro do intervalo esperado.)";Contexto: preço afastado demais da média (risco de correção).;
26/09/2025;Europe;EURUSD;2025-09-26T07:00:00+00:00;2025-09-26T06:30:00+00:00;1.2.2;0.0968;0.1484;VENDA;FORA;1.0;"Tendência: Neutro (Slopes das EMAs estão próximos de zero (lateral).; Confirmação H1: EMA50 inclinada para baixo (-0.5).) | Contexto: Favorável (Preço acima da VWAP intradiária (+1).; Preço acima da EMA50 (+0.5).) | Impulso: Moderado (ADX=16.3 entre 14-22 (+1).) | Mitigação: Atenção: mercado travado (Candle atual < 0.7x ATR (-1).)";Baixa volatilidade: range < 0.7x ATR.;
25/09/2025;America;XAUUSD;2025-09-25T13:30:00+00:00;2025-09-25T13:15:00+00:00;1.2.3;0.1055;0.0806;COMPRA;FORA;1.0;"Tendência: Alta (Slope EMA20/EMA50 positivos e preço sustentado acima das médias.; Confirmação H1: EMA50 inclinada para baixo (-0.5).) | Contexto: Neutro (Preço abaixo da VWAP (-1).; Preço acima da EMA50 (+0.5).) | Impulso: Fraco (ADX=21.4 abaixo de 22 (0).) | Mitigação: Sem alertas (Volatilidade dentro do intervalo esperado.)";Nenhum alerta crítico.;
25/09/2025;Asia;USDJPY;2025-09-25T00:00:00+00:00;2025-09-24T23:30:00+00:00;1.2.1;0.1065;-0.0521;COMPRA;COMPRA;4.5;"Tendência: Alta (Slope EMA20/EMA50 positivos e preço sustentado acima das médias.; Confirmação H1: EMA50 inclinada para cima (+0.5).) | Contexto: Neutro (Preço acima da VWAP intradiária (+1).; Preço acima da EMA50 (+0.5).; Preco esticado > 1.5x ATR distante da EMA50 (-1).) | Impulso: Forte (ADX=34.0 acima de 20 (+2).) | Mitigação: Sem alertas (Volatilidade dentro do intervalo esperado.)";Contexto: preço afastado demais da média (risco de correção).;
25/09/2025;Europe;EURUSD;2025-09-25T07:00:00+00:00;2025-09-25T06:30:00+00:00;1.2.2;0.1021;0.0938;COMPRA;FORA;0.0;"Tendência: Neutro (Slopes das EMAs estão próximos de zero (lateral).; Confirmação H1: EMA50 inclinada para baixo (-0.5).) | Contexto: Desfavorável (Preço abaixo da VWAP (-1).; Preço abaixo da EMA50 (-0.5).) | Impulso: Forte (ADX=26.7 acima de 22 (+2).) | Mitigação: Sem alertas (Volatilidade dentro do intervalo esperado.)";Nenhum alerta crítico.;
24/09/2025;America;XAUUSD;2025-09-24T13:30:00+00:00;2025-09-24T13:15:00+00:00;1.2.3;-0.9992;0.1075;VENDA;FORA;1.0;"Tendência: Baixa moderada (Tendência de baixa nos slopes, porém preço tenta se manter acima.; Confirmação H1: EMA50 inclinada para cima (+0.5).) | Contexto: Favorável (Preço acima da VWAP intradiária (+1).; Preço acima da EMA50 (+0.5).) | Impulso: Moderado (ADX=26.4 entre 22-30 (+1).) | Mitigação: Atenção: mercado travado (Candle atual < 0.7x ATR (-1).)";Baixa volatilidade: range < 0.7x ATR.;
24/09/2025;Asia;USDJPY;2025-09-24T00:00:00+00:00;2025-09-23T23:30:00+00:00;1.2.1;0.0996;-0.1356;COMPRA;VENDA;-3.5;"Tendência: Baixa (Slope EMA20/EMA50 negativos e preço abaixo das médias.; Confirmação H1: EMA50 inclinada para baixo (-0.5).) | Contexto: Desfavorável (Preço abaixo da VWAP (-1).; Preço abaixo da EMA50 (-0.5).) | Impulso: Fraco (ADX=13.7 abaixo de 15 (0).) | Mitigação: Sem alertas (Volatilidade dentro do intervalo esperado.)";Nenhum alerta crítico.;
24/09/2025;Europe;EURUSD;2025-09-24T07:00:00+00:00;2025-09-24T06:30:00+00:00;1.2.2;-0.858;0.1038;VENDA;FORA;1.5;"Tendência: Neutro (Slopes das EMAs estão próximos de zero (lateral).; Confirmação H1: slope neutro.) | Contexto: Neutro (Preço acima da VWAP intradiária (+1).; Preço abaixo da EMA50 (-0.5).) | Impulso: Moderado (ADX=18.9 entre 14-22 (+1).) | Mitigação: Sem alertas (Volatilidade dentro do intervalo esperado.)";Nenhum alerta crítico.;
23/09/2025;America;XAUUSD;2025-09-23T13:30:00+00:00;2025-09-23T13:15:00+00:00;1.2.3;-0.6332;0.0866;VENDA;FORA;0.0;"Tendência: Alta (Slope EMA20/EMA50 positivos e preço sustentado acima das médias.; Confirmação H1: EMA50 inclinada para cima (+0.5).) | Contexto: Neutro (Preço acima da VWAP intradiária (+1).; Preço acima da EMA50 (+0.5).; Preco esticado > 2.5x ATR distante da EMA50 (-1).; Distancia > 3.0x ATR -> sinal vetado.) | Impulso: Forte (ADX=40.6 acima de 30 (+2).) | Mitigação: Sem alertas (Volatilidade dentro do intervalo esperado.; Mitigação forte: contexto esticado com score elevado. Sinal vetado.)";Contexto: preço afastado demais da média (risco de correção). | Contexto extremo: afastamento excedeu limite configurado. Sinal cancelado. | Sinal vetado por mitigação (preço afastado + score alto).;
23/09/2025;Asia;USDJPY;2025-09-23T00:00:00+00:00;2025-09-22T23:30:00+00:00;1.2.1;0.1119;-0.3451;COMPRA;FORA;0.0;"Tendência: Baixa (Slope EMA20/EMA50 negativos e preço abaixo das médias.; Confirmação H1: EMA50 inclinada para cima (+0.5).) | Contexto: Desfavorável (Preço abaixo da VWAP (-1).; Preço abaixo da EMA50 (-0.5).; Preco esticado > 1.5x ATR distante da EMA50 (-1).) | Impulso: Moderado (ADX=17.7 entre 15-20 (+1).) | Mitigação: Atencao: pavio exagerado (Volatilidade dentro do intervalo esperado.; Pavio exagerado no candle atual (-1).; Mitigação forte: pavio exagerado + preço afastado demais da média. Sinal vetado.)";Contexto: preço afastado demais da média (risco de correção). | Mitigacao: pavio exagerado no candle atual. | Sinal vetado por mitigação (pavio exagerado + preço afastado da média).;
23/09/2025;Europe;EURUSD;2025-09-23T07:00:00+00:00;2025-09-23T06:30:00+00:00;1.2.2;0.0918;0.1107;VENDA;FORA;0.5;"Tendência: Neutro (Slopes das EMAs estão próximos de zero (lateral).; Confirmação H1: slope neutro.) | Contexto: Neutro (Preço abaixo da VWAP (-1).; Preço acima da EMA50 (+0.5).) | Impulso: Moderado (ADX=17.5 entre 14-22 (+1).) | Mitigação: Sem alertas (Volatilidade dentro do intervalo esperado.)";Nenhum alerta crítico.;
22/09/2025;America;XAUUSD;2025-09-22T13:30:00+00:00;2025-09-22T13:15:00+00:00;1.2.3;0.104;0.0852;COMPRA;FORA;0.0;"Tendência: Alta (Slope EMA20/EMA50 positivos e preço sustentado acima das médias.; Confirmação H1: EMA50 inclinada para cima (+0.5).) | Contexto: Neutro (Preço acima da VWAP intradiária (+1).; Preço acima da EMA50 (+0.5).; Preco esticado > 2.5x ATR distante da EMA50 (-1).; Distancia > 3.0x ATR -> sinal vetado.) | Impulso: Forte (ADX=59.6 acima de 30 (+2).) | Mitigação: Sem alertas (Volatilidade dentro do intervalo esperado.; Mitigação forte: contexto esticado com score elevado. Sinal vetado.)";Contexto: preço afastado demais da média (risco de correção). | Contexto extremo: afastamento excedeu limite configurado. Sinal cancelado. | Sinal vetado por mitigação (preço afastado + score alto).;
22/09/2025;Asia;USDJPY;2025-09-22T00:00:00+00:00;2025-09-21T23:30:00+00:00;1.2.1;-0.0747;0.0064;VENDA;FORA;0.5;"Tendência: Alta (Slope EMA20/EMA50 positivos e preço sustentado acima das médias.; Confirmação H1: EMA50 inclinada para cima (+0.5).) | Contexto: Favorável (Preço acima da VWAP intradiária (+1).; Preço acima da EMA50 (+0.5).) | Impulso: Fraco (ADX=10.6 abaixo de 15 (0).) | Mitigação: Risco: volatilidade extrema (Candle atual > 2.0x ATR (-2).; Pavio exagerado no candle atual (-1).)";Volatilidade excessiva detectada (candle > 2.0x ATR). | Mitigacao: pavio exagerado no candle atual.;
22/09/2025;Europe;EURUSD;2025-09-22T07:00:00+00:00;2025-09-22T06:30:00+00:00;1.2.2;0.0949;-0.6317;COMPRA;FORA;-1.0;"Tendência: Neutro (Slopes das EMAs estão próximos de zero (lateral).; Confirmação H1: EMA50 inclinada para baixo (-0.5).) | Contexto: Desfavorável (Preço abaixo da VWAP (-1).; Preço abaixo da EMA50 (-0.5).) | Impulso: Forte (ADX=26.6 acima de 22 (+2).) | Mitigação: Atenção: mercado travado (Candle atual < 0.7x ATR (-1).)";Baixa volatilidade: range < 0.7x ATR.;
19/09/2025;America;XAUUSD;2025-09-19T13:30:00+00:00;2025-09-19T13:15:00+00:00;1.2.3;0.1141;-0.2804;COMPRA;FORA;-1.0;"Tendência: Alta moderada (EMAs apontando para cima, mas preço perdeu uma das médias.; Confirmação H1: EMA50 inclinada para baixo (-0.5).) | Contexto: Desfavorável (Preço abaixo da VWAP (-1).; Preço abaixo da EMA50 (-0.5).) | Impulso: Fraco (ADX=16.0 abaixo de 22 (0).) | Mitigação: Sem alertas (Volatilidade dentro do intervalo esperado.)";Nenhum alerta crítico.;
19/09/2025;Asia;USDJPY;2025-09-19T00:00:00+00:00;2025-09-18T23:30:00+00:00;1.2.1;-0.0631;0.0312;VENDA;COMPRA;3.5;"Tendência: Alta (Slope EMA20/EMA50 positivos e preço sustentado acima das médias.; Confirmação H1: EMA50 inclinada para cima (+0.5).) | Contexto: Neutro (Preço acima da VWAP intradiária (+1).; Preço acima da EMA50 (+0.5).; Preco esticado > 1.5x ATR distante da EMA50 (-1).) | Impulso: Forte (ADX=25.4 acima de 20 (+2).) | Mitigação: Atenção: mercado travado (Candle atual < 0.8x ATR (-1).)";Contexto: preço afastado demais da média (risco de correção). | Baixa volatilidade: range < 0.8x ATR.;
19/09/2025;Europe;EURUSD;2025-09-19T07:00:00+00:00;2025-09-19T06:30:00+00:00;1.2.2;-0.5779;0.0941;VENDA;VENDA;-2.0;"Tendência: Neutro (Slopes das EMAs estão próximos de zero (lateral).; Confirmação H1: EMA50 inclinada para baixo (-0.5).) | Contexto: Desfavorável (Preço abaixo da VWAP (-1).; Preço abaixo da EMA50 (-0.5).) | Impulso: Moderado (ADX=15.3 entre 14-22 (+1).) | Mitigação: Atenção: mercado travado (Candle atual < 0.7x ATR (-1).)";Baixa volatilidade: range < 0.7x ATR.;
18/09/2025;America;XAUUSD;2025-09-18T13:30:00+00:00;2025-09-18T13:15:00+00:00;1.2.3;0.1094;0.0834;COMPRA;COMPRA;4.0;"Tendência: Alta (Slope EMA20/EMA50 positivos e preço sustentado acima das médias.; Confirmação H1: EMA50 inclinada para baixo (-0.5).) | Contexto: Favorável (Preço acima da VWAP intradiária (+1).; Preço acima da EMA50 (+0.5).) | Impulso: Moderado (ADX=24.1 entre 22-30 (+1).) | Mitigação: Sem alertas (Volatilidade dentro do intervalo esperado.)";Nenhum alerta crítico.;
18/09/2025;Asia;USDJPY;2025-09-18T00:00:00+00:00;2025-09-17T23:30:00+00:00;1.2.1;0.1093;-0.1755;COMPRA;COMPRA;2.0;"Tendência: Alta (Slope EMA20/EMA50 positivos e preço sustentado acima das médias.; Confirmação H1: EMA50 inclinada para baixo (-0.5).) | Contexto: Neutro (Preço acima da VWAP intradiária (+1).; Preço acima da EMA50 (+0.5).; Preco esticado > 1.5x ATR distante da EMA50 (-1).) | Impulso: Moderado (ADX=18.1 entre 15-20 (+1).) | Mitigação: Atenção: mercado travado (Candle atual < 0.8x ATR (-1).)";Contexto: preço afastado demais da média (risco de correção). | Baixa volatilidade: range < 0.8x ATR.;
18/09/2025;Europe;EURUSD;2025-09-18T07:00:00+00:00;2025-09-18T06:30:00+00:00;1.2.2;0.1054;0.1249;VENDA;FORA;0.0;"Tendência: Neutro (Slopes das EMAs estão próximos de zero (lateral).; Confirmação H1: slope neutro.) | Contexto: Desfavorável (Preço abaixo da VWAP (-1).; Preço abaixo da EMA50 (-0.5).; Preco esticado > 1.9x ATR distante da EMA50 (-1).; Distancia > 3.0x ATR -> sinal vetado.) | Impulso: Moderado (ADX=15.7 entre 14-22 (+1).) | Mitigação: Sem alertas (Volatilidade dentro do intervalo esperado.)";Contexto: preço afastado demais da média (risco de correção). | Contexto extremo: afastamento excedeu limite configurado. Sinal cancelado.;
17/09/2025;America;XAUUSD;2025-09-17T13:30:00+00:00;2025-09-17T13:15:00+00:00;1.2.3;0.1003;-0.2714;COMPRA;FORA;-1.0;"Tendência: Baixa (Slope EMA20/EMA50 negativos e preço abaixo das médias.; Confirmação H1: EMA50 inclinada para cima (+0.5).) | Contexto: Desfavorável (Preço abaixo da VWAP (-1).; Preço abaixo da EMA50 (-0.5).) | Impulso: Forte (ADX=48.4 acima de 30 (+2).) | Mitigação: Sem alertas (Volatilidade dentro do intervalo esperado.)";Nenhum alerta crítico.;
17/09/2025;Asia;USDJPY;2025-09-17T00:00:00+00:00;2025-09-16T23:30:00+00:00;1.2.1;-0.3023;0.1019;VENDA;FORA;-1.5;"Tendência: Baixa (Slope EMA20/EMA50 negativos e preço abaixo das médias.; Confirmação H1: EMA50 inclinada para baixo (-0.5).) | Contexto: Neutro (Preço acima da VWAP intradiária (+1).; Preço abaixo da EMA50 (-0.5).; Preco esticado > 1.5x ATR distante da EMA50 (-1).) | Impulso: Forte (ADX=23.3 acima de 20 (+2).) | Mitigação: Atenção: mercado travado (Candle atual < 0.8x ATR (-1).)";Contexto: preço afastado demais da média (risco de correção). | Baixa volatilidade: range < 0.8x ATR.;
17/09/2025;Europe;EURUSD;2025-09-17T07:00:00+00:00;2025-09-17T06:30:00+00:00;1.2.2;0.0931;0.095;VENDA;COMPRA;3.0;"Tendência: Neutro (Slopes das EMAs estão próximos de zero (lateral).; Confirmação H1: EMA50 inclinada para cima (+0.5).) | Contexto: Favorável (Preço acima da VWAP intradiária (+1).; Preço acima da EMA50 (+0.5).) | Impulso: Moderado (ADX=19.3 entre 14-22 (+1).) | Mitigação: Sem alertas (Volatilidade dentro do intervalo esperado.)";Nenhum alerta crítico.;
16/09/2025;America;XAUUSD;2025-09-16T13:30:00+00:00;2025-09-16T13:15:00+00:00;1.2.3;0.1092;0.0904;COMPRA;COMPRA;3.5;"Tendência: Alta (Slope EMA20/EMA50 positivos e preço sustentado acima das médias.; Confirmação H1: EMA50 inclinada para cima (+0.5).) | Contexto: Neutro (Preço acima da VWAP intradiária (+1).; Preço acima da EMA50 (+0.5).; Preco esticado > 2.5x ATR distante da EMA50 (-1).) | Impulso: Moderado (ADX=23.2 entre 22-30 (+1).) | Mitigação: Sem alertas (Volatilidade dentro do intervalo esperado.)";Contexto: preço afastado demais da média (risco de correção).;
16/09/2025;Asia;USDJPY;2025-09-16T00:00:00+00:00;2025-09-15T23:30:00+00:00;1.2.1;-0.0633;0.0713;VENDA;FORA;1.0;"Tendência: Neutro (Slopes das EMAs estão próximos de zero (lateral).; Confirmação H1: EMA50 inclinada para baixo (-0.5).) | Contexto: Favorável (Preço acima da VWAP intradiária (+1).; Preço acima da EMA50 (+0.5).) | Impulso: Fraco (ADX=13.6 abaixo de 15 (0).) | Mitigação: Sem alertas (Volatilidade dentro do intervalo esperado.)";Nenhum alerta crítico.;
16/09/2025;Europe;EURUSD;2025-09-16T07:00:00+00:00;2025-09-16T06:30:00+00:00;1.2.2;0.0999;-0.6971;COMPRA;COMPRA;3.0;"Tendência: Neutro (Slopes das EMAs estão próximos de zero (lateral).; Confirmação H1: EMA50 inclinada para cima (+0.5).) | Contexto: Neutro (Preço acima da VWAP intradiária (+1).; Preço acima da EMA50 (+0.5).; Preco esticado > 1.9x ATR distante da EMA50 (-1).) | Impulso: Forte (ADX=29.1 acima de 22 (+2).) | Mitigação: Sem alertas (Volatilidade dentro do intervalo esperado.)";Contexto: preço afastado demais da média (risco de correção).;
15/09/2025;America;XAUUSD;2025-09-15T13:30:00+00:00;2025-09-15T13:15:00+00:00;1.2.3;0.1041;0.0841;COMPRA;COMPRA;2.0;"Tendência: Alta moderada (EMAs apontando para cima, mas preço perdeu uma das médias.; Confirmação H1: EMA50 inclinada para baixo (-0.5).) | Contexto: Favorável (Preço acima da VWAP intradiária (+1).; Preço acima da EMA50 (+0.5).) | Impulso: Fraco (ADX=10.3 abaixo de 22 (0).) | Mitigação: Sem alertas (Volatilidade dentro do intervalo esperado.)";Nenhum alerta crítico.;
15/09/2025;Asia;USDJPY;2025-09-15T00:00:00+00:00;2025-09-14T23:30:00+00:00;1.2.1;0.1022;-0.0719;COMPRA;FORA;-1.0;"Tendência: Baixa moderada (Tendência de baixa nos slopes, porém preço tenta se manter acima.; Confirmação H1: EMA50 inclinada para cima (+0.5).) | Contexto: Favorável (Preço acima da VWAP intradiária (+1).; Preço acima da EMA50 (+0.5).) | Impulso: Moderado (ADX=17.4 entre 15-20 (+1).) | Mitigação: Risco: volatilidade extrema (Candle atual > 2.0x ATR (-2).; Pavio exagerado no candle atual (-1).)";Volatilidade excessiva detectada (candle > 2.0x ATR). | Mitigacao: pavio exagerado no candle atual.;
15/09/2025;Europe;EURUSD;2025-09-15T07:00:00+00:00;2025-09-15T06:30:00+00:00;1.2.2;-0.2567;0.0929;VENDA;COMPRA;2.5;"Tendência: Neutro (Slopes das EMAs estão próximos de zero (lateral).; Confirmação H1: slope neutro.) | Contexto: Favorável (Preço acima da VWAP intradiária (+1).; Preço acima da EMA50 (+0.5).) | Impulso: Moderado (ADX=18.9 entre 14-22 (+1).) | Mitigação: Sem alertas (Volatilidade dentro do intervalo esperado.)";Nenhum alerta crítico.;
12/09/2025;America;XAUUSD;2025-09-12T13:30:00+00:00;2025-09-12T13:15:00+00:00;1.2.3;-0.1015;0.0814;VENDA;COMPRA;2.0;"Tendência: Neutro (Slopes das EMAs estão próximos de zero (lateral).; Confirmação H1: EMA50 inclinada para cima (+0.5).) | Contexto: Favorável (Preço acima da VWAP intradiária (+1).; Preço acima da EMA50 (+0.5).) | Impulso: Fraco (ADX=20.3 abaixo de 22 (0).) | Mitigação: Sem alertas (Volatilidade dentro do intervalo esperado.)";Nenhum alerta crítico.;
12/09/2025;Asia;USDJPY;2025-09-12T00:00:00+00:00;2025-09-11T23:30:00+00:00;1.2.1;0.0298;-0.0602;COMPRA;FORA;-1.5;"Tendência: Baixa (Slope EMA20/EMA50 negativos e preço abaixo das médias.; Confirmação H1: EMA50 inclinada para cima (+0.5).) | Contexto: Desfavorável (Preço abaixo da VWAP (-1).; Preço abaixo da EMA50 (-0.5).; Preco esticado > 1.5x ATR distante da EMA50 (-1).) | Impulso: Forte (ADX=25.2 acima de 20 (+2).) | Mitigação: Sem alertas (Volatilidade dentro do intervalo esperado.)";Contexto: preço afastado demais da média (risco de correção).;
12/09/2025;Europe;EURUSD;2025-09-12T07:00:00+00:00;2025-09-12T06:30:00+00:00;1.2.2;0.1021;-0.4149;COMPRA;FORA;-0.5;"Tendência: Neutro (Slopes das EMAs estão próximos de zero (lateral).; Confirmação H1: slope neutro.) | Contexto: Desfavorável (Preço abaixo da VWAP (-1).; Preço abaixo da EMA50 (-0.5).) | Impulso: Moderado (ADX=18.0 entre 14-22 (+1).) | Mitigação: Sem alertas (Volatilidade dentro do intervalo esperado.)";Nenhum alerta crítico.;
11/09/2025;America;XAUUSD;2025-09-11T13:30:00+00:00;2025-09-11T13:15:00+00:00;1.2.3;0.1013;-0.2853;COMPRA;FORA;0.0;"Tendência: Baixa (Slope EMA20/EMA50 negativos e preço abaixo das médias.; Confirmação H1: EMA50 inclinada para baixo (-0.5).) | Contexto: Desfavorável (Preço abaixo da VWAP (-1).; Preço abaixo da EMA50 (-0.5).; Preco esticado > 2.5x ATR distante da EMA50 (-1).; Distancia > 3.0x ATR -> sinal vetado.) | Impulso: Forte (ADX=31.6 acima de 30 (+2).) | Mitigação: Atenção: mercado travado (Candle atual < 0.7x ATR (-1).)";Contexto: preço afastado demais da média (risco de correção). | Contexto extremo: afastamento excedeu limite configurado. Sinal cancelado. | Baixa volatilidade: range < 0.7x ATR.;
11/09/2025;Asia;USDJPY;2025-09-11T00:00:00+00:00;2025-09-10T23:30:00+00:00;1.2.1;-0.1572;0.0839;VENDA;COMPRA;3.5;"Tendência: Alta (Slope EMA20/EMA50 positivos e preço sustentado acima das médias.; Confirmação H1: EMA50 inclinada para cima (+0.5).) | Contexto: Favorável (Preço acima da VWAP intradiária (+1).; Preço acima da EMA50 (+0.5).) | Impulso: Fraco (ADX=9.5 abaixo de 15 (0).) | Mitigação: Sem alertas (Volatilidade dentro do intervalo esperado.)";Nenhum alerta crítico.;
11/09/2025;Europe;EURUSD;2025-09-11T07:00:00+00:00;2025-09-11T06:30:00+00:00;1.2.2;-0.3599;0.1163;VENDA;FORA;-0.5;"Tendência: Neutro (Slopes das EMAs estão próximos de zero (lateral).; Confirmação H1: slope neutro.) | Contexto: Desfavorável (Preço abaixo da VWAP (-1).; Preço abaixo da EMA50 (-0.5).) | Impulso: Moderado (ADX=14.6 entre 14-22 (+1).) | Mitigação: Sem alertas (Volatilidade dentro do intervalo esperado.)";Nenhum alerta crítico.;
10/09/2025;America;XAUUSD;2025-09-10T13:30:00+00:00;2025-09-10T13:15:00+00:00;1.2.3;0.1001;0.0802;COMPRA;FORA;1.0;"Tendência: Alta moderada (EMAs apontando para cima, mas preço perdeu uma das médias.; Confirmação H1: EMA50 inclinada para cima (+0.5).) | Contexto: Neutro (Preço abaixo da VWAP (-1).; Preço acima da EMA50 (+0.5).) | Impulso: Fraco (ADX=17.4 abaixo de 22 (0).) | Mitigação: Sem alertas (Volatilidade dentro do intervalo esperado.)";Nenhum alerta crítico.;
10/09/2025;Asia;USDJPY;2025-09-10T00:00:00+00:00;2025-09-09T23:30:00+00:00;1.2.1;0.014;0.0809;VENDA;FORA;1.0;"Tendência: Alta (Slope EMA20/EMA50 positivos e preço sustentado acima das médias.; Confirmação H1: EMA50 inclinada para baixo (-0.5).) | Contexto: Desfavorável (Preço abaixo da VWAP (-1).; Preço acima da EMA50 (+0.5).; Preco esticado > 1.5x ATR distante da EMA50 (-1).) | Impulso: Forte (ADX=22.6 acima de 20 (+2).) | Mitigação: Atenção: mercado travado (Candle atual < 0.8x ATR (-1).)";Contexto: preço afastado demais da média (risco de correção). | Baixa volatilidade: range < 0.8x ATR.;
10/09/2025;Europe;EURUSD;2025-09-10T07:00:00+00:00;2025-09-10T06:30:00+00:00;1.2.2;0.1498;0.119;COMPRA;COMPRA;2.5;"Tendência: Neutro (Slopes das EMAs estão próximos de zero (lateral).; Confirmação H1: slope neutro.) | Contexto: Favorável (Preço acima da VWAP intradiária (+1).; Preço acima da EMA50 (+0.5).) | Impulso: Moderado (ADX=18.5 entre 14-22 (+1).) | Mitigação: Sem alertas (Volatilidade dentro do intervalo esperado.)";Nenhum alerta crítico.;
09/09/2025;America;XAUUSD;2025-09-09T13:30:00+00:00;2025-09-09T13:15:00+00:00;1.2.3;0.1063;0.0851;COMPRA;FORA;1.0;"Tendência: Alta moderada (EMAs apontando para cima, mas preço perdeu uma das médias.; Confirmação H1: EMA50 inclinada para cima (+0.5).) | Contexto: Neutro (Preço abaixo da VWAP (-1).; Preço acima da EMA50 (+0.5).) | Impulso: Fraco (ADX=14.2 abaixo de 22 (0).) | Mitigação: Sem alertas (Volatilidade dentro do intervalo esperado.)";Nenhum alerta crítico.;
09/09/2025;Asia;USDJPY;2025-09-09T00:00:00+00:00;2025-09-08T23:30:00+00:00;1.2.1;-0.2419;0.0933;VENDA;VENDA;-3.0;"Tendência: Baixa (Slope EMA20/EMA50 negativos e preço abaixo das médias.; Confirmação H1: EMA50 inclinada para baixo (-0.5).) | Contexto: Desfavorável (Preço abaixo da VWAP (-1).; Preço abaixo da EMA50 (-0.5).; Preco esticado > 1.5x ATR distante da EMA50 (-1).) | Impulso: Forte (ADX=27.9 acima de 20 (+2).) | Mitigação: Atenção: mercado travado (Candle atual < 0.8x ATR (-1).)";Contexto: preço afastado demais da média (risco de correção). | Baixa volatilidade: range < 0.8x ATR.;
09/09/2025;Europe;EURUSD;2025-09-09T07:00:00+00:00;2025-09-09T06:30:00+00:00;1.2.2;0.0912;0.1235;VENDA;COMPRA;2.0;"Tendência: Neutro (Slopes das EMAs estão próximos de zero (lateral).; Confirmação H1: EMA50 inclinada para cima (+0.5).) | Contexto: Neutro (Preço acima da VWAP intradiária (+1).; Preço acima da EMA50 (+0.5).; Preco esticado > 1.9x ATR distante da EMA50 (-1).) | Impulso: Moderado (ADX=19.2 entre 14-22 (+1).) | Mitigação: Sem alertas (Volatilidade dentro do intervalo esperado.)";Contexto: preço afastado demais da média (risco de correção).;
08/09/2025;America;XAUUSD;2025-09-08T13:30:00+00:00;2025-09-08T13:15:00+00:00;1.2.3;0.1003;-0.6608;COMPRA;FORA;0.0;"Tendência: Alta (Slope EMA20/EMA50 positivos e preço sustentado acima das médias.; Confirmação H1: EMA50 inclinada para cima (+0.5).) | Contexto: Neutro (Preço acima da VWAP intradiária (+1).; Preço acima da EMA50 (+0.5).; Preco esticado > 2.5x ATR distante da EMA50 (-1).; Distancia > 3.0x ATR -> sinal vetado.) | Impulso: Forte (ADX=45.2 acima de 30 (+2).) | Mitigação: Sem alertas (Volatilidade dentro do intervalo esperado.; Mitigação forte: contexto esticado com score elevado. Sinal vetado.)";Contexto: preço afastado demais da média (risco de correção). | Contexto extremo: afastamento excedeu limite configurado. Sinal cancelado. | Sinal vetado por mitigação (preço afastado + score alto).;
08/09/2025;Asia;USDJPY;2025-09-08T00:00:00+00:00;2025-09-07T23:30:00+00:00;1.2.1;-0.0839;0.0822;VENDA;COMPRA;2.0;"Tendência: Alta (Slope EMA20/EMA50 positivos e preço sustentado acima das médias.; Confirmação H1: EMA50 inclinada para baixo (-0.5).) | Contexto: Neutro (Preço acima da VWAP intradiária (+1).; Preço acima da EMA50 (+0.5).; Preco esticado > 1.5x ATR distante da EMA50 (-1).) | Impulso: Forte (ADX=30.7 acima de 20 (+2).) | Mitigação: Risco: volatilidade extrema (Candle atual > 2.0x ATR (-2).)";Contexto: preço afastado demais da média (risco de correção). | Volatilidade excessiva detectada (candle > 2.0x ATR).;
08/09/2025;Europe;EURUSD;2025-09-08T07:00:00+00:00;2025-09-08T06:30:00+00:00;1.2.2;0.0919;0.1092;VENDA;COMPRA;3.0;"Tendência: Neutro (Slopes das EMAs estão próximos de zero (lateral).; Confirmação H1: EMA50 inclinada para cima (+0.5).) | Contexto: Favorável (Preço acima da VWAP intradiária (+1).; Preço acima da EMA50 (+0.5).) | Impulso: Moderado (ADX=14.7 entre 14-22 (+1).) | Mitigação: Sem alertas (Volatilidade dentro do intervalo esperado.)";Nenhum alerta crítico.;
05/09/2025;America;XAUUSD;2025-09-05T13:30:00+00:00;2025-09-05T13:15:00+00:00;1.2.3;0.132;0.1034;COMPRA;FORA;0.0;"Tendência: Baixa moderada (Tendência de baixa nos slopes, porém preço tenta se manter acima.; Confirmação H1: EMA50 inclinada para cima (+0.5).) | Contexto: Favorável (Preço acima da VWAP intradiária (+1).; Preço acima da EMA50 (+0.5).) | Impulso: Fraco (ADX=18.3 abaixo de 22 (0).) | Mitigação: Atencao: pavio exagerado (Volatilidade dentro do intervalo esperado.; Pavio exagerado no candle atual (-1).)";Mitigacao: pavio exagerado no candle atual.;
05/09/2025;Asia;USDJPY;2025-09-05T00:00:00+00:00;2025-09-04T23:30:00+00:00;1.2.1;0.118;0.0818;COMPRA;FORA;0.0;"Tendência: Neutro (Slopes das EMAs estão próximos de zero (lateral).; Confirmação H1: EMA50 inclinada para cima (+0.5).) | Contexto: Neutro (Preço abaixo da VWAP (-1).; Preço acima da EMA50 (+0.5).) | Impulso: Fraco (ADX=14.8 abaixo de 15 (0).) | Mitigação: Sem alertas (Volatilidade dentro do intervalo esperado.)";Nenhum alerta crítico.;
05/09/2025;Europe;EURUSD;2025-09-05T07:00:00+00:00;2025-09-05T06:30:00+00:00;1.2.2;0.0918;0.1673;VENDA;COMPRA;2.5;"Tendência: Neutro (Slopes das EMAs estão próximos de zero (lateral).; Confirmação H1: slope neutro.) | Contexto: Neutro (Preço acima da VWAP intradiária (+1).; Preço acima da EMA50 (+0.5).; Preco esticado > 1.9x ATR distante da EMA50 (-1).) | Impulso: Forte (ADX=27.9 acima de 22 (+2).) | Mitigação: Sem alertas (Volatilidade dentro do intervalo esperado.)";Contexto: preço afastado demais da média (risco de correção).;
04/09/2025;America;XAUUSD;2025-09-04T13:30:00+00:00;2025-09-04T13:15:00+00:00;1.2.3;0.1014;0.0861;COMPRA;COMPRA;2.0;"Tendência: Neutro (Slopes das EMAs estão próximos de zero (lateral).; Confirmação H1: EMA50 inclinada para cima (+0.5).) | Contexto: Favorável (Preço acima da VWAP intradiária (+1).; Preço acima da EMA50 (+0.5).) | Impulso: Fraco (ADX=17.5 abaixo de 22 (0).) | Mitigação: Sem alertas (Volatilidade dentro do intervalo esperado.)";Nenhum alerta crítico.;
04/09/2025;Asia;USDJPY;2025-09-04T00:00:00+00:00;2025-09-03T23:30:00+00:00;1.2.1;0.1014;-0.1061;COMPRA;FORA;1.0;"Tendência: Baixa moderada (Tendência de baixa nos slopes, porém preço tenta se manter acima.; Confirmação H1: EMA50 inclinada para cima (+0.5).) | Contexto: Neutro (Preço acima da VWAP intradiária (+1).; Preço abaixo da EMA50 (-0.5).) | Impulso: Moderado (ADX=17.1 entre 15-20 (+1).) | Mitigação: Sem alertas (Volatilidade dentro do intervalo esperado.)";Nenhum alerta crítico.;
04/09/2025;Europe;EURUSD;2025-09-04T07:00:00+00:00;2025-09-04T06:30:00+00:00;1.2.2;0.1037;0.0972;COMPRA;FORA;-0.5;"Tendência: Neutro (Slopes das EMAs estão próximos de zero (lateral).; Confirmação H1: slope neutro.) | Contexto: Desfavorável (Preço abaixo da VWAP (-1).; Preço abaixo da EMA50 (-0.5).) | Impulso: Moderado (ADX=17.0 entre 14-22 (+1).) | Mitigação: Sem alertas (Volatilidade dentro do intervalo esperado.)";Nenhum alerta crítico.;
03/09/2025;America;XAUUSD;2025-09-03T13:30:00+00:00;2025-09-03T13:15:00+00:00;1.2.3;0.1036;0.0837;COMPRA;COMPRA;2.5;"Tendência: Alta (Slope EMA20/EMA50 positivos e preço sustentado acima das médias.; Confirmação H1: EMA50 inclinada para cima (+0.5).) | Contexto: Neutro (Preço acima da VWAP intradiária (+1).; Preço acima da EMA50 (+0.5).; Preco esticado > 2.5x ATR distante da EMA50 (-1).) | Impulso: Fraco (ADX=17.7 abaixo de 22 (0).) | Mitigação: Sem alertas (Volatilidade dentro do intervalo esperado.)";Contexto: preço afastado demais da média (risco de correção).;
03/09/2025;Asia;USDJPY;2025-09-03T00:00:00+00:00;2025-09-02T23:30:00+00:00;1.2.1;0.1047;0.1516;VENDA;FORA;1.5;"Tendência: Alta (Slope EMA20/EMA50 positivos e preço sustentado acima das médias.; Confirmação H1: EMA50 inclinada para cima (+0.5).) | Contexto: Neutro (Preço abaixo da VWAP (-1).; Preço acima da EMA50 (+0.5).) | Impulso: Fraco (ADX=11.9 abaixo de 15 (0).) | Mitigação: Sem alertas (Volatilidade dentro do intervalo esperado.)";Nenhum alerta crítico.;
03/09/2025;Europe;EURUSD;2025-09-03T07:00:00+00:00;2025-09-03T06:30:00+00:00;1.2.2;0.0972;-0.0778;COMPRA;FORA;1.0;"Tendência: Neutro (Slopes das EMAs estão próximos de zero (lateral).; Confirmação H1: EMA50 inclinada para baixo (-0.5).) | Contexto: Neutro (Preço acima da VWAP intradiária (+1).; Preço abaixo da EMA50 (-0.5).) | Impulso: Moderado (ADX=18.9 entre 14-22 (+1).) | Mitigação: Sem alertas (Volatilidade dentro do intervalo esperado.)";Nenhum alerta crítico.;
