Date,Region,Symbol,Version,SessionUTC,AnalysisUTC,BacktestVies,BacktestScore,LiveLikeVies,LiveLikeScore,SameVies,ScoreDelta,LastM15_BT,LastM15_LIVE,SameLastM15,Source_BT,Source_LIVE,Error
05/12/2025,America,XAUUSD,1.0.3,2025-12-05T13:30:00+00:00,2025-12-05T13:15:00+00:00,VENDA,-5.5,VENDA,-5.5,True,0.0,2025-12-05T13:00:00+00:00,2025-12-05T13:00:00+00:00,True,db,db,
05/12/2025,America,XAUUSD,1.2.3,2025-12-05T13:30:00+00:00,2025-12-05T13:15:00+00:00,VENDA,-3.5,VENDA,-3.5,True,0.0,2025-12-05T13:00:00+00:00,2025-12-05T13:00:00+00:00,True,db,db,
05/12/2025,Asia,USDJPY,1.2.1,2025-12-05T00:00:00+00:00,2025-12-04T23:30:00+00:00,FORA,0.0,FORA,0.0,True,0.0,2025-12-04T23:15:00+00:00,2025-12-04T23:15:00+00:00,True,db,db,
05/12/2025,Asia,USDJPY,1.0.1,2025-12-05T00:00:00+00:00,2025-12-04T23:30:00+00:00,FORA,0.0,FORA,0.0,True,0.0,2025-12-04T23:15:00+00:00,2025-12-04T23:15:00+00:00,True,db,db,
05/12/2025,Europe,EURUSD,1.2.2,2025-12-05T07:00:00+00:00,2025-12-05T06:45:00+00:00,VENDA,-1.0,VENDA,-1.0,True,0.0,2025-12-05T06:30:00+00:00,2025-12-05T06:30:00+00:00,True,db,db,
04/12/2025,America,XAUUSD,1.2.3,2025-12-04T13:30:00+00:00,2025-12-04T13:15:00+00:00,FORA,0.0,FORA,0.0,True,0.0,2025-12-04T13:00:00+00:00,2025-12-04T13:00:00+00:00,True,db,db,
04/12/2025,America,XAUUSD,1.0.3,2025-12-04T13:30:00+00:00,2025-12-04T13:15:00+00:00,VENDA,-2.0,VENDA,-2.0,True,0.0,2025-12-04T13:00:00+00:00,2025-12-04T13:00:00+00:00,True,db,db,
04/12/2025,Asia,USDJPY,1.0.1,2025-12-04T00:00:00+00:00,2025-12-03T23:30:00+00:00,FORA,0.0,FORA,0.0,True,0.0,2025-12-03T23:15:00+00:00,2025-12-03T23:15:00+00:00,True,db,db,
04/12/2025,Asia,USDJPY,1.2.1,2025-12-04T00:00:00+00:00,2025-12-03T23:30:00+00:00,FORA,0.0,FORA,0.0,True,0.0,2025-12-03T23:15:00+00:00,2025-12-03T23:15:00+00:00,True,db,db,
04/12/2025,Europe,EURUSD,1.2.2,2025-12-04T07:00:00+00:00,2025-12-04T06:45:00+00:00,FORA,0.0,FORA,0.0,True,0.0,2025-12-04T06:30:00+00:00,2025-12-04T06:30:00+00:00,True,db,db,
03/12/2025,America,XAUUSD,1.2.3,2025-12-03T13:30:00+00:00,2025-12-03T13:15:00+00:00,FORA,0.0,FORA,0.0,True,0.0,2025-12-03T13:00:00+00:00,2025-12-03T13:00:00+00:00,True,db,db,
03/12/2025,America,XAUUSD,1.0.3,2025-12-03T13:30:00+00:00,2025-12-03T13:15:00+00:00,FORA,0.0,FORA,0.0,True,0.0,2025-12-03T13:00:00+00:00,2025-12-03T13:00:00+00:00,True,db,db,
03/12/2025,Asia,USDJPY,1.0.1,2025-12-03T00:00:00+00:00,2025-12-02T23:30:00+00:00,FORA,0.0,FORA,0.0,True,0.0,2025-12-02T23:15:00+00:00,2025-12-02T23:15:00+00:00,True,db,db,
03/12/2025,Asia,USDJPY,1.2.1,2025-12-03T00:00:00+00:00,2025-12-02T23:30:00+00:00,FORA,0.0,FORA,0.0,True,0.0,2025-12-02T23:15:00+00:00,2025-12-02T23:15:00+00:00,True,db,db,
03/12/2025,Europe,EURUSD,1.2.2,2025-12-03T07:00:00+00:00,2025-12-03T06:45:00+00:00,FORA,0.5,FORA,0.5,True,0.0,2025-12-03T06:30:00+00:00,2025-12-03T06:30:00+00:00,True,db,db,
02/12/2025,America,XAUUSD,1.0.3,2025-12-02T13:30:00+00:00,2025-12-02T13:15:00+00:00,VENDA,-1.0,VENDA,-1.0,True,0.0,2025-12-02T13:00:00+00:00,2025-12-02T13:00:00+00:00,True,db,db,
02/12/2025,America,XAUUSD,1.2.3,2025-12-02T13:30:00+00:00,2025-12-02T13:15:00+00:00,FORA,-1.0,FORA,-1.0,True,0.0,2025-12-02T13:00:00+00:00,2025-12-02T13:00:00+00:00,True,db,db,
02/12/2025,Asia,USDJPY,1.0.1,2025-12-02T00:00:00+00:00,2025-12-01T23:30:00+00:00,COMPRA,2.0,COMPRA,2.0,True,0.0,2025-12-01T23:15:00+00:00,2025-12-01T23:15:00+00:00,True,db,db,
02/12/2025,Asia,USDJPY,1.2.1,2025-12-02T00:00:00+00:00,2025-12-01T23:30:00+00:00,COMPRA,1.0,COMPRA,1.0,True,0.0,2025-12-01T23:15:00+00:00,2025-12-01T23:15:00+00:00,True,db,db,
02/12/2025,Europe,EURUSD,1.2.2,2025-12-02T07:00:00+00:00,2025-12-02T06:45:00+00:00,VENDA,-2.0,VENDA,-2.0,True,0.0,2025-12-02T06:30:00+00:00,2025-12-02T06:30:00+00:00,True,db,db,
01/12/2025,America,XAUUSD,1.2.3,2025-12-01T13:30:00+00:00,2025-12-01T13:15:00+00:00,COMPRA,2.5,COMPRA,2.5,True,0.0,2025-12-01T13:00:00+00:00,2025-12-01T13:00:00+00:00,True,db,db,
01/12/2025,America,XAUUSD,1.0.3,2025-12-01T13:30:00+00:00,2025-12-01T13:15:00+00:00,COMPRA,2.5,COMPRA,2.5,True,0.0,2025-12-01T13:00:00+00:00,2025-12-01T13:00:00+00:00,True,db,db,
01/12/2025,Asia,USDJPY,1.2.1,2025-12-01T00:00:00+00:00,2025-11-30T23:30:00+00:00,VENDA,-1.5,VENDA,-1.5,True,0.0,2025-11-28T23:45:00+00:00,2025-11-28T23:45:00+00:00,True,db,db,
01/12/2025,Asia,USDJPY,1.0.1,2025-12-01T00:00:00+00:00,2025-11-30T23:30:00+00:00,VENDA,-3.5,VENDA,-3.5,True,0.0,2025-11-28T23:45:00+00:00,2025-11-28T23:45:00+00:00,True,db,db,
01/12/2025,Europe,EURUSD,1.2.2,2025-12-01T07:00:00+00:00,2025-12-01T06:45:00+00:00,COMPRA,1.5,COMPRA,1.5,True,0.0,2025-12-01T06:30:00+00:00,2025-12-01T06:30:00+00:00,True,db,db,
28/11/2025,America,XAUUSD,1.0.3,2025-11-28T13:30:00+00:00,2025-11-28T13:15:00+00:00,FORA,0.0,FORA,0.0,True,0.0,2025-11-28T13:00:00+00:00,2025-11-28T13:00:00+00:00,True,db,db,
28/11/2025,America,XAUUSD,1.2.3,2025-11-28T13:30:00+00:00,2025-11-28T13:15:00+00:00,COMPRA,2.0,COMPRA,2.0,True,0.0,2025-11-28T13:00:00+00:00,2025-11-28T13:00:00+00:00,True,db,db,
28/11/2025,Asia,USDJPY,1.2.1,2025-11-28T00:00:00+00:00,2025-11-27T23:30:00+00:00,VENDA,-2.0,VENDA,-2.0,True,0.0,2025-11-27T23:15:00+00:00,2025-11-27T23:15:00+00:00,True,db,db,
28/11/2025,Asia,USDJPY,1.0.1,2025-11-28T00:00:00+00:00,2025-11-27T23:30:00+00:00,VENDA,-4.0,VENDA,-4.0,True,0.0,2025-11-27T23:15:00+00:00,2025-11-27T23:15:00+00:00,True,db,db,
28/11/2025,Europe,EURUSD,1.2.2,2025-11-28T07:00:00+00:00,2025-11-28T06:45:00+00:00,FORA,0.5,FORA,0.5,True,0.0,2025-11-28T06:30:00+00:00,2025-11-28T06:30:00+00:00,True,db,db,
27/11/2025,America,XAUUSD,1.2.3,2025-11-27T13:30:00+00:00,2025-11-27T13:15:00+00:00,FORA,1.5,FORA,1.5,True,0.0,2025-11-27T13:00:00+00:00,2025-11-27T13:00:00+00:00,True,db,db,
27/11/2025,Asia,USDJPY,1.2.1,2025-11-27T00:00:00+00:00,2025-11-26T23:30:00+00:00,VENDA,-2.0,VENDA,-2.0,True,0.0,2025-11-26T23:15:00+00:00,2025-11-26T23:15:00+00:00,True,db,db,
27/11/2025,Asia,USDJPY,1.0.1,2025-11-27T00:00:00+00:00,2025-11-26T23:30:00+00:00,VENDA,-2.0,VENDA,-2.0,True,0.0,2025-11-26T23:15:00+00:00,2025-11-26T23:15:00+00:00,True,db,db,
27/11/2025,Europe,EURUSD,1.2.2,2025-11-27T07:00:00+00:00,2025-11-27T06:45:00+00:00,VENDA,-2.0,VENDA,-2.0,True,0.0,2025-11-27T06:30:00+00:00,2025-11-27T06:30:00+00:00,True,db,db,
26/11/2025,America,XAUUSD,1.0.3,2025-11-26T13:30:00+00:00,2025-11-26T13:15:00+00:00,COMPRA,1.5,COMPRA,1.5,True,0.0,2025-11-26T13:00:00+00:00,2025-11-26T13:00:00+00:00,True,db,db,
26/11/2025,America,XAUUSD,1.2.3,2025-11-26T13:30:00+00:00,2025-11-26T13:15:00+00:00,FORA,0.5,FORA,0.5,True,0.0,2025-11-26T13:00:00+00:00,2025-11-26T13:00:00+00:00,True,db,db,
26/11/2025,Asia,USDJPY,1.2.1,2025-11-26T00:00:00+00:00,2025-11-25T23:30:00+00:00,VENDA,-2.0,VENDA,-2.0,True,0.0,2025-11-25T23:15:00+00:00,2025-11-25T23:15:00+00:00,True,db,db,
26/11/2025,Europe,EURUSD,1.2.2,2025-11-26T07:00:00+00:00,2025-11-26T06:45:00+00:00,FORA,0.0,FORA,0.0,True,0.0,2025-11-26T06:30:00+00:00,2025-11-26T06:30:00+00:00,True,db,db,
26/11/2025,Europe,EURUSD,1.0.2,2025-11-26T07:00:00+00:00,2025-11-26T06:45:00+00:00,FORA,0.0,FORA,0.0,True,0.0,2025-11-26T06:30:00+00:00,2025-11-26T06:30:00+00:00,True,db,db,
25/11/2025,America,XAUUSD,1.0.3,2025-11-25T13:30:00+00:00,2025-11-25T13:15:00+00:00,COMPRA,2.0,COMPRA,2.0,True,0.0,2025-11-25T13:00:00+00:00,2025-11-25T13:00:00+00:00,True,db,db,
25/11/2025,America,XAUUSD,1.2.3,2025-11-25T13:30:00+00:00,2025-11-25T13:15:00+00:00,COMPRA,2.0,COMPRA,2.0,True,0.0,2025-11-25T13:00:00+00:00,2025-11-25T13:00:00+00:00,True,db,db,
25/11/2025,Asia,USDJPY,1.2.1,2025-11-25T00:00:00+00:00,2025-11-24T23:30:00+00:00,COMPRA,2.0,COMPRA,2.0,True,0.0,2025-11-24T23:15:00+00:00,2025-11-24T23:15:00+00:00,True,db,db,
25/11/2025,Asia,USDJPY,1.0.1,2025-11-25T00:00:00+00:00,2025-11-24T23:30:00+00:00,COMPRA,3.0,COMPRA,3.0,True,0.0,2025-11-24T23:15:00+00:00,2025-11-24T23:15:00+00:00,True,db,db,
25/11/2025,Europe,EURUSD,1.2.2,2025-11-25T07:00:00+00:00,2025-11-25T06:45:00+00:00,VENDA,-2.5,VENDA,-2.5,True,0.0,2025-11-25T06:30:00+00:00,2025-11-25T06:30:00+00:00,True,db,db,
25/11/2025,Europe,EURUSD,1.0.2,2025-11-25T07:00:00+00:00,2025-11-25T06:45:00+00:00,FORA,-0.5,FORA,-0.5,True,0.0,2025-11-25T06:30:00+00:00,2025-11-25T06:30:00+00:00,True,db,db,
24/11/2025,America,XAUUSD,1.0.3,2025-11-24T13:30:00+00:00,2025-11-24T13:15:00+00:00,COMPRA,2.0,COMPRA,2.0,True,0.0,2025-11-24T13:00:00+00:00,2025-11-24T13:00:00+00:00,True,db,db,
24/11/2025,America,XAUUSD,1.2.3,2025-11-24T13:30:00+00:00,2025-11-24T13:15:00+00:00,COMPRA,2.0,COMPRA,2.0,True,0.0,2025-11-24T13:00:00+00:00,2025-11-24T13:00:00+00:00,True,db,db,
24/11/2025,Asia,USDJPY,1.2.1,2025-11-24T00:00:00+00:00,2025-11-23T23:30:00+00:00,VENDA,-3.0,VENDA,-3.0,True,0.0,2025-11-21T23:45:00+00:00,2025-11-21T23:45:00+00:00,True,db,db,
24/11/2025,Asia,USDJPY,1.0.1,2025-11-24T00:00:00+00:00,2025-11-23T23:30:00+00:00,VENDA,-5.0,VENDA,-5.0,True,0.0,2025-11-21T23:45:00+00:00,2025-11-21T23:45:00+00:00,True,db,db,
24/11/2025,Europe,EURUSD,1.2.2,2025-11-24T07:00:00+00:00,2025-11-24T06:45:00+00:00,FORA,0.5,FORA,0.5,True,0.0,2025-11-24T06:30:00+00:00,2025-11-24T06:30:00+00:00,True,db,db,
24/11/2025,Europe,EURUSD,1.0.2,2025-11-24T07:00:00+00:00,2025-11-24T06:45:00+00:00,COMPRA,1.5,COMPRA,1.5,True,0.0,2025-11-24T06:30:00+00:00,2025-11-24T06:30:00+00:00,True,db,db,
21/11/2025,America,XAUUSD,1.2.3,2025-11-21T13:30:00+00:00,2025-11-21T13:15:00+00:00,VENDA,-3.5,VENDA,-3.5,True,0.0,2025-11-21T13:00:00+00:00,2025-11-21T13:00:00+00:00,True,db,db,
21/11/2025,America,XAUUSD,1.0.3,2025-11-21T13:30:00+00:00,2025-11-21T13:15:00+00:00,VENDA,-5.5,VENDA,-5.5,True,0.0,2025-11-21T13:00:00+00:00,2025-11-21T13:00:00+00:00,True,db,db,
21/11/2025,Asia,USDJPY,1.2.1,2025-11-21T00:00:00+00:00,2025-11-20T23:30:00+00:00,COMPRA,1.0,COMPRA,1.0,True,0.0,2025-11-20T23:15:00+00:00,2025-11-20T23:15:00+00:00,True,db,db,
21/11/2025,Asia,USDJPY,1.0.1,2025-11-21T00:00:00+00:00,2025-11-20T23:30:00+00:00,COMPRA,1.0,COMPRA,1.0,True,0.0,2025-11-20T23:15:00+00:00,2025-11-20T23:15:00+00:00,True,db,db,
21/11/2025,Europe,EURUSD,1.2.2,2025-11-21T07:00:00+00:00,2025-11-21T06:45:00+00:00,VENDA,-2.0,VENDA,-2.0,True,0.0,2025-11-21T06:30:00+00:00,2025-11-21T06:30:00+00:00,True,db,db,
21/11/2025,Europe,EURUSD,1.0.2,2025-11-21T07:00:00+00:00,2025-11-21T06:45:00+00:00,VENDA,-2.0,VENDA,-2.0,True,0.0,2025-11-21T06:30:00+00:00,2025-11-21T06:30:00+00:00,True,db,db,
20/11/2025,America,XAUUSD,1.0.3,2025-11-20T13:30:00+00:00,2025-11-20T13:15:00+00:00,FORA,0.0,FORA,0.0,True,0.0,2025-11-20T13:00:00+00:00,2025-11-20T13:00:00+00:00,True,db,db,
20/11/2025,America,XAUUSD,1.2.3,2025-11-20T13:30:00+00:00,2025-11-20T13:15:00+00:00,VENDA,-3.5,VENDA,-3.5,True,0.0,2025-11-20T13:00:00+00:00,2025-11-20T13:00:00+00:00,True,db,db,
20/11/2025,Asia,USDJPY,1.0.1,2025-11-20T00:00:00+00:00,2025-11-19T23:30:00+00:00,FORA,0.0,FORA,0.0,True,0.0,2025-11-19T23:15:00+00:00,2025-11-19T23:15:00+00:00,True,db,db,
20/11/2025,Asia,USDJPY,1.2.1,2025-11-20T00:00:00+00:00,2025-11-19T23:30:00+00:00,FORA,0.0,FORA,0.0,True,0.0,2025-11-19T23:15:00+00:00,2025-11-19T23:15:00+00:00,True,db,db,
20/11/2025,Europe,EURUSD,1.2.2,2025-11-20T07:00:00+00:00,2025-11-20T06:45:00+00:00,FORA,0.0,FORA,0.0,True,0.0,2025-11-20T06:30:00+00:00,2025-11-20T06:30:00+00:00,True,db,db,
20/11/2025,Europe,EURUSD,1.0.2,2025-11-20T07:00:00+00:00,2025-11-20T06:45:00+00:00,FORA,0.0,FORA,0.0,True,0.0,2025-11-20T06:30:00+00:00,2025-11-20T06:30:00+00:00,True,db,db,
19/11/2025,America,XAUUSD,1.2.3,2025-11-19T13:30:00+00:00,2025-11-19T13:15:00+00:00,FORA,0.0,FORA,0.0,True,0.0,2025-11-19T13:00:00+00:00,2025-11-19T13:00:00+00:00,True,db,db,
19/11/2025,America,XAUUSD,1.0.3,2025-11-19T13:30:00+00:00,2025-11-19T13:15:00+00:00,FORA,0.0,FORA,0.0,True,0.0,2025-11-19T13:00:00+00:00,2025-11-19T13:00:00+00:00,True,db,db,
19/11/2025,Asia,USDJPY,1.0.1,2025-11-19T00:00:00+00:00,2025-11-18T23:30:00+00:00,FORA,0.5,FORA,0.5,True,0.0,2025-11-18T23:15:00+00:00,2025-11-18T23:15:00+00:00,True,db,db,
19/11/2025,Asia,USDJPY,1.2.1,2025-11-19T00:00:00+00:00,2025-11-18T23:30:00+00:00,FORA,0.5,FORA,0.5,True,0.0,2025-11-18T23:15:00+00:00,2025-11-18T23:15:00+00:00,True,db,db,
19/11/2025,Europe,EURUSD,1.2.2,2025-11-19T07:00:00+00:00,2025-11-19T06:45:00+00:00,FORA,-0.5,FORA,-0.5,True,0.0,2025-11-19T06:30:00+00:00,2025-11-19T06:30:00+00:00,True,db,db,
19/11/2025,Europe,EURUSD,1.0.2,2025-11-19T07:00:00+00:00,2025-11-19T06:45:00+00:00,FORA,0.5,FORA,0.5,True,0.0,2025-11-19T06:30:00+00:00,2025-11-19T06:30:00+00:00,True,db,db,
18/11/2025,America,XAUUSD,1.0.3,2025-11-18T13:30:00+00:00,2025-11-18T13:15:00+00:00,COMPRA,1.0,COMPRA,1.0,True,0.0,2025-11-18T13:00:00+00:00,2025-11-18T13:00:00+00:00,True,db,db,
18/11/2025,America,XAUUSD,1.2.3,2025-11-18T13:30:00+00:00,2025-11-18T13:15:00+00:00,FORA,1.0,FORA,1.0,True,0.0,2025-11-18T13:00:00+00:00,2025-11-18T13:00:00+00:00,True,db,db,
18/11/2025,Asia,USDJPY,1.2.1,2025-11-18T00:00:00+00:00,2025-11-17T23:30:00+00:00,FORA,0.0,FORA,0.0,True,0.0,2025-11-17T23:15:00+00:00,2025-11-17T23:15:00+00:00,True,db,db,
18/11/2025,Asia,USDJPY,1.0.1,2025-11-18T00:00:00+00:00,2025-11-17T23:30:00+00:00,FORA,0.0,FORA,0.0,True,0.0,2025-11-17T23:15:00+00:00,2025-11-17T23:15:00+00:00,True,db,db,
18/11/2025,Europe,EURUSD,1.2.2,2025-11-18T07:00:00+00:00,2025-11-18T06:45:00+00:00,VENDA,-2.0,VENDA,-2.0,True,0.0,2025-11-18T06:30:00+00:00,2025-11-18T06:30:00+00:00,True,db,db,
18/11/2025,Europe,EURUSD,1.0.2,2025-11-18T07:00:00+00:00,2025-11-18T06:45:00+00:00,VENDA,-4.0,VENDA,-4.0,True,0.0,2025-11-18T06:30:00+00:00,2025-11-18T06:30:00+00:00,True,db,db,
17/11/2025,America,XAUUSD,1.0.3,2025-11-17T13:30:00+00:00,2025-11-17T13:15:00+00:00,VENDA,-4.5,VENDA,-4.5,True,0.0,2025-11-17T13:00:00+00:00,2025-11-17T13:00:00+00:00,True,db,db,
17/11/2025,America,XAUUSD,1.2.3,2025-11-17T13:30:00+00:00,2025-11-17T13:15:00+00:00,VENDA,-2.5,VENDA,-2.5,True,0.0,2025-11-17T13:00:00+00:00,2025-11-17T13:00:00+00:00,True,db,db,
17/11/2025,Asia,USDJPY,1.0.1,2025-11-17T00:00:00+00:00,2025-11-16T23:30:00+00:00,VENDA,-2.0,VENDA,-2.0,True,0.0,2025-11-14T23:45:00+00:00,2025-11-14T23:45:00+00:00,True,db,db,
17/11/2025,Asia,USDJPY,1.2.1,2025-11-17T00:00:00+00:00,2025-11-16T23:30:00+00:00,FORA,0.0,FORA,0.0,True,0.0,2025-11-14T23:45:00+00:00,2025-11-14T23:45:00+00:00,True,db,db,
17/11/2025,Europe,EURUSD,1.2.2,2025-11-17T07:00:00+00:00,2025-11-17T06:45:00+00:00,FORA,0.0,FORA,0.0,True,0.0,2025-11-17T06:30:00+00:00,2025-11-17T06:30:00+00:00,True,db,db,
17/11/2025,Europe,EURUSD,1.0.2,2025-11-17T07:00:00+00:00,2025-11-17T06:45:00+00:00,FORA,0.0,FORA,0.0,True,0.0,2025-11-17T06:30:00+00:00,2025-11-17T06:30:00+00:00,True,db,db,
14/11/2025,America,XAUUSD,1.0.3,2025-11-14T13:30:00+00:00,2025-11-14T13:15:00+00:00,FORA,0.0,FORA,0.0,True,0.0,2025-11-14T13:00:00+00:00,2025-11-14T13:00:00+00:00,True,db,db,
14/11/2025,America,XAUUSD,1.2.3,2025-11-14T13:30:00+00:00,2025-11-14T13:15:00+00:00,FORA,0.0,FORA,0.0,True,0.0,2025-11-14T13:00:00+00:00,2025-11-14T13:00:00+00:00,True,db,db,
14/11/2025,Asia,USDJPY,1.2.1,2025-11-14T00:00:00+00:00,2025-11-13T23:30:00+00:00,COMPRA,2.0,COMPRA,2.0,True,0.0,2025-11-13T23:15:00+00:00,2025-11-13T23:15:00+00:00,True,db,db,
14/11/2025,Asia,USDJPY,1.0.1,2025-11-14T00:00:00+00:00,2025-11-13T23:30:00+00:00,COMPRA,2.0,COMPRA,2.0,True,0.0,2025-11-13T23:15:00+00:00,2025-11-13T23:15:00+00:00,True,db,db,
14/11/2025,Europe,EURUSD,1.2.2,2025-11-14T07:00:00+00:00,2025-11-14T06:45:00+00:00,FORA,0.0,FORA,0.0,True,0.0,2025-11-14T06:30:00+00:00,2025-11-14T06:30:00+00:00,True,db,db,
14/11/2025,Europe,EURUSD,1.0.2,2025-11-14T07:00:00+00:00,2025-11-14T06:45:00+00:00,FORA,0.0,FORA,0.0,True,0.0,2025-11-14T06:30:00+00:00,2025-11-14T06:30:00+00:00,True,db,db,
13/11/2025,America,XAUUSD,1.2.3,2025-11-13T13:30:00+00:00,2025-11-13T13:15:00+00:00,FORA,1.5,FORA,1.5,True,0.0,2025-11-13T13:00:00+00:00,2025-11-13T13:00:00+00:00,True,db,db,
13/11/2025,America,XAUUSD,1.0.3,2025-11-13T13:30:00+00:00,2025-11-13T13:15:00+00:00,FORA,-0.5,FORA,-0.5,True,0.0,2025-11-13T13:00:00+00:00,2025-11-13T13:00:00+00:00,True,db,db,
13/11/2025,Asia,USDJPY,1.2.1,2025-11-13T00:00:00+00:00,2025-11-12T23:30:00+00:00,FORA,0.0,FORA,0.0,True,0.0,2025-11-12T23:15:00+00:00,2025-11-12T23:15:00+00:00,True,db,db,
13/11/2025,Asia,USDJPY,1.0.1,2025-11-13T00:00:00+00:00,2025-11-12T23:30:00+00:00,FORA,0.0,FORA,0.0,True,0.0,2025-11-12T23:15:00+00:00,2025-11-12T23:15:00+00:00,True,db,db,
13/11/2025,Europe,EURUSD,1.2.2,2025-11-13T07:00:00+00:00,2025-11-13T06:45:00+00:00,FORA,-0.5,FORA,-0.5,True,0.0,2025-11-13T06:30:00+00:00,2025-11-13T06:30:00+00:00,True,db,db,
13/11/2025,Europe,EURUSD,1.0.2,2025-11-13T07:00:00+00:00,2025-11-13T06:45:00+00:00,COMPRA,1.5,COMPRA,1.5,True,0.0,2025-11-13T06:30:00+00:00,2025-11-13T06:30:00+00:00,True,db,db,
12/11/2025,America,XAUUSD,1.2.3,2025-11-12T13:30:00+00:00,2025-11-12T13:15:00+00:00,COMPRA,2.5,COMPRA,2.5,True,0.0,2025-11-12T13:00:00+00:00,2025-11-12T13:00:00+00:00,True,db,db,
12/11/2025,America,XAUUSD,1.0.3,2025-11-12T13:30:00+00:00,2025-11-12T13:15:00+00:00,COMPRA,3.5,COMPRA,3.5,True,0.0,2025-11-12T13:00:00+00:00,2025-11-12T13:00:00+00:00,True,db,db,
12/11/2025,Asia,USDJPY,1.2.1,2025-11-12T00:00:00+00:00,2025-11-11T23:30:00+00:00,COMPRA,2.5,COMPRA,2.5,True,0.0,2025-11-11T23:15:00+00:00,2025-11-11T23:15:00+00:00,True,db,db,
12/11/2025,Asia,USDJPY,1.0.1,2025-11-12T00:00:00+00:00,2025-11-11T23:30:00+00:00,COMPRA,2.5,COMPRA,2.5,True,0.0,2025-11-11T23:15:00+00:00,2025-11-11T23:15:00+00:00,True,db,db,
12/11/2025,Europe,EURUSD,1.2.2,2025-11-12T07:00:00+00:00,2025-11-12T06:45:00+00:00,VENDA,-2.5,VENDA,-2.5,True,0.0,2025-11-12T06:30:00+00:00,2025-11-12T06:30:00+00:00,True,db,db,
12/11/2025,Europe,EURUSD,1.0.2,2025-11-12T07:00:00+00:00,2025-11-12T06:45:00+00:00,FORA,-0.5,FORA,-0.5,True,0.0,2025-11-12T06:30:00+00:00,2025-11-12T06:30:00+00:00,True,db,db,
11/11/2025,America,XAUUSD,1.2.3,2025-11-11T13:30:00+00:00,2025-11-11T13:15:00+00:00,FORA,-0.5,FORA,-0.5,True,0.0,2025-11-11T13:00:00+00:00,2025-11-11T13:00:00+00:00,True,db,db,
11/11/2025,America,XAUUSD,1.0.3,2025-11-11T13:30:00+00:00,2025-11-11T13:15:00+00:00,FORA,0.5,FORA,0.5,True,0.0,2025-11-11T13:00:00+00:00,2025-11-11T13:00:00+00:00,True,db,db,
11/11/2025,Asia,USDJPY,1.0.1,2025-11-11T00:00:00+00:00,2025-11-10T23:30:00+00:00,FORA,0.0,FORA,0.0,True,0.0,2025-11-10T23:15:00+00:00,2025-11-10T23:15:00+00:00,True,db,db,
11/11/2025,Asia,USDJPY,1.2.1,2025-11-11T00:00:00+00:00,2025-11-10T23:30:00+00:00,FORA,0.0,FORA,0.0,True,0.0,2025-11-10T23:15:00+00:00,2025-11-10T23:15:00+00:00,True,db,db,
11/11/2025,Europe,EURUSD,1.2.2,2025-11-11T07:00:00+00:00,2025-11-11T06:45:00+00:00,FORA,0.5,FORA,0.5,True,0.0,2025-11-11T06:30:00+00:00,2025-11-11T06:30:00+00:00,True,db,db,
11/11/2025,Europe,EURUSD,1.0.2,2025-11-11T07:00:00+00:00,2025-11-11T06:45:00+00:00,COMPRA,1.5,COMPRA,1.5,True,0.0,2025-11-11T06:30:00+00:00,2025-11-11T06:30:00+00:00,True,db,db,
10/11/2025,America,XAUUSD,1.2.3,2025-11-10T13:30:00+00:00,2025-11-10T13:15:00+00:00,FORA,0.0,FORA,0.0,True,0.0,2025-11-10T13:00:00+00:00,2025-11-10T13:00:00+00:00,True,db,db,
10/11/2025,America,XAUUSD,1.0.3,2025-11-10T13:30:00+00:00,2025-11-10T13:15:00+00:00,FORA,0.0,FORA,0.0,True,0.0,2025-11-10T13:00:00+00:00,2025-11-10T13:00:00+00:00,True,db,db,
10/11/2025,Asia,USDJPY,1.2.1,2025-11-10T00:00:00+00:00,2025-11-09T23:30:00+00:00,COMPRA,1.0,COMPRA,1.0,True,0.0,2025-11-07T23:45:00+00:00,2025-11-07T23:45:00+00:00,True,db,db,
10/11/2025,Asia,USDJPY,1.0.1,2025-11-10T00:00:00+00:00,2025-11-09T23:30:00+00:00,COMPRA,1.0,COMPRA,1.0,True,0.0,2025-11-07T23:45:00+00:00,2025-11-07T23:45:00+00:00,True,db,db,
10/11/2025,Europe,EURUSD,1.2.2,2025-11-10T07:00:00+00:00,2025-11-10T06:45:00+00:00,COMPRA,2.0,COMPRA,2.0,True,0.0,2025-11-10T06:30:00+00:00,2025-11-10T06:30:00+00:00,True,db,db,
10/11/2025,Europe,EURUSD,1.0.2,2025-11-10T07:00:00+00:00,2025-11-10T06:45:00+00:00,VENDA,-1.0,VENDA,-1.0,True,0.0,2025-11-10T06:30:00+00:00,2025-11-10T06:30:00+00:00,True,db,db,
07/11/2025,America,XAUUSD,1.0.3,2025-11-07T13:30:00+00:00,2025-11-07T13:15:00+00:00,VENDA,-1.0,VENDA,-1.0,True,0.0,2025-11-07T13:00:00+00:00,2025-11-07T13:00:00+00:00,True,db,db,
07/11/2025,America,XAUUSD,1.2.3,2025-11-07T13:30:00+00:00,2025-11-07T13:15:00+00:00,FORA,1.0,FORA,1.0,True,0.0,2025-11-07T13:00:00+00:00,2025-11-07T13:00:00+00:00,True,db,db,
07/11/2025,Asia,USDJPY,1.0.1,2025-11-07T00:00:00+00:00,2025-11-06T23:30:00+00:00,FORA,0.0,FORA,0.0,True,0.0,2025-11-06T23:15:00+00:00,2025-11-06T23:15:00+00:00,True,db,db,
07/11/2025,Asia,USDJPY,1.2.1,2025-11-07T00:00:00+00:00,2025-11-06T23:30:00+00:00,FORA,0.0,FORA,0.0,True,0.0,2025-11-06T23:15:00+00:00,2025-11-06T23:15:00+00:00,True,db,db,
07/11/2025,Europe,EURUSD,1.2.2,2025-11-07T07:00:00+00:00,2025-11-07T06:45:00+00:00,FORA,0.0,FORA,0.0,True,0.0,2025-11-07T06:30:00+00:00,2025-11-07T06:30:00+00:00,True,db,db,
07/11/2025,Europe,EURUSD,1.0.2,2025-11-07T07:00:00+00:00,2025-11-07T06:45:00+00:00,FORA,0.0,FORA,0.0,True,0.0,2025-11-07T06:30:00+00:00,2025-11-07T06:30:00+00:00,True,db,db,
06/11/2025,America,XAUUSD,1.0.3,2025-11-06T13:30:00+00:00,2025-11-06T13:15:00+00:00,FORA,0.0,FORA,0.0,True,0.0,2025-11-06T13:00:00+00:00,2025-11-06T13:00:00+00:00,True,db,db,
06/11/2025,America,XAUUSD,1.2.3,2025-11-06T13:30:00+00:00,2025-11-06T13:15:00+00:00,FORA,0.0,FORA,0.0,True,0.0,2025-11-06T13:00:00+00:00,2025-11-06T13:00:00+00:00,True,db,db,
06/11/2025,Asia,USDJPY,1.0.1,2025-11-06T00:00:00+00:00,2025-11-05T23:30:00+00:00,COMPRA,2.5,COMPRA,2.5,True,0.0,2025-11-05T23:15:00+00:00,2025-11-05T23:15:00+00:00,True,db,db,
06/11/2025,Asia,USDJPY,1.2.1,2025-11-06T00:00:00+00:00,2025-11-05T23:30:00+00:00,COMPRA,3.5,COMPRA,3.5,True,0.0,2025-11-05T23:15:00+00:00,2025-11-05T23:15:00+00:00,True,db,db,
06/11/2025,Europe,EURUSD,1.2.2,2025-11-06T07:00:00+00:00,2025-11-06T06:45:00+00:00,FORA,0.5,FORA,0.5,True,0.0,2025-11-06T06:30:00+00:00,2025-11-06T06:30:00+00:00,True,db,db,
06/11/2025,Europe,EURUSD,1.0.2,2025-11-06T07:00:00+00:00,2025-11-06T06:45:00+00:00,COMPRA,1.5,COMPRA,1.5,True,0.0,2025-11-06T06:30:00+00:00,2025-11-06T06:30:00+00:00,True,db,db,
05/11/2025,America,XAUUSD,1.0.3,2025-11-05T13:30:00+00:00,2025-11-05T13:15:00+00:00,VENDA,-3.0,VENDA,-3.0,True,0.0,2025-11-05T13:00:00+00:00,2025-11-05T13:00:00+00:00,True,db,db,
05/11/2025,America,XAUUSD,1.2.3,2025-11-05T13:30:00+00:00,2025-11-05T13:15:00+00:00,FORA,-1.0,FORA,-1.0,True,0.0,2025-11-05T13:00:00+00:00,2025-11-05T13:00:00+00:00,True,db,db,
05/11/2025,Asia,USDJPY,1.0.1,2025-11-05T00:00:00+00:00,2025-11-04T23:30:00+00:00,COMPRA,4.0,COMPRA,4.0,True,0.0,2025-11-04T23:15:00+00:00,2025-11-04T23:15:00+00:00,True,db,db,
05/11/2025,Asia,USDJPY,1.2.1,2025-11-05T00:00:00+00:00,2025-11-04T23:30:00+00:00,COMPRA,4.0,COMPRA,4.0,True,0.0,2025-11-04T23:15:00+00:00,2025-11-04T23:15:00+00:00,True,db,db,
05/11/2025,Europe,EURUSD,1.2.2,2025-11-05T07:00:00+00:00,2025-11-05T06:45:00+00:00,FORA,0.0,FORA,0.0,True,0.0,2025-11-05T06:30:00+00:00,2025-11-05T06:30:00+00:00,True,db,db,
05/11/2025,Europe,EURUSD,1.0.2,2025-11-05T07:00:00+00:00,2025-11-05T06:45:00+00:00,FORA,0.0,FORA,0.0,True,0.0,2025-11-05T06:30:00+00:00,2025-11-05T06:30:00+00:00,True,db,db,
04/11/2025,America,XAUUSD,1.0.3,2025-11-04T13:30:00+00:00,2025-11-04T13:15:00+00:00,COMPRA,1.0,COMPRA,1.0,True,0.0,2025-11-04T13:00:00+00:00,2025-11-04T13:00:00+00:00,True,db,db,
04/11/2025,America,XAUUSD,1.2.3,2025-11-04T13:30:00+00:00,2025-11-04T13:15:00+00:00,FORA,0.0,FORA,0.0,True,0.0,2025-11-04T13:00:00+00:00,2025-11-04T13:00:00+00:00,True,db,db,
04/11/2025,Asia,USDJPY,1.2.1,2025-11-04T00:00:00+00:00,2025-11-03T23:30:00+00:00,COMPRA,1.5,COMPRA,1.5,True,0.0,2025-11-03T23:15:00+00:00,2025-11-03T23:15:00+00:00,True,db,db,
04/11/2025,Asia,USDJPY,1.0.1,2025-11-04T00:00:00+00:00,2025-11-03T23:30:00+00:00,COMPRA,1.5,COMPRA,1.5,True,0.0,2025-11-03T23:15:00+00:00,2025-11-03T23:15:00+00:00,True,db,db,
04/11/2025,Europe,EURUSD,1.2.2,2025-11-04T07:00:00+00:00,2025-11-04T06:45:00+00:00,VENDA,-3.0,VENDA,-3.0,True,0.0,2025-11-04T06:30:00+00:00,2025-11-04T06:30:00+00:00,True,db,db,
04/11/2025,Europe,EURUSD,1.0.2,2025-11-04T07:00:00+00:00,2025-11-04T06:45:00+00:00,VENDA,-1.0,VENDA,-1.0,True,0.0,2025-11-04T06:30:00+00:00,2025-11-04T06:30:00+00:00,True,db,db,
03/11/2025,America,XAUUSD,1.2.3,2025-11-03T13:30:00+00:00,2025-11-03T13:15:00+00:00,FORA,0.0,FORA,0.0,True,0.0,2025-11-03T13:00:00+00:00,2025-11-03T13:00:00+00:00,True,db,db,
03/11/2025,America,XAUUSD,1.0.3,2025-11-03T13:30:00+00:00,2025-11-03T13:15:00+00:00,VENDA,-2.0,VENDA,-2.0,True,0.0,2025-11-03T13:00:00+00:00,2025-11-03T13:00:00+00:00,True,db,db,
03/11/2025,Asia,USDJPY,1.2.1,2025-11-03T00:00:00+00:00,2025-11-02T23:30:00+00:00,COMPRA,2.0,COMPRA,2.0,True,0.0,2025-10-31T23:45:00+00:00,2025-10-31T23:45:00+00:00,True,db,db,
03/11/2025,Asia,USDJPY,1.0.1,2025-11-03T00:00:00+00:00,2025-11-02T23:30:00+00:00,FORA,0.0,FORA,0.0,True,0.0,2025-10-31T23:45:00+00:00,2025-10-31T23:45:00+00:00,True,db,db,
03/11/2025,Europe,EURUSD,1.2.2,2025-11-03T07:00:00+00:00,2025-11-03T06:45:00+00:00,FORA,0.0,FORA,0.0,True,0.0,2025-11-03T06:30:00+00:00,2025-11-03T06:30:00+00:00,True,db,db,
03/11/2025,Europe,EURUSD,1.0.2,2025-11-03T07:00:00+00:00,2025-11-03T06:45:00+00:00,FORA,0.0,FORA,0.0,True,0.0,2025-11-03T06:30:00+00:00,2025-11-03T06:30:00+00:00,True,db,db,
31/10/2025,America,XAUUSD,1.2.3,2025-10-31T13:30:00+00:00,2025-10-31T13:15:00+00:00,FORA,-1.0,FORA,-1.0,True,0.0,2025-10-31T13:00:00+00:00,2025-10-31T13:00:00+00:00,True,db,db,
31/10/2025,America,XAUUSD,1.0.3,2025-10-31T13:30:00+00:00,2025-10-31T13:15:00+00:00,FORA,0.0,FORA,0.0,True,0.0,2025-10-31T13:00:00+00:00,2025-10-31T13:00:00+00:00,True,db,db,
31/10/2025,Asia,USDJPY,1.0.1,2025-10-31T00:00:00+00:00,2025-10-30T23:30:00+00:00,VENDA,-1.0,VENDA,-1.0,True,0.0,2025-10-30T23:15:00+00:00,2025-10-30T23:15:00+00:00,True,db,db,
31/10/2025,Asia,USDJPY,1.2.1,2025-10-31T00:00:00+00:00,2025-10-30T23:30:00+00:00,COMPRA,1.0,COMPRA,1.0,True,0.0,2025-10-30T23:15:00+00:00,2025-10-30T23:15:00+00:00,True,db,db,
31/10/2025,Europe,EURUSD,1.2.2,2025-10-31T07:00:00+00:00,2025-10-31T06:45:00+00:00,FORA,0.0,FORA,0.0,True,0.0,2025-10-31T06:30:00+00:00,2025-10-31T06:30:00+00:00,True,db,db,
31/10/2025,Europe,EURUSD,1.0.2,2025-10-31T07:00:00+00:00,2025-10-31T06:45:00+00:00,COMPRA,1.0,COMPRA,1.0,True,0.0,2025-10-31T06:30:00+00:00,2025-10-31T06:30:00+00:00,True,db,db,
30/10/2025,America,XAUUSD,1.2.3,2025-10-30T13:30:00+00:00,2025-10-30T13:15:00+00:00,FORA,-1.0,FORA,-1.0,True,0.0,2025-10-30T13:00:00+00:00,2025-10-30T13:00:00+00:00,True,db,db,
30/10/2025,America,XAUUSD,1.0.3,2025-10-30T13:30:00+00:00,2025-10-30T13:15:00+00:00,FORA,0.0,FORA,0.0,True,0.0,2025-10-30T13:00:00+00:00,2025-10-30T13:00:00+00:00,True,db,db,
30/10/2025,Asia,USDJPY,1.0.1,2025-10-30T00:00:00+00:00,2025-10-29T23:30:00+00:00,COMPRA,2.0,COMPRA,2.0,True,0.0,2025-10-29T23:15:00+00:00,2025-10-29T23:15:00+00:00,True,db,db,
30/10/2025,Asia,USDJPY,1.2.1,2025-10-30T00:00:00+00:00,2025-10-29T23:30:00+00:00,COMPRA,2.0,COMPRA,2.0,True,0.0,2025-10-29T23:15:00+00:00,2025-10-29T23:15:00+00:00,True,db,db,
30/10/2025,Europe,EURUSD,1.2.2,2025-10-30T07:00:00+00:00,2025-10-30T06:45:00+00:00,FORA,0.0,FORA,0.0,True,0.0,2025-10-30T06:30:00+00:00,2025-10-30T06:30:00+00:00,True,db,db,
30/10/2025,Europe,EURUSD,1.0.2,2025-10-30T07:00:00+00:00,2025-10-30T06:45:00+00:00,FORA,0.0,FORA,0.0,True,0.0,2025-10-30T06:30:00+00:00,2025-10-30T06:30:00+00:00,True,db,db,
29/10/2025,America,XAUUSD,1.2.3,2025-10-29T13:30:00+00:00,2025-10-29T13:15:00+00:00,FORA,0.0,FORA,0.0,True,0.0,2025-10-29T13:00:00+00:00,2025-10-29T13:00:00+00:00,True,db,db,
29/10/2025,America,XAUUSD,1.0.3,2025-10-29T13:30:00+00:00,2025-10-29T13:15:00+00:00,FORA,0.0,FORA,0.0,True,0.0,2025-10-29T13:00:00+00:00,2025-10-29T13:00:00+00:00,True,db,db,
29/10/2025,Asia,USDJPY,1.0.1,2025-10-29T00:00:00+00:00,2025-10-28T23:30:00+00:00,VENDA,-4.5,VENDA,-4.5,True,0.0,2025-10-28T23:15:00+00:00,2025-10-28T23:15:00+00:00,True,db,db,
29/10/2025,Asia,USDJPY,1.2.1,2025-10-29T00:00:00+00:00,2025-10-28T23:30:00+00:00,VENDA,-2.5,VENDA,-2.5,True,0.0,2025-10-28T23:15:00+00:00,2025-10-28T23:15:00+00:00,True,db,db,
29/10/2025,Europe,EURUSD,1.2.2,2025-10-29T07:00:00+00:00,2025-10-29T06:45:00+00:00,VENDA,-1.5,VENDA,-1.5,True,0.0,2025-10-29T06:30:00+00:00,2025-10-29T06:30:00+00:00,True,db,db,
29/10/2025,Europe,EURUSD,1.0.2,2025-10-29T07:00:00+00:00,2025-10-29T06:45:00+00:00,FORA,-0.5,FORA,-0.5,True,0.0,2025-10-29T06:30:00+00:00,2025-10-29T06:30:00+00:00,True,db,db,
28/10/2025,America,XAUUSD,1.2.3,2025-10-28T13:30:00+00:00,2025-10-28T13:15:00+00:00,FORA,-0.5,FORA,-0.5,True,0.0,2025-10-28T13:00:00+00:00,2025-10-28T13:00:00+00:00,True,db,db,
28/10/2025,America,XAUUSD,1.0.3,2025-10-28T13:30:00+00:00,2025-10-28T13:15:00+00:00,FORA,0.0,FORA,0.0,True,0.0,2025-10-28T13:00:00+00:00,2025-10-28T13:00:00+00:00,True,db,db,
28/10/2025,Asia,USDJPY,1.2.1,2025-10-28T00:00:00+00:00,2025-10-27T23:30:00+00:00,VENDA,-3.5,VENDA,-3.5,True,0.0,2025-10-27T23:15:00+00:00,2025-10-27T23:15:00+00:00,True,db,db,
28/10/2025,Asia,USDJPY,1.0.1,2025-10-28T00:00:00+00:00,2025-10-27T23:30:00+00:00,VENDA,-3.0,VENDA,-3.0,True,0.0,2025-10-27T23:15:00+00:00,2025-10-27T23:15:00+00:00,True,db,db,
28/10/2025,Europe,EURUSD,1.2.2,2025-10-28T07:00:00+00:00,2025-10-28T06:45:00+00:00,VENDA,-1.5,VENDA,-1.5,True,0.0,2025-10-28T06:30:00+00:00,2025-10-28T06:30:00+00:00,True,db,db,
28/10/2025,Europe,EURUSD,1.0.2,2025-10-28T07:00:00+00:00,2025-10-28T06:45:00+00:00,FORA,-0.5,FORA,-0.5,True,0.0,2025-10-28T06:30:00+00:00,2025-10-28T06:30:00+00:00,True,db,db,
27/10/2025,America,XAUUSD,1.2.3,2025-10-27T13:30:00+00:00,2025-10-27T13:15:00+00:00,FORA,0.0,FORA,0.0,True,0.0,2025-10-27T13:00:00+00:00,2025-10-27T13:00:00+00:00,True,db,db,
27/10/2025,America,XAUUSD,1.0.3,2025-10-27T13:30:00+00:00,2025-10-27T13:15:00+00:00,FORA,0.0,FORA,0.0,True,0.0,2025-10-27T13:00:00+00:00,2025-10-27T13:00:00+00:00,True,db,db,
27/10/2025,Asia,USDJPY,1.2.1,2025-10-27T00:00:00+00:00,2025-10-26T23:30:00+00:00,COMPRA,2.5,COMPRA,2.5,True,0.0,2025-10-24T23:45:00+00:00,2025-10-24T23:45:00+00:00,True,db,db,
27/10/2025,Asia,USDJPY,1.0.1,2025-10-27T00:00:00+00:00,2025-10-26T23:30:00+00:00,COMPRA,3.5,COMPRA,3.5,True,0.0,2025-10-24T23:45:00+00:00,2025-10-24T23:45:00+00:00,True,db,db,
27/10/2025,Europe,EURUSD,1.2.2,2025-10-27T07:00:00+00:00,2025-10-27T06:45:00+00:00,VENDA,-2.0,VENDA,-2.0,True,0.0,2025-10-27T06:30:00+00:00,2025-10-27T06:30:00+00:00,True,db,db,
27/10/2025,Europe,EURUSD,1.0.2,2025-10-27T07:00:00+00:00,2025-10-27T06:45:00+00:00,VENDA,-1.0,VENDA,-1.0,True,0.0,2025-10-27T06:30:00+00:00,2025-10-27T06:30:00+00:00,True,db,db,
24/10/2025,America,XAUUSD,1.0.3,2025-10-24T13:30:00+00:00,2025-10-24T13:15:00+00:00,FORA,0.0,FORA,0.0,True,0.0,2025-10-24T13:00:00+00:00,2025-10-24T13:00:00+00:00,True,db,db,
24/10/2025,America,XAUUSD,1.2.3,2025-10-24T13:30:00+00:00,2025-10-24T13:15:00+00:00,FORA,-0.5,FORA,-0.5,True,0.0,2025-10-24T13:00:00+00:00,2025-10-24T13:00:00+00:00,True,db,db,
24/10/2025,Asia,USDJPY,1.0.1,2025-10-24T00:00:00+00:00,2025-10-23T23:30:00+00:00,FORA,0.0,FORA,0.0,True,0.0,2025-10-23T23:15:00+00:00,2025-10-23T23:15:00+00:00,True,db,db,
24/10/2025,Asia,USDJPY,1.2.1,2025-10-24T00:00:00+00:00,2025-10-23T23:30:00+00:00,FORA,0.0,FORA,0.0,True,0.0,2025-10-23T23:15:00+00:00,2025-10-23T23:15:00+00:00,True,db,db,
24/10/2025,Europe,EURUSD,1.2.2,2025-10-24T07:00:00+00:00,2025-10-24T06:45:00+00:00,COMPRA,1.5,COMPRA,1.5,True,0.0,2025-10-24T06:30:00+00:00,2025-10-24T06:30:00+00:00,True,db,db,
24/10/2025,Europe,EURUSD,1.0.2,2025-10-24T07:00:00+00:00,2025-10-24T06:45:00+00:00,COMPRA,2.5,COMPRA,2.5,True,0.0,2025-10-24T06:30:00+00:00,2025-10-24T06:30:00+00:00,True,db,db,
23/10/2025,America,XAUUSD,1.2.3,2025-10-23T13:30:00+00:00,2025-10-23T13:15:00+00:00,FORA,1.0,FORA,1.0,True,0.0,2025-10-23T13:00:00+00:00,2025-10-23T13:00:00+00:00,True,db,db,
23/10/2025,America,XAUUSD,1.0.3,2025-10-23T13:30:00+00:00,2025-10-23T13:15:00+00:00,COMPRA,2.0,COMPRA,2.0,True,0.0,2025-10-23T13:00:00+00:00,2025-10-23T13:00:00+00:00,True,db,db,
23/10/2025,Asia,USDJPY,1.0.1,2025-10-23T00:00:00+00:00,2025-10-22T23:30:00+00:00,COMPRA,1.0,COMPRA,1.0,True,0.0,2025-10-22T23:15:00+00:00,2025-10-22T23:15:00+00:00,True,db,db,
23/10/2025,Asia,USDJPY,1.2.1,2025-10-23T00:00:00+00:00,2025-10-22T23:30:00+00:00,COMPRA,1.0,COMPRA,1.0,True,0.0,2025-10-22T23:15:00+00:00,2025-10-22T23:15:00+00:00,True,db,db,
23/10/2025,Europe,EURUSD,1.2.2,2025-10-23T07:00:00+00:00,2025-10-23T06:45:00+00:00,FORA,-0.5,FORA,-0.5,True,0.0,2025-10-23T06:30:00+00:00,2025-10-23T06:30:00+00:00,True,db,db,
23/10/2025,Europe,EURUSD,1.0.2,2025-10-23T07:00:00+00:00,2025-10-23T06:45:00+00:00,COMPRA,1.5,COMPRA,1.5,True,0.0,2025-10-23T06:30:00+00:00,2025-10-23T06:30:00+00:00,True,db,db,
22/10/2025,America,XAUUSD,1.2.3,2025-10-22T13:30:00+00:00,2025-10-22T13:15:00+00:00,VENDA,-3.0,VENDA,-3.0,True,0.0,2025-10-22T13:00:00+00:00,2025-10-22T13:00:00+00:00,True,db,db,
22/10/2025,America,XAUUSD,1.0.3,2025-10-22T13:30:00+00:00,2025-10-22T13:15:00+00:00,VENDA,-3.0,VENDA,-3.0,True,0.0,2025-10-22T13:00:00+00:00,2025-10-22T13:00:00+00:00,True,db,db,
22/10/2025,Asia,USDJPY,1.2.1,2025-10-22T00:00:00+00:00,2025-10-21T23:30:00+00:00,FORA,-0.5,FORA,-0.5,True,0.0,2025-10-21T23:15:00+00:00,2025-10-21T23:15:00+00:00,True,db,db,
22/10/2025,Europe,EURUSD,1.2.2,2025-10-22T07:00:00+00:00,2025-10-22T06:45:00+00:00,VENDA,-2.0,VENDA,-2.0,True,0.0,2025-10-22T06:30:00+00:00,2025-10-22T06:30:00+00:00,True,db,db,
22/10/2025,Europe,EURUSD,1.0.2,2025-10-22T07:00:00+00:00,2025-10-22T06:45:00+00:00,FORA,0.0,FORA,0.0,True,0.0,2025-10-22T06:30:00+00:00,2025-10-22T06:30:00+00:00,True,db,db,
21/10/2025,America,XAUUSD,1.0.3,2025-10-21T13:30:00+00:00,2025-10-21T13:15:00+00:00,FORA,0.0,FORA,0.0,True,0.0,2025-10-21T13:00:00+00:00,2025-10-21T13:00:00+00:00,True,db,db,
21/10/2025,America,XAUUSD,1.2.3,2025-10-21T13:30:00+00:00,2025-10-21T13:15:00+00:00,FORA,0.0,FORA,0.0,True,0.0,2025-10-21T13:00:00+00:00,2025-10-21T13:00:00+00:00,True,db,db,
21/10/2025,Asia,USDJPY,1.2.1,2025-10-21T00:00:00+00:00,2025-10-20T23:30:00+00:00,COMPRA,1.5,COMPRA,1.5,True,0.0,2025-10-20T23:15:00+00:00,2025-10-20T23:15:00+00:00,True,db,db,
21/10/2025,Asia,USDJPY,1.0.1,2025-10-21T00:00:00+00:00,2025-10-20T23:30:00+00:00,FORA,-0.5,FORA,-0.5,True,0.0,2025-10-20T23:15:00+00:00,2025-10-20T23:15:00+00:00,True,db,db,
21/10/2025,Europe,EURUSD,1.2.2,2025-10-21T07:00:00+00:00,2025-10-21T06:45:00+00:00,VENDA,-2.0,VENDA,-2.0,True,0.0,2025-10-21T06:30:00+00:00,2025-10-21T06:30:00+00:00,True,db,db,
21/10/2025,Europe,EURUSD,1.0.2,2025-10-21T07:00:00+00:00,2025-10-21T06:45:00+00:00,VENDA,-1.0,VENDA,-1.0,True,0.0,2025-10-21T06:30:00+00:00,2025-10-21T06:30:00+00:00,True,db,db,
20/10/2025,America,XAUUSD,1.2.3,2025-10-20T13:30:00+00:00,2025-10-20T13:15:00+00:00,VENDA,-3.5,VENDA,-3.5,True,0.0,2025-10-20T13:00:00+00:00,2025-10-20T13:00:00+00:00,True,db,db,
20/10/2025,America,XAUUSD,1.0.3,2025-10-20T13:30:00+00:00,2025-10-20T13:15:00+00:00,VENDA,-5.5,VENDA,-5.5,True,0.0,2025-10-20T13:00:00+00:00,2025-10-20T13:00:00+00:00,True,db,db,
20/10/2025,Asia,USDJPY,1.2.1,2025-10-20T00:00:00+00:00,2025-10-19T23:30:00+00:00,FORA,0.0,FORA,0.0,True,0.0,2025-10-17T23:45:00+00:00,2025-10-17T23:45:00+00:00,True,db,db,
20/10/2025,Asia,USDJPY,1.0.1,2025-10-20T00:00:00+00:00,2025-10-19T23:30:00+00:00,FORA,0.0,FORA,0.0,True,0.0,2025-10-17T23:45:00+00:00,2025-10-17T23:45:00+00:00,True,db,db,
20/10/2025,Europe,EURUSD,1.2.2,2025-10-20T07:00:00+00:00,2025-10-20T06:45:00+00:00,FORA,0.5,FORA,0.5,True,0.0,2025-10-20T06:30:00+00:00,2025-10-20T06:30:00+00:00,True,db,db,
20/10/2025,Europe,EURUSD,1.0.2,2025-10-20T07:00:00+00:00,2025-10-20T06:45:00+00:00,COMPRA,1.5,COMPRA,1.5,True,0.0,2025-10-20T06:30:00+00:00,2025-10-20T06:30:00+00:00,True,db,db,
17/10/2025,America,XAUUSD,1.0.3,2025-10-17T13:30:00+00:00,2025-10-17T13:15:00+00:00,VENDA,-1.0,VENDA,-1.0,True,0.0,2025-10-17T13:00:00+00:00,2025-10-17T13:00:00+00:00,True,db,db,
17/10/2025,America,XAUUSD,1.2.3,2025-10-17T13:30:00+00:00,2025-10-17T13:15:00+00:00,FORA,-1.0,FORA,-1.0,True,0.0,2025-10-17T13:00:00+00:00,2025-10-17T13:00:00+00:00,True,db,db,
17/10/2025,Asia,USDJPY,1.0.1,2025-10-17T00:00:00+00:00,2025-10-16T23:30:00+00:00,VENDA,-1.5,VENDA,-1.5,True,0.0,2025-10-16T23:15:00+00:00,2025-10-16T23:15:00+00:00,True,db,db,
17/10/2025,Asia,USDJPY,1.2.1,2025-10-17T00:00:00+00:00,2025-10-16T23:30:00+00:00,VENDA,-1.5,VENDA,-1.5,True,0.0,2025-10-16T23:15:00+00:00,2025-10-16T23:15:00+00:00,True,db,db,
17/10/2025,Europe,EURUSD,1.2.2,2025-10-17T07:00:00+00:00,2025-10-17T06:45:00+00:00,FORA,0.0,FORA,0.0,True,0.0,2025-10-17T06:30:00+00:00,2025-10-17T06:30:00+00:00,True,db,db,
17/10/2025,Europe,EURUSD,1.0.2,2025-10-17T07:00:00+00:00,2025-10-17T06:45:00+00:00,COMPRA,2.0,COMPRA,2.0,True,0.0,2025-10-17T06:30:00+00:00,2025-10-17T06:30:00+00:00,True,db,db,
16/10/2025,America,XAUUSD,1.2.3,2025-10-16T13:30:00+00:00,2025-10-16T13:15:00+00:00,COMPRA,2.5,COMPRA,2.5,True,0.0,2025-10-16T13:00:00+00:00,2025-10-16T13:00:00+00:00,True,db,db,
16/10/2025,America,XAUUSD,1.0.3,2025-10-16T13:30:00+00:00,2025-10-16T13:15:00+00:00,FORA,0.5,FORA,0.5,True,0.0,2025-10-16T13:00:00+00:00,2025-10-16T13:00:00+00:00,True,db,db,
16/10/2025,Asia,USDJPY,1.0.1,2025-10-16T00:00:00+00:00,2025-10-15T23:30:00+00:00,VENDA,-2.5,VENDA,-2.5,True,0.0,2025-10-15T23:15:00+00:00,2025-10-15T23:15:00+00:00,True,db,db,
16/10/2025,Asia,USDJPY,1.2.1,2025-10-16T00:00:00+00:00,2025-10-15T23:30:00+00:00,VENDA,-3.0,VENDA,-3.0,True,0.0,2025-10-15T23:15:00+00:00,2025-10-15T23:15:00+00:00,True,db,db,
16/10/2025,Europe,EURUSD,1.2.2,2025-10-16T07:00:00+00:00,2025-10-16T06:45:00+00:00,VENDA,-2.0,VENDA,-2.0,True,0.0,2025-10-16T06:30:00+00:00,2025-10-16T06:30:00+00:00,True,db,db,
16/10/2025,Europe,EURUSD,1.0.2,2025-10-16T07:00:00+00:00,2025-10-16T06:45:00+00:00,FORA,0.0,FORA,0.0,True,0.0,2025-10-16T06:30:00+00:00,2025-10-16T06:30:00+00:00,True,db,db,
15/10/2025,America,XAUUSD,1.0.3,2025-10-15T13:30:00+00:00,2025-10-15T13:15:00+00:00,FORA,0.0,FORA,0.0,True,0.0,2025-10-15T13:00:00+00:00,2025-10-15T13:00:00+00:00,True,db,db,
15/10/2025,America,XAUUSD,1.2.3,2025-10-15T13:30:00+00:00,2025-10-15T13:15:00+00:00,COMPRA,2.5,COMPRA,2.5,True,0.0,2025-10-15T13:00:00+00:00,2025-10-15T13:00:00+00:00,True,db,db,
15/10/2025,Asia,USDJPY,1.0.1,2025-10-15T00:00:00+00:00,2025-10-14T23:30:00+00:00,VENDA,-1.0,VENDA,-1.0,True,0.0,2025-10-14T23:15:00+00:00,2025-10-14T23:15:00+00:00,True,db,db,
15/10/2025,Asia,USDJPY,1.2.1,2025-10-15T00:00:00+00:00,2025-10-14T23:30:00+00:00,VENDA,-2.0,VENDA,-2.0,True,0.0,2025-10-14T23:15:00+00:00,2025-10-14T23:15:00+00:00,True,db,db,
15/10/2025,Europe,EURUSD,1.2.2,2025-10-15T07:00:00+00:00,2025-10-15T06:45:00+00:00,FORA,0.0,FORA,0.0,True,0.0,2025-10-15T06:30:00+00:00,2025-10-15T06:30:00+00:00,True,db,db,
15/10/2025,Europe,EURUSD,1.0.2,2025-10-15T07:00:00+00:00,2025-10-15T06:45:00+00:00,FORA,0.0,FORA,0.0,True,0.0,2025-10-15T06:30:00+00:00,2025-10-15T06:30:00+00:00,True,db,db,
14/10/2025,America,XAUUSD,1.0.3,2025-10-14T13:30:00+00:00,2025-10-14T13:15:00+00:00,VENDA,-2.0,VENDA,-2.0,True,0.0,2025-10-14T13:00:00+00:00,2025-10-14T13:00:00+00:00,True,db,db,
14/10/2025,America,XAUUSD,1.2.3,2025-10-14T13:30:00+00:00,2025-10-14T13:15:00+00:00,VENDA,-3.0,VENDA,-3.0,True,0.0,2025-10-14T13:00:00+00:00,2025-10-14T13:00:00+00:00,True,db,db,
14/10/2025,Asia,USDJPY,1.2.1,2025-10-14T00:00:00+00:00,2025-10-13T23:30:00+00:00,COMPRA,3.0,COMPRA,3.0,True,0.0,2025-10-13T23:15:00+00:00,2025-10-13T23:15:00+00:00,True,db,db,
14/10/2025,Asia,USDJPY,1.0.1,2025-10-14T00:00:00+00:00,2025-10-13T23:30:00+00:00,COMPRA,3.0,COMPRA,3.0,True,0.0,2025-10-13T23:15:00+00:00,2025-10-13T23:15:00+00:00,True,db,db,
14/10/2025,Europe,EURUSD,1.2.2,2025-10-14T07:00:00+00:00,2025-10-14T06:45:00+00:00,VENDA,-2.0,VENDA,-2.0,True,0.0,2025-10-14T06:30:00+00:00,2025-10-14T06:30:00+00:00,True,db,db,
14/10/2025,Europe,EURUSD,1.0.2,2025-10-14T07:00:00+00:00,2025-10-14T06:45:00+00:00,VENDA,-1.0,VENDA,-1.0,True,0.0,2025-10-14T06:30:00+00:00,2025-10-14T06:30:00+00:00,True,db,db,
13/10/2025,America,XAUUSD,1.0.3,2025-10-13T13:30:00+00:00,2025-10-13T13:15:00+00:00,COMPRA,2.5,COMPRA,2.5,True,0.0,2025-10-13T13:00:00+00:00,2025-10-13T13:00:00+00:00,True,db,db,
13/10/2025,America,XAUUSD,1.2.3,2025-10-13T13:30:00+00:00,2025-10-13T13:15:00+00:00,COMPRA,2.5,COMPRA,2.5,True,0.0,2025-10-13T13:00:00+00:00,2025-10-13T13:00:00+00:00,True,db,db,
13/10/2025,Asia,USDJPY,1.2.1,2025-10-13T00:00:00+00:00,2025-10-12T23:30:00+00:00,FORA,0.0,FORA,0.0,True,0.0,2025-10-10T23:45:00+00:00,2025-10-10T23:45:00+00:00,True,db,db,
13/10/2025,Asia,USDJPY,1.0.1,2025-10-13T00:00:00+00:00,2025-10-12T23:30:00+00:00,FORA,0.0,FORA,0.0,True,0.0,2025-10-10T23:45:00+00:00,2025-10-10T23:45:00+00:00,True,db,db,
13/10/2025,Europe,EURUSD,1.2.2,2025-10-13T07:00:00+00:00,2025-10-13T06:45:00+00:00,COMPRA,1.5,COMPRA,1.5,True,0.0,2025-10-13T06:30:00+00:00,2025-10-13T06:30:00+00:00,True,db,db,
13/10/2025,Europe,EURUSD,1.0.2,2025-10-13T07:00:00+00:00,2025-10-13T06:45:00+00:00,COMPRA,2.5,COMPRA,2.5,True,0.0,2025-10-13T06:30:00+00:00,2025-10-13T06:30:00+00:00,True,db,db,
10/10/2025,America,XAUUSD,1.0.3,2025-10-10T13:30:00+00:00,2025-10-10T13:15:00+00:00,COMPRA,1.0,COMPRA,1.0,True,0.0,2025-10-10T13:00:00+00:00,2025-10-10T13:00:00+00:00,True,db,db,
10/10/2025,America,XAUUSD,1.2.3,2025-10-10T13:30:00+00:00,2025-10-10T13:15:00+00:00,FORA,0.0,FORA,0.0,True,0.0,2025-10-10T13:00:00+00:00,2025-10-10T13:00:00+00:00,True,db,db,
10/10/2025,Asia,USDJPY,1.2.1,2025-10-10T00:00:00+00:00,2025-10-09T23:30:00+00:00,FORA,0.0,FORA,0.0,True,0.0,2025-10-09T23:15:00+00:00,2025-10-09T23:15:00+00:00,True,db,db,
10/10/2025,Asia,USDJPY,1.0.1,2025-10-10T00:00:00+00:00,2025-10-09T23:30:00+00:00,COMPRA,1.0,COMPRA,1.0,True,0.0,2025-10-09T23:15:00+00:00,2025-10-09T23:15:00+00:00,True,db,db,
10/10/2025,Europe,EURUSD,1.2.2,2025-10-10T07:00:00+00:00,2025-10-10T06:45:00+00:00,FORA,0.0,FORA,0.0,True,0.0,2025-10-10T06:30:00+00:00,2025-10-10T06:30:00+00:00,True,db,db,
10/10/2025,Europe,EURUSD,1.0.2,2025-10-10T07:00:00+00:00,2025-10-10T06:45:00+00:00,FORA,0.0,FORA,0.0,True,0.0,2025-10-10T06:30:00+00:00,2025-10-10T06:30:00+00:00,True,db,db,
09/10/2025,America,XAUUSD,1.0.3,2025-10-09T13:30:00+00:00,2025-10-09T13:15:00+00:00,COMPRA,3.5,COMPRA,3.5,True,0.0,2025-10-09T13:00:00+00:00,2025-10-09T13:00:00+00:00,True,db,db,
09/10/2025,America,XAUUSD,1.2.3,2025-10-09T13:30:00+00:00,2025-10-09T13:15:00+00:00,COMPRA,2.5,COMPRA,2.5,True,0.0,2025-10-09T13:00:00+00:00,2025-10-09T13:00:00+00:00,True,db,db,
09/10/2025,Asia,USDJPY,1.2.1,2025-10-09T00:00:00+00:00,2025-10-08T23:30:00+00:00,COMPRA,1.0,COMPRA,1.0,True,0.0,2025-10-08T23:15:00+00:00,2025-10-08T23:15:00+00:00,True,db,db,
09/10/2025,Asia,USDJPY,1.0.1,2025-10-09T00:00:00+00:00,2025-10-08T23:30:00+00:00,COMPRA,2.0,COMPRA,2.0,True,0.0,2025-10-08T23:15:00+00:00,2025-10-08T23:15:00+00:00,True,db,db,
09/10/2025,Europe,EURUSD,1.2.2,2025-10-09T07:00:00+00:00,2025-10-09T06:45:00+00:00,VENDA,-2.0,VENDA,-2.0,True,0.0,2025-10-09T06:30:00+00:00,2025-10-09T06:30:00+00:00,True,db,db,
09/10/2025,Europe,EURUSD,1.0.2,2025-10-09T07:00:00+00:00,2025-10-09T06:45:00+00:00,VENDA,-1.0,VENDA,-1.0,True,0.0,2025-10-09T06:30:00+00:00,2025-10-09T06:30:00+00:00,True,db,db,
08/10/2025,America,XAUUSD,1.0.3,2025-10-08T13:30:00+00:00,2025-10-08T13:15:00+00:00,FORA,0.0,FORA,0.0,True,0.0,2025-10-08T13:00:00+00:00,2025-10-08T13:00:00+00:00,True,db,db,
08/10/2025,America,XAUUSD,1.2.3,2025-10-08T13:30:00+00:00,2025-10-08T13:15:00+00:00,FORA,0.0,FORA,0.0,True,0.0,2025-10-08T13:00:00+00:00,2025-10-08T13:00:00+00:00,True,db,db,
08/10/2025,Asia,USDJPY,1.2.1,2025-10-08T00:00:00+00:00,2025-10-07T23:30:00+00:00,FORA,0.0,FORA,0.0,True,0.0,2025-10-07T23:15:00+00:00,2025-10-07T23:15:00+00:00,True,db,db,
08/10/2025,Asia,USDJPY,1.0.1,2025-10-08T00:00:00+00:00,2025-10-07T23:30:00+00:00,FORA,0.0,FORA,0.0,True,0.0,2025-10-07T23:15:00+00:00,2025-10-07T23:15:00+00:00,True,db,db,
08/10/2025,Europe,EURUSD,1.2.2,2025-10-08T07:00:00+00:00,2025-10-08T06:45:00+00:00,FORA,0.0,FORA,0.0,True,0.0,2025-10-08T06:30:00+00:00,2025-10-08T06:30:00+00:00,True,db,db,
08/10/2025,Europe,EURUSD,1.0.2,2025-10-08T07:00:00+00:00,2025-10-08T06:45:00+00:00,FORA,0.0,FORA,0.0,True,0.0,2025-10-08T06:30:00+00:00,2025-10-08T06:30:00+00:00,True,db,db,
07/10/2025,America,XAUUSD,1.2.3,2025-10-07T13:30:00+00:00,2025-10-07T13:15:00+00:00,FORA,-1.0,FORA,-1.0,True,0.0,2025-10-07T13:00:00+00:00,2025-10-07T13:00:00+00:00,True,db,db,
07/10/2025,America,XAUUSD,1.0.3,2025-10-07T13:30:00+00:00,2025-10-07T13:15:00+00:00,VENDA,-1.0,VENDA,-1.0,True,0.0,2025-10-07T13:00:00+00:00,2025-10-07T13:00:00+00:00,True,db,db,
07/10/2025,Asia,USDJPY,1.0.1,2025-10-07T00:00:00+00:00,2025-10-06T23:30:00+00:00,COMPRA,3.5,COMPRA,3.5,True,0.0,2025-10-06T23:15:00+00:00,2025-10-06T23:15:00+00:00,True,db,db,
07/10/2025,Asia,USDJPY,1.2.1,2025-10-07T00:00:00+00:00,2025-10-06T23:30:00+00:00,COMPRA,3.5,COMPRA,3.5,True,0.0,2025-10-06T23:15:00+00:00,2025-10-06T23:15:00+00:00,True,db,db,
07/10/2025,Europe,EURUSD,1.2.2,2025-10-07T07:00:00+00:00,2025-10-07T06:45:00+00:00,FORA,0.0,FORA,0.0,True,0.0,2025-10-07T06:30:00+00:00,2025-10-07T06:30:00+00:00,True,db,db,
07/10/2025,Europe,EURUSD,1.0.2,2025-10-07T07:00:00+00:00,2025-10-07T06:45:00+00:00,COMPRA,2.0,COMPRA,2.0,True,0.0,2025-10-07T06:30:00+00:00,2025-10-07T06:30:00+00:00,True,db,db,
06/10/2025,America,XAUUSD,1.0.3,2025-10-06T13:30:00+00:00,2025-10-06T13:15:00+00:00,FORA,-0.5,FORA,-0.5,True,0.0,2025-10-06T13:00:00+00:00,2025-10-06T13:00:00+00:00,True,db,db,
06/10/2025,America,XAUUSD,1.2.3,2025-10-06T13:30:00+00:00,2025-10-06T13:15:00+00:00,FORA,1.5,FORA,1.5,True,0.0,2025-10-06T13:00:00+00:00,2025-10-06T13:00:00+00:00,True,db,db,
06/10/2025,Asia,USDJPY,1.2.1,2025-10-06T00:00:00+00:00,2025-10-05T23:30:00+00:00,COMPRA,1.5,COMPRA,1.5,True,0.0,2025-10-03T23:45:00+00:00,2025-10-03T23:45:00+00:00,True,db,db,
06/10/2025,Asia,USDJPY,1.0.1,2025-10-06T00:00:00+00:00,2025-10-05T23:30:00+00:00,FORA,-0.5,FORA,-0.5,True,0.0,2025-10-03T23:45:00+00:00,2025-10-03T23:45:00+00:00,True,db,db,
06/10/2025,Europe,EURUSD,1.2.2,2025-10-06T07:00:00+00:00,2025-10-06T06:45:00+00:00,FORA,0.5,FORA,0.5,True,0.0,2025-10-06T06:30:00+00:00,2025-10-06T06:30:00+00:00,True,db,db,
06/10/2025,Europe,EURUSD,1.0.2,2025-10-06T07:00:00+00:00,2025-10-06T06:45:00+00:00,COMPRA,2.5,COMPRA,2.5,True,0.0,2025-10-06T06:30:00+00:00,2025-10-06T06:30:00+00:00,True,db,db,
03/10/2025,America,XAUUSD,1.2.3,2025-10-03T13:30:00+00:00,2025-10-03T13:15:00+00:00,FORA,1.0,FORA,1.0,True,0.0,2025-10-03T13:00:00+00:00,2025-10-03T13:00:00+00:00,True,db,db,
03/10/2025,America,XAUUSD,1.0.3,2025-10-03T13:30:00+00:00,2025-10-03T13:15:00+00:00,COMPRA,2.0,COMPRA,2.0,True,0.0,2025-10-03T13:00:00+00:00,2025-10-03T13:00:00+00:00,True,db,db,
03/10/2025,Asia,USDJPY,1.2.1,2025-10-03T00:00:00+00:00,2025-10-02T23:30:00+00:00,COMPRA,3.0,COMPRA,3.0,True,0.0,2025-10-02T23:15:00+00:00,2025-10-02T23:15:00+00:00,True,db,db,
03/10/2025,Asia,USDJPY,1.0.1,2025-10-03T00:00:00+00:00,2025-10-02T23:30:00+00:00,COMPRA,3.0,COMPRA,3.0,True,0.0,2025-10-02T23:15:00+00:00,2025-10-02T23:15:00+00:00,True,db,db,
03/10/2025,Europe,EURUSD,1.2.2,2025-10-03T07:00:00+00:00,2025-10-03T06:45:00+00:00,VENDA,-1.5,VENDA,-1.5,True,0.0,2025-10-03T06:30:00+00:00,2025-10-03T06:30:00+00:00,True,db,db,
03/10/2025,Europe,EURUSD,1.0.2,2025-10-03T07:00:00+00:00,2025-10-03T06:45:00+00:00,VENDA,-1.0,VENDA,-1.0,True,0.0,2025-10-03T06:30:00+00:00,2025-10-03T06:30:00+00:00,True,db,db,
02/10/2025,America,XAUUSD,1.0.3,2025-10-02T13:30:00+00:00,2025-10-02T13:15:00+00:00,FORA,0.5,FORA,0.5,True,0.0,2025-10-02T13:00:00+00:00,2025-10-02T13:00:00+00:00,True,db,db,
02/10/2025,America,XAUUSD,1.2.3,2025-10-02T13:30:00+00:00,2025-10-02T13:15:00+00:00,COMPRA,3.5,COMPRA,3.5,True,0.0,2025-10-02T13:00:00+00:00,2025-10-02T13:00:00+00:00,True,db,db,
02/10/2025,Asia,USDJPY,1.2.1,2025-10-02T00:00:00+00:00,2025-10-01T23:30:00+00:00,COMPRA,2.0,COMPRA,2.0,True,0.0,2025-10-01T23:15:00+00:00,2025-10-01T23:15:00+00:00,True,db,db,
02/10/2025,Asia,USDJPY,1.0.1,2025-10-02T00:00:00+00:00,2025-10-01T23:30:00+00:00,COMPRA,2.0,COMPRA,2.0,True,0.0,2025-10-01T23:15:00+00:00,2025-10-01T23:15:00+00:00,True,db,db,
02/10/2025,Europe,EURUSD,1.2.2,2025-10-02T07:00:00+00:00,2025-10-02T06:45:00+00:00,FORA,-0.5,FORA,-0.5,True,0.0,2025-10-02T06:30:00+00:00,2025-10-02T06:30:00+00:00,True,db,db,
02/10/2025,Europe,EURUSD,1.0.2,2025-10-02T07:00:00+00:00,2025-10-02T06:45:00+00:00,COMPRA,1.5,COMPRA,1.5,True,0.0,2025-10-02T06:30:00+00:00,2025-10-02T06:30:00+00:00,True,db,db,
01/10/2025,America,XAUUSD,1.2.3,2025-10-01T13:30:00+00:00,2025-10-01T13:15:00+00:00,FORA,0.0,FORA,0.0,True,0.0,2025-10-01T13:00:00+00:00,2025-10-01T13:00:00+00:00,True,db,db,
01/10/2025,America,XAUUSD,1.0.3,2025-10-01T13:30:00+00:00,2025-10-01T13:15:00+00:00,FORA,0.0,FORA,0.0,True,0.0,2025-10-01T13:00:00+00:00,2025-10-01T13:00:00+00:00,True,db,db,
01/10/2025,Asia,USDJPY,1.2.1,2025-10-01T00:00:00+00:00,2025-09-30T23:30:00+00:00,FORA,0.0,FORA,0.0,True,0.0,2025-09-30T23:15:00+00:00,2025-09-30T23:15:00+00:00,True,db,db,
01/10/2025,Asia,USDJPY,1.0.1,2025-10-01T00:00:00+00:00,2025-09-30T23:30:00+00:00,FORA,0.0,FORA,0.0,True,0.0,2025-09-30T23:15:00+00:00,2025-09-30T23:15:00+00:00,True,db,db,
01/10/2025,Europe,EURUSD,1.2.2,2025-10-01T07:00:00+00:00,2025-10-01T06:45:00+00:00,VENDA,-2.5,VENDA,-2.5,True,0.0,2025-10-01T06:30:00+00:00,2025-10-01T06:30:00+00:00,True,db,db,
01/10/2025,Europe,EURUSD,1.0.2,2025-10-01T07:00:00+00:00,2025-10-01T06:45:00+00:00,VENDA,-2.5,VENDA,-2.5,True,0.0,2025-10-01T06:30:00+00:00,2025-10-01T06:30:00+00:00,True,db,db,
30/09/2025,America,XAUUSD,1.2.3,2025-09-30T13:30:00+00:00,2025-09-30T13:15:00+00:00,FORA,0.0,FORA,0.0,True,0.0,2025-09-30T13:00:00+00:00,2025-09-30T13:00:00+00:00,True,db,db,
30/09/2025,America,XAUUSD,1.0.3,2025-09-30T13:30:00+00:00,2025-09-30T13:15:00+00:00,FORA,0.0,FORA,0.0,True,0.0,2025-09-30T13:00:00+00:00,2025-09-30T13:00:00+00:00,True,db,db,
30/09/2025,Asia,USDJPY,1.2.1,2025-09-30T00:00:00+00:00,2025-09-29T23:30:00+00:00,FORA,0.0,FORA,0.0,True,0.0,2025-09-29T23:15:00+00:00,2025-09-29T23:15:00+00:00,True,db,db,
30/09/2025,Asia,USDJPY,1.0.1,2025-09-30T00:00:00+00:00,2025-09-29T23:30:00+00:00,FORA,0.0,FORA,0.0,True,0.0,2025-09-29T23:15:00+00:00,2025-09-29T23:15:00+00:00,True,db,db,
30/09/2025,Europe,EURUSD,1.2.2,2025-09-30T07:00:00+00:00,2025-09-30T06:45:00+00:00,FORA,-0.5,FORA,-0.5,True,0.0,2025-09-30T06:30:00+00:00,2025-09-30T06:30:00+00:00,True,db,db,
30/09/2025,Europe,EURUSD,1.0.2,2025-09-30T07:00:00+00:00,2025-09-30T06:45:00+00:00,FORA,0.5,FORA,0.5,True,0.0,2025-09-30T06:30:00+00:00,2025-09-30T06:30:00+00:00,True,db,db,
29/09/2025,America,XAUUSD,1.2.3,2025-09-29T13:30:00+00:00,2025-09-29T13:15:00+00:00,FORA,1.0,FORA,1.0,True,0.0,2025-09-29T13:00:00+00:00,2025-09-29T13:00:00+00:00,True,db,db,
29/09/2025,America,XAUUSD,1.0.3,2025-09-29T13:30:00+00:00,2025-09-29T13:15:00+00:00,COMPRA,2.0,COMPRA,2.0,True,0.0,2025-09-29T13:00:00+00:00,2025-09-29T13:00:00+00:00,True,db,db,
29/09/2025,Asia,USDJPY,1.2.1,2025-09-29T00:00:00+00:00,2025-09-28T23:30:00+00:00,VENDA,-3.5,VENDA,-3.5,True,0.0,2025-09-26T23:45:00+00:00,2025-09-26T23:45:00+00:00,True,db,db,
29/09/2025,Asia,USDJPY,1.0.1,2025-09-29T00:00:00+00:00,2025-09-28T23:30:00+00:00,VENDA,-5.5,VENDA,-5.5,True,0.0,2025-09-26T23:45:00+00:00,2025-09-26T23:45:00+00:00,True,db,db,
29/09/2025,Europe,EURUSD,1.2.2,2025-09-29T07:00:00+00:00,2025-09-29T06:45:00+00:00,FORA,0.0,FORA,0.0,True,0.0,2025-09-29T06:30:00+00:00,2025-09-29T06:30:00+00:00,True,db,db,
29/09/2025,Europe,EURUSD,1.0.2,2025-09-29T07:00:00+00:00,2025-09-29T06:45:00+00:00,FORA,0.0,FORA,0.0,True,0.0,2025-09-29T06:30:00+00:00,2025-09-29T06:30:00+00:00,True,db,db,
26/09/2025,America,XAUUSD,1.0.3,2025-09-26T13:30:00+00:00,2025-09-26T13:15:00+00:00,COMPRA,2.0,COMPRA,2.0,True,0.0,2025-09-26T13:00:00+00:00,2025-09-26T13:00:00+00:00,True,db,db,
26/09/2025,America,XAUUSD,1.2.3,2025-09-26T13:30:00+00:00,2025-09-26T13:15:00+00:00,COMPRA,3.0,COMPRA,3.0,True,0.0,2025-09-26T13:00:00+00:00,2025-09-26T13:00:00+00:00,True,db,db,
26/09/2025,Asia,USDJPY,1.2.1,2025-09-26T00:00:00+00:00,2025-09-25T23:30:00+00:00,FORA,0.0,FORA,0.0,True,0.0,2025-09-25T23:15:00+00:00,2025-09-25T23:15:00+00:00,True,db,db,
26/09/2025,Asia,USDJPY,1.0.1,2025-09-26T00:00:00+00:00,2025-09-25T23:30:00+00:00,FORA,0.0,FORA,0.0,True,0.0,2025-09-25T23:15:00+00:00,2025-09-25T23:15:00+00:00,True,db,db,
26/09/2025,Europe,EURUSD,1.2.2,2025-09-26T07:00:00+00:00,2025-09-26T06:45:00+00:00,FORA,0.0,FORA,0.0,True,0.0,2025-09-26T06:30:00+00:00,2025-09-26T06:30:00+00:00,True,db,db,
26/09/2025,Europe,EURUSD,1.0.2,2025-09-26T07:00:00+00:00,2025-09-26T06:45:00+00:00,FORA,0.0,FORA,0.0,True,0.0,2025-09-26T06:30:00+00:00,2025-09-26T06:30:00+00:00,True,db,db,
25/09/2025,America,XAUUSD,1.2.3,2025-09-25T13:30:00+00:00,2025-09-25T13:15:00+00:00,FORA,1.0,FORA,1.0,True,0.0,2025-09-25T13:00:00+00:00,2025-09-25T13:00:00+00:00,True,db,db,
25/09/2025,America,XAUUSD,1.0.3,2025-09-25T13:30:00+00:00,2025-09-25T13:15:00+00:00,COMPRA,2.0,COMPRA,2.0,True,0.0,2025-09-25T13:00:00+00:00,2025-09-25T13:00:00+00:00,True,db,db,
25/09/2025,Asia,USDJPY,1.2.1,2025-09-25T00:00:00+00:00,2025-09-24T23:30:00+00:00,FORA,0.0,FORA,0.0,True,0.0,2025-09-24T23:15:00+00:00,2025-09-24T23:15:00+00:00,True,db,db,
25/09/2025,Asia,USDJPY,1.0.1,2025-09-25T00:00:00+00:00,2025-09-24T23:30:00+00:00,FORA,0.0,FORA,0.0,True,0.0,2025-09-24T23:15:00+00:00,2025-09-24T23:15:00+00:00,True,db,db,
25/09/2025,Europe,EURUSD,1.2.2,2025-09-25T07:00:00+00:00,2025-09-25T06:45:00+00:00,VENDA,-2.5,VENDA,-2.5,True,0.0,2025-09-25T06:30:00+00:00,2025-09-25T06:30:00+00:00,True,db,db,
25/09/2025,Europe,EURUSD,1.0.2,2025-09-25T07:00:00+00:00,2025-09-25T06:45:00+00:00,FORA,-0.5,FORA,-0.5,True,0.0,2025-09-25T06:30:00+00:00,2025-09-25T06:30:00+00:00,True,db,db,
24/09/2025,America,XAUUSD,1.0.3,2025-09-24T13:30:00+00:00,2025-09-24T13:15:00+00:00,VENDA,-2.0,VENDA,-2.0,True,0.0,2025-09-24T13:00:00+00:00,2025-09-24T13:00:00+00:00,True,db,db,
24/09/2025,America,XAUUSD,1.2.3,2025-09-24T13:30:00+00:00,2025-09-24T13:15:00+00:00,FORA,0.0,FORA,0.0,True,0.0,2025-09-24T13:00:00+00:00,2025-09-24T13:00:00+00:00,True,db,db,
24/09/2025,Asia,USDJPY,1.0.1,2025-09-24T00:00:00+00:00,2025-09-23T23:30:00+00:00,VENDA,-2.5,VENDA,-2.5,True,0.0,2025-09-23T23:15:00+00:00,2025-09-23T23:15:00+00:00,True,db,db,
24/09/2025,Asia,USDJPY,1.2.1,2025-09-24T00:00:00+00:00,2025-09-23T23:30:00+00:00,VENDA,-2.5,VENDA,-2.5,True,0.0,2025-09-23T23:15:00+00:00,2025-09-23T23:15:00+00:00,True,db,db,
24/09/2025,Europe,EURUSD,1.2.2,2025-09-24T07:00:00+00:00,2025-09-24T06:45:00+00:00,VENDA,-2.5,VENDA,-2.5,True,0.0,2025-09-24T06:30:00+00:00,2025-09-24T06:30:00+00:00,True,db,db,
24/09/2025,Europe,EURUSD,1.0.2,2025-09-24T07:00:00+00:00,2025-09-24T06:45:00+00:00,VENDA,-1.5,VENDA,-1.5,True,0.0,2025-09-24T06:30:00+00:00,2025-09-24T06:30:00+00:00,True,db,db,
23/09/2025,America,XAUUSD,1.2.3,2025-09-23T13:30:00+00:00,2025-09-23T13:15:00+00:00,FORA,0.0,FORA,0.0,True,0.0,2025-09-23T13:00:00+00:00,2025-09-23T13:00:00+00:00,True,db,db,
23/09/2025,America,XAUUSD,1.0.3,2025-09-23T13:30:00+00:00,2025-09-23T13:15:00+00:00,FORA,0.0,FORA,0.0,True,0.0,2025-09-23T13:00:00+00:00,2025-09-23T13:00:00+00:00,True,db,db,
23/09/2025,Asia,USDJPY,1.2.1,2025-09-23T00:00:00+00:00,2025-09-22T23:30:00+00:00,VENDA,-3.0,VENDA,-3.0,True,0.0,2025-09-22T23:15:00+00:00,2025-09-22T23:15:00+00:00,True,db,db,
23/09/2025,Asia,USDJPY,1.0.1,2025-09-23T00:00:00+00:00,2025-09-22T23:30:00+00:00,VENDA,-3.0,VENDA,-3.0,True,0.0,2025-09-22T23:15:00+00:00,2025-09-22T23:15:00+00:00,True,db,db,
23/09/2025,Europe,EURUSD,1.2.2,2025-09-23T07:00:00+00:00,2025-09-23T06:45:00+00:00,FORA,0.0,FORA,0.0,True,0.0,2025-09-23T06:30:00+00:00,2025-09-23T06:30:00+00:00,True,db,db,
23/09/2025,Europe,EURUSD,1.0.2,2025-09-23T07:00:00+00:00,2025-09-23T06:45:00+00:00,FORA,0.0,FORA,0.0,True,0.0,2025-09-23T06:30:00+00:00,2025-09-23T06:30:00+00:00,True,db,db,
22/09/2025,America,XAUUSD,1.0.3,2025-09-22T13:30:00+00:00,2025-09-22T13:15:00+00:00,FORA,0.0,FORA,0.0,True,0.0,2025-09-22T13:00:00+00:00,2025-09-22T13:00:00+00:00,True,db,db,
22/09/2025,America,XAUUSD,1.2.3,2025-09-22T13:30:00+00:00,2025-09-22T13:15:00+00:00,FORA,0.0,FORA,0.0,True,0.0,2025-09-22T13:00:00+00:00,2025-09-22T13:00:00+00:00,True,db,db,
22/09/2025,Asia,USDJPY,1.0.1,2025-09-22T00:00:00+00:00,2025-09-21T23:30:00+00:00,FORA,-0.5,FORA,-0.5,True,0.0,2025-09-19T23:45:00+00:00,2025-09-19T23:45:00+00:00,True,db,db,
22/09/2025,Asia,USDJPY,1.2.1,2025-09-22T00:00:00+00:00,2025-09-21T23:30:00+00:00,COMPRA,1.5,COMPRA,1.5,True,0.0,2025-09-19T23:45:00+00:00,2025-09-19T23:45:00+00:00,True,db,db,
22/09/2025,Europe,EURUSD,1.2.2,2025-09-22T07:00:00+00:00,2025-09-22T06:45:00+00:00,VENDA,-1.5,VENDA,-1.5,True,0.0,2025-09-22T06:30:00+00:00,2025-09-22T06:30:00+00:00,True,db,db,
22/09/2025,Europe,EURUSD,1.0.2,2025-09-22T07:00:00+00:00,2025-09-22T06:45:00+00:00,FORA,-0.5,FORA,-0.5,True,0.0,2025-09-22T06:30:00+00:00,2025-09-22T06:30:00+00:00,True,db,db,
19/09/2025,America,XAUUSD,1.2.3,2025-09-19T13:30:00+00:00,2025-09-19T13:15:00+00:00,FORA,1.0,FORA,1.0,True,0.0,2025-09-19T13:00:00+00:00,2025-09-19T13:00:00+00:00,True,db,db,
19/09/2025,Asia,USDJPY,1.2.1,2025-09-19T00:00:00+00:00,2025-09-18T23:30:00+00:00,FORA,0.0,FORA,0.0,True,0.0,2025-09-18T23:15:00+00:00,2025-09-18T23:15:00+00:00,True,db,db,
19/09/2025,Asia,USDJPY,1.0.1,2025-09-19T00:00:00+00:00,2025-09-18T23:30:00+00:00,FORA,0.0,FORA,0.0,True,0.0,2025-09-18T23:15:00+00:00,2025-09-18T23:15:00+00:00,True,db,db,
19/09/2025,Europe,EURUSD,1.2.2,2025-09-19T07:00:00+00:00,2025-09-19T06:45:00+00:00,FORA,-0.5,FORA,-0.5,True,0.0,2025-09-19T06:30:00+00:00,2025-09-19T06:30:00+00:00,True,db,db,
19/09/2025,Europe,EURUSD,1.0.2,2025-09-19T07:00:00+00:00,2025-09-19T06:45:00+00:00,FORA,0.5,FORA,0.5,True,0.0,2025-09-19T06:30:00+00:00,2025-09-19T06:30:00+00:00,True,db,db,
18/09/2025,America,XAUUSD,1.0.3,2025-09-18T13:30:00+00:00,2025-09-18T13:15:00+00:00,VENDA,-1.0,VENDA,-1.0,True,0.0,2025-09-18T13:00:00+00:00,2025-09-18T13:00:00+00:00,True,db,db,
18/09/2025,America,XAUUSD,1.2.3,2025-09-18T13:30:00+00:00,2025-09-18T13:15:00+00:00,COMPRA,2.0,COMPRA,2.0,True,0.0,2025-09-18T13:00:00+00:00,2025-09-18T13:00:00+00:00,True,db,db,
18/09/2025,Asia,USDJPY,1.2.1,2025-09-18T00:00:00+00:00,2025-09-17T23:30:00+00:00,COMPRA,3.0,COMPRA,3.0,True,0.0,2025-09-17T23:15:00+00:00,2025-09-17T23:15:00+00:00,True,db,db,
18/09/2025,Asia,USDJPY,1.0.1,2025-09-18T00:00:00+00:00,2025-09-17T23:30:00+00:00,COMPRA,1.0,COMPRA,1.0,True,0.0,2025-09-17T23:15:00+00:00,2025-09-17T23:15:00+00:00,True,db,db,
18/09/2025,Europe,EURUSD,1.2.2,2025-09-18T07:00:00+00:00,2025-09-18T06:45:00+00:00,VENDA,-1.0,VENDA,-1.0,True,0.0,2025-09-18T06:30:00+00:00,2025-09-18T06:30:00+00:00,True,db,db,
18/09/2025,Europe,EURUSD,1.0.2,2025-09-18T07:00:00+00:00,2025-09-18T06:45:00+00:00,COMPRA,1.0,COMPRA,1.0,True,0.0,2025-09-18T06:30:00+00:00,2025-09-18T06:30:00+00:00,True,db,db,
17/09/2025,America,XAUUSD,1.2.3,2025-09-17T13:30:00+00:00,2025-09-17T13:15:00+00:00,FORA,-1.5,FORA,-1.5,True,0.0,2025-09-17T13:00:00+00:00,2025-09-17T13:00:00+00:00,True,db,db,
17/09/2025,America,XAUUSD,1.0.3,2025-09-17T13:30:00+00:00,2025-09-17T13:15:00+00:00,FORA,0.0,FORA,0.0,True,0.0,2025-09-17T13:00:00+00:00,2025-09-17T13:00:00+00:00,True,db,db,
17/09/2025,Asia,USDJPY,1.2.1,2025-09-17T00:00:00+00:00,2025-09-16T23:30:00+00:00,VENDA,-1.5,VENDA,-1.5,True,0.0,2025-09-16T23:15:00+00:00,2025-09-16T23:15:00+00:00,True,db,db,
17/09/2025,Asia,USDJPY,1.0.1,2025-09-17T00:00:00+00:00,2025-09-16T23:30:00+00:00,VENDA,-1.5,VENDA,-1.5,True,0.0,2025-09-16T23:15:00+00:00,2025-09-16T23:15:00+00:00,True,db,db,
17/09/2025,Europe,EURUSD,1.2.2,2025-09-17T07:00:00+00:00,2025-09-17T06:45:00+00:00,FORA,0.0,FORA,0.0,True,0.0,2025-09-17T06:30:00+00:00,2025-09-17T06:30:00+00:00,True,db,db,
17/09/2025,Europe,EURUSD,1.0.2,2025-09-17T07:00:00+00:00,2025-09-17T06:45:00+00:00,FORA,0.0,FORA,0.0,True,0.0,2025-09-17T06:30:00+00:00,2025-09-17T06:30:00+00:00,True,db,db,
16/09/2025,America,XAUUSD,1.2.3,2025-09-16T13:30:00+00:00,2025-09-16T13:15:00+00:00,FORA,0.0,FORA,0.0,True,0.0,2025-09-16T13:00:00+00:00,2025-09-16T13:00:00+00:00,True,db,db,
16/09/2025,America,XAUUSD,1.0.3,2025-09-16T13:30:00+00:00,2025-09-16T13:15:00+00:00,FORA,0.0,FORA,0.0,True,0.0,2025-09-16T13:00:00+00:00,2025-09-16T13:00:00+00:00,True,db,db,
16/09/2025,Asia,USDJPY,1.2.1,2025-09-16T00:00:00+00:00,2025-09-15T23:30:00+00:00,FORA,0.0,FORA,0.0,True,0.0,2025-09-15T23:15:00+00:00,2025-09-15T23:15:00+00:00,True,db,db,
16/09/2025,Asia,USDJPY,1.0.1,2025-09-16T00:00:00+00:00,2025-09-15T23:30:00+00:00,VENDA,-1.0,VENDA,-1.0,True,0.0,2025-09-15T23:15:00+00:00,2025-09-15T23:15:00+00:00,True,db,db,
16/09/2025,Europe,EURUSD,1.2.2,2025-09-16T07:00:00+00:00,2025-09-16T06:45:00+00:00,FORA,0.5,FORA,0.5,True,0.0,2025-09-16T06:30:00+00:00,2025-09-16T06:30:00+00:00,True,db,db,
16/09/2025,Europe,EURUSD,1.0.2,2025-09-16T07:00:00+00:00,2025-09-16T06:45:00+00:00,COMPRA,1.5,COMPRA,1.5,True,0.0,2025-09-16T06:30:00+00:00,2025-09-16T06:30:00+00:00,True,db,db,
15/09/2025,America,XAUUSD,1.0.3,2025-09-15T13:30:00+00:00,2025-09-15T13:15:00+00:00,FORA,0.0,FORA,0.0,True,0.0,2025-09-15T13:00:00+00:00,2025-09-15T13:00:00+00:00,True,db,db,
15/09/2025,America,XAUUSD,1.2.3,2025-09-15T13:30:00+00:00,2025-09-15T13:15:00+00:00,FORA,0.0,FORA,0.0,True,0.0,2025-09-15T13:00:00+00:00,2025-09-15T13:00:00+00:00,True,db,db,
15/09/2025,Asia,USDJPY,1.0.1,2025-09-15T00:00:00+00:00,2025-09-14T23:30:00+00:00,VENDA,-1.0,VENDA,-1.0,True,0.0,2025-09-12T23:45:00+00:00,2025-09-12T23:45:00+00:00,True,db,db,
15/09/2025,Asia,USDJPY,1.2.1,2025-09-15T00:00:00+00:00,2025-09-14T23:30:00+00:00,COMPRA,1.0,COMPRA,1.0,True,0.0,2025-09-12T23:45:00+00:00,2025-09-12T23:45:00+00:00,True,db,db,
15/09/2025,Europe,EURUSD,1.2.2,2025-09-15T07:00:00+00:00,2025-09-15T06:45:00+00:00,COMPRA,1.5,COMPRA,1.5,True,0.0,2025-09-15T06:30:00+00:00,2025-09-15T06:30:00+00:00,True,db,db,
15/09/2025,Europe,EURUSD,1.0.2,2025-09-15T07:00:00+00:00,2025-09-15T06:45:00+00:00,COMPRA,1.5,COMPRA,1.5,True,0.0,2025-09-15T06:30:00+00:00,2025-09-15T06:30:00+00:00,True,db,db,
12/09/2025,America,XAUUSD,1.2.3,2025-09-12T13:30:00+00:00,2025-09-12T13:15:00+00:00,COMPRA,2.0,COMPRA,2.0,True,0.0,2025-09-12T13:00:00+00:00,2025-09-12T13:00:00+00:00,True,db,db,
12/09/2025,America,XAUUSD,1.0.3,2025-09-12T13:30:00+00:00,2025-09-12T13:15:00+00:00,COMPRA,3.0,COMPRA,3.0,True,0.0,2025-09-12T13:00:00+00:00,2025-09-12T13:00:00+00:00,True,db,db,
12/09/2025,Asia,USDJPY,1.2.1,2025-09-12T00:00:00+00:00,2025-09-11T23:30:00+00:00,VENDA,-2.5,VENDA,-2.5,True,0.0,2025-09-11T23:15:00+00:00,2025-09-11T23:15:00+00:00,True,db,db,
12/09/2025,Asia,USDJPY,1.0.1,2025-09-12T00:00:00+00:00,2025-09-11T23:30:00+00:00,VENDA,-2.5,VENDA,-2.5,True,0.0,2025-09-11T23:15:00+00:00,2025-09-11T23:15:00+00:00,True,db,db,
12/09/2025,Europe,EURUSD,1.2.2,2025-09-12T07:00:00+00:00,2025-09-12T06:45:00+00:00,FORA,0.0,FORA,0.0,True,0.0,2025-09-12T06:30:00+00:00,2025-09-12T06:30:00+00:00,True,db,db,
12/09/2025,Europe,EURUSD,1.0.2,2025-09-12T07:00:00+00:00,2025-09-12T06:45:00+00:00,COMPRA,2.5,COMPRA,2.5,True,0.0,2025-09-12T06:30:00+00:00,2025-09-12T06:30:00+00:00,True,db,db,
11/09/2025,America,XAUUSD,1.2.3,2025-09-11T13:30:00+00:00,2025-09-11T13:15:00+00:00,VENDA,-2.5,VENDA,-2.5,True,0.0,2025-09-11T13:00:00+00:00,2025-09-11T13:00:00+00:00,True,db,db,
11/09/2025,America,XAUUSD,1.0.3,2025-09-11T13:30:00+00:00,2025-09-11T13:15:00+00:00,VENDA,-1.5,VENDA,-1.5,True,0.0,2025-09-11T13:00:00+00:00,2025-09-11T13:00:00+00:00,True,db,db,
11/09/2025,Asia,USDJPY,1.0.1,2025-09-11T00:00:00+00:00,2025-09-10T23:30:00+00:00,COMPRA,1.0,COMPRA,1.0,True,0.0,2025-09-10T23:15:00+00:00,2025-09-10T23:15:00+00:00,True,db,db,
11/09/2025,Asia,USDJPY,1.2.1,2025-09-11T00:00:00+00:00,2025-09-10T23:30:00+00:00,COMPRA,1.0,COMPRA,1.0,True,0.0,2025-09-10T23:15:00+00:00,2025-09-10T23:15:00+00:00,True,db,db,
11/09/2025,Europe,EURUSD,1.2.2,2025-09-11T07:00:00+00:00,2025-09-11T06:45:00+00:00,VENDA,-3.0,VENDA,-3.0,True,0.0,2025-09-11T06:30:00+00:00,2025-09-11T06:30:00+00:00,True,db,db,
11/09/2025,Europe,EURUSD,1.0.2,2025-09-11T07:00:00+00:00,2025-09-11T06:45:00+00:00,VENDA,-3.0,VENDA,-3.0,True,0.0,2025-09-11T06:30:00+00:00,2025-09-11T06:30:00+00:00,True,db,db,
10/09/2025,America,XAUUSD,1.0.3,2025-09-10T13:30:00+00:00,2025-09-10T13:15:00+00:00,COMPRA,2.5,COMPRA,2.5,True,0.0,2025-09-10T13:00:00+00:00,2025-09-10T13:00:00+00:00,True,db,db,
10/09/2025,America,XAUUSD,1.2.3,2025-09-10T13:30:00+00:00,2025-09-10T13:15:00+00:00,FORA,1.5,FORA,1.5,True,0.0,2025-09-10T13:00:00+00:00,2025-09-10T13:00:00+00:00,True,db,db,
10/09/2025,Asia,USDJPY,1.0.1,2025-09-10T00:00:00+00:00,2025-09-09T23:30:00+00:00,FORA,0.0,FORA,0.0,True,0.0,2025-09-09T23:15:00+00:00,2025-09-09T23:15:00+00:00,True,db,db,
10/09/2025,Asia,USDJPY,1.2.1,2025-09-10T00:00:00+00:00,2025-09-09T23:30:00+00:00,FORA,0.0,FORA,0.0,True,0.0,2025-09-09T23:15:00+00:00,2025-09-09T23:15:00+00:00,True,db,db,
10/09/2025,Europe,EURUSD,1.2.2,2025-09-10T07:00:00+00:00,2025-09-10T06:45:00+00:00,FORA,0.0,FORA,0.0,True,0.0,2025-09-10T06:30:00+00:00,2025-09-10T06:30:00+00:00,True,db,db,
10/09/2025,Europe,EURUSD,1.0.2,2025-09-10T07:00:00+00:00,2025-09-10T06:45:00+00:00,FORA,-0.5,FORA,-0.5,True,0.0,2025-09-10T06:30:00+00:00,2025-09-10T06:30:00+00:00,True,db,db,
09/09/2025,America,XAUUSD,1.0.3,2025-09-09T13:30:00+00:00,2025-09-09T13:15:00+00:00,COMPRA,2.5,COMPRA,2.5,True,0.0,2025-09-09T13:00:00+00:00,2025-09-09T13:00:00+00:00,True,db,db,
09/09/2025,America,XAUUSD,1.2.3,2025-09-09T13:30:00+00:00,2025-09-09T13:15:00+00:00,COMPRA,2.5,COMPRA,2.5,True,0.0,2025-09-09T13:00:00+00:00,2025-09-09T13:00:00+00:00,True,db,db,
09/09/2025,Asia,USDJPY,1.0.1,2025-09-09T00:00:00+00:00,2025-09-08T23:30:00+00:00,VENDA,-3.0,VENDA,-3.0,True,0.0,2025-09-08T23:15:00+00:00,2025-09-08T23:15:00+00:00,True,db,db,
09/09/2025,Asia,USDJPY,1.2.1,2025-09-09T00:00:00+00:00,2025-09-08T23:30:00+00:00,VENDA,-2.0,VENDA,-2.0,True,0.0,2025-09-08T23:15:00+00:00,2025-09-08T23:15:00+00:00,True,db,db,
09/09/2025,Europe,EURUSD,1.2.2,2025-09-09T07:00:00+00:00,2025-09-09T06:45:00+00:00,FORA,0.0,FORA,0.0,True,0.0,2025-09-09T06:30:00+00:00,2025-09-09T06:30:00+00:00,True,db,db,
09/09/2025,Europe,EURUSD,1.0.2,2025-09-09T07:00:00+00:00,2025-09-09T06:45:00+00:00,FORA,0.0,FORA,0.0,True,0.0,2025-09-09T06:30:00+00:00,2025-09-09T06:30:00+00:00,True,db,db,
08/09/2025,America,XAUUSD,1.2.3,2025-09-08T13:30:00+00:00,2025-09-08T13:15:00+00:00,FORA,0.0,FORA,0.0,True,0.0,2025-09-08T13:00:00+00:00,2025-09-08T13:00:00+00:00,True,db,db,
08/09/2025,America,XAUUSD,1.0.3,2025-09-08T13:30:00+00:00,2025-09-08T13:15:00+00:00,FORA,0.0,FORA,0.0,True,0.0,2025-09-08T13:00:00+00:00,2025-09-08T13:00:00+00:00,True,db,db,
08/09/2025,Asia,USDJPY,1.2.1,2025-09-08T00:00:00+00:00,2025-09-07T23:30:00+00:00,VENDA,-1.5,VENDA,-1.5,True,0.0,2025-09-05T23:45:00+00:00,2025-09-05T23:45:00+00:00,True,db,db,
08/09/2025,Asia,USDJPY,1.0.1,2025-09-08T00:00:00+00:00,2025-09-07T23:30:00+00:00,VENDA,-1.5,VENDA,-1.5,True,0.0,2025-09-05T23:45:00+00:00,2025-09-05T23:45:00+00:00,True,db,db,
08/09/2025,Europe,EURUSD,1.2.2,2025-09-08T07:00:00+00:00,2025-09-08T06:45:00+00:00,VENDA,-2.0,VENDA,-2.0,True,0.0,2025-09-08T06:30:00+00:00,2025-09-08T06:30:00+00:00,True,db,db,
08/09/2025,Europe,EURUSD,1.0.2,2025-09-08T07:00:00+00:00,2025-09-08T06:45:00+00:00,VENDA,-1.0,VENDA,-1.0,True,0.0,2025-09-08T06:30:00+00:00,2025-09-08T06:30:00+00:00,True,db,db,
05/09/2025,America,XAUUSD,1.2.3,2025-09-05T13:30:00+00:00,2025-09-05T13:15:00+00:00,VENDA,-2.0,VENDA,-2.0,True,0.0,2025-09-05T13:00:00+00:00,2025-09-05T13:00:00+00:00,True,db,db,
05/09/2025,America,XAUUSD,1.0.3,2025-09-05T13:30:00+00:00,2025-09-05T13:15:00+00:00,VENDA,-1.0,VENDA,-1.0,True,0.0,2025-09-05T13:00:00+00:00,2025-09-05T13:00:00+00:00,True,db,db,
05/09/2025,Asia,USDJPY,1.2.1,2025-09-05T00:00:00+00:00,2025-09-04T23:30:00+00:00,FORA,0.0,FORA,0.0,True,0.0,2025-09-04T23:15:00+00:00,2025-09-04T23:15:00+00:00,True,db,db,
05/09/2025,Asia,USDJPY,1.0.1,2025-09-05T00:00:00+00:00,2025-09-04T23:30:00+00:00,VENDA,-2.0,VENDA,-2.0,True,0.0,2025-09-04T23:15:00+00:00,2025-09-04T23:15:00+00:00,True,db,db,
05/09/2025,Europe,EURUSD,1.2.2,2025-09-05T07:00:00+00:00,2025-09-05T06:45:00+00:00,VENDA,-1.5,VENDA,-1.5,True,0.0,2025-09-05T06:30:00+00:00,2025-09-05T06:30:00+00:00,True,db,db,
05/09/2025,Europe,EURUSD,1.0.2,2025-09-05T07:00:00+00:00,2025-09-05T06:45:00+00:00,VENDA,-1.5,VENDA,-1.5,True,0.0,2025-09-05T06:30:00+00:00,2025-09-05T06:30:00+00:00,True,db,db,
04/09/2025,America,XAUUSD,1.0.3,2025-09-04T13:30:00+00:00,2025-09-04T13:15:00+00:00,FORA,0.0,FORA,0.0,True,0.0,2025-09-04T13:00:00+00:00,2025-09-04T13:00:00+00:00,True,db,db,
04/09/2025,America,XAUUSD,1.2.3,2025-09-04T13:30:00+00:00,2025-09-04T13:15:00+00:00,COMPRA,2.0,COMPRA,2.0,True,0.0,2025-09-04T13:00:00+00:00,2025-09-04T13:00:00+00:00,True,db,db,
04/09/2025,Asia,USDJPY,1.0.1,2025-09-04T00:00:00+00:00,2025-09-03T23:30:00+00:00,VENDA,-1.0,VENDA,-1.0,True,0.0,2025-09-03T23:15:00+00:00,2025-09-03T23:15:00+00:00,True,db,db,
04/09/2025,Asia,USDJPY,1.2.1,2025-09-04T00:00:00+00:00,2025-09-03T23:30:00+00:00,FORA,0.0,FORA,0.0,True,0.0,2025-09-03T23:15:00+00:00,2025-09-03T23:15:00+00:00,True,db,db,
04/09/2025,Europe,EURUSD,1.2.2,2025-09-04T07:00:00+00:00,2025-09-04T06:45:00+00:00,FORA,-0.5,FORA,-0.5,True,0.0,2025-09-04T06:30:00+00:00,2025-09-04T06:30:00+00:00,True,db,db,
04/09/2025,Europe,EURUSD,1.0.2,2025-09-04T07:00:00+00:00,2025-09-04T06:45:00+00:00,FORA,0.5,FORA,0.5,True,0.0,2025-09-04T06:30:00+00:00,2025-09-04T06:30:00+00:00,True,db,db,
03/09/2025,America,XAUUSD,1.0.3,2025-09-03T13:30:00+00:00,2025-09-03T13:15:00+00:00,COMPRA,1.0,COMPRA,1.0,True,0.0,2025-09-03T13:00:00+00:00,2025-09-03T13:00:00+00:00,True,db,db,
03/09/2025,America,XAUUSD,1.2.3,2025-09-03T13:30:00+00:00,2025-09-03T13:15:00+00:00,FORA,1.0,FORA,1.0,True,0.0,2025-09-03T13:00:00+00:00,2025-09-03T13:00:00+00:00,True,db,db,
03/09/2025,Asia,USDJPY,1.0.1,2025-09-03T00:00:00+00:00,2025-09-02T23:30:00+00:00,COMPRA,2.5,COMPRA,2.5,True,0.0,2025-09-02T23:15:00+00:00,2025-09-02T23:15:00+00:00,True,db,db,
03/09/2025,Asia,USDJPY,1.2.1,2025-09-03T00:00:00+00:00,2025-09-02T23:30:00+00:00,COMPRA,1.5,COMPRA,1.5,True,0.0,2025-09-02T23:15:00+00:00,2025-09-02T23:15:00+00:00,True,db,db,
03/09/2025,Europe,EURUSD,1.2.2,2025-09-03T07:00:00+00:00,2025-09-03T06:45:00+00:00,VENDA,-1.0,VENDA,-1.0,True,0.0,2025-09-03T06:30:00+00:00,2025-09-03T06:30:00+00:00,True,db,db,
03/09/2025,Europe,EURUSD,1.0.2,2025-09-03T07:00:00+00:00,2025-09-03T06:45:00+00:00,FORA,0.0,FORA,0.0,True,0.0,2025-09-03T06:30:00+00:00,2025-09-03T06:30:00+00:00,True,db,db,
02/09/2025,America,XAUUSD,1.0.3,2025-09-02T13:30:00+00:00,2025-09-02T13:15:00+00:00,FORA,0.0,FORA,0.0,True,0.0,2025-09-02T13:00:00+00:00,2025-09-02T13:00:00+00:00,True,db,db,
02/09/2025,America,XAUUSD,1.2.3,2025-09-02T13:30:00+00:00,2025-09-02T13:15:00+00:00,FORA,1.0,FORA,1.0,True,0.0,2025-09-02T13:00:00+00:00,2025-09-02T13:00:00+00:00,True,db,db,
02/09/2025,Asia,USDJPY,1.0.1,2025-09-02T00:00:00+00:00,2025-09-01T23:30:00+00:00,FORA,0.0,FORA,0.0,True,0.0,2025-09-01T23:15:00+00:00,2025-09-01T23:15:00+00:00,True,db,db,
02/09/2025,Asia,USDJPY,1.2.1,2025-09-02T00:00:00+00:00,2025-09-01T23:30:00+00:00,FORA,0.0,FORA,0.0,True,0.0,2025-09-01T23:15:00+00:00,2025-09-01T23:15:00+00:00,True,db,db,
02/09/2025,Europe,EURUSD,1.2.2,2025-09-02T07:00:00+00:00,2025-09-02T06:45:00+00:00,FORA,0.5,FORA,0.5,True,0.0,2025-09-02T06:30:00+00:00,2025-09-02T06:30:00+00:00,True,db,db,
02/09/2025,Europe,EURUSD,1.0.2,2025-09-02T07:00:00+00:00,2025-09-02T06:45:00+00:00,COMPRA,2.5,COMPRA,2.5,True,0.0,2025-09-02T06:30:00+00:00,2025-09-02T06:30:00+00:00,True,db,db,
01/09/2025,America,XAUUSD,1.0.3,2025-09-01T13:30:00+00:00,2025-09-01T13:15:00+00:00,FORA,0.0,FORA,0.0,True,0.0,2025-09-01T13:00:00+00:00,2025-09-01T13:00:00+00:00,True,db,db,
01/09/2025,America,XAUUSD,1.2.3,2025-09-01T13:30:00+00:00,2025-09-01T13:15:00+00:00,COMPRA,2.0,COMPRA,2.0,True,0.0,2025-09-01T13:00:00+00:00,2025-09-01T13:00:00+00:00,True,db,db,
01/09/2025,Asia,USDJPY,1.2.1,2025-09-01T00:00:00+00:00,2025-08-31T23:30:00+00:00,VENDA,-6.5,VENDA,-6.5,True,0.0,2025-08-29T23:45:00+00:00,2025-08-29T23:45:00+00:00,True,db,db,
01/09/2025,Asia,USDJPY,1.0.1,2025-09-01T00:00:00+00:00,2025-08-31T23:30:00+00:00,VENDA,-6.5,VENDA,-6.5,True,0.0,2025-08-29T23:45:00+00:00,2025-08-29T23:45:00+00:00,True,db,db,
01/09/2025,Europe,EURUSD,1.2.2,2025-09-01T07:00:00+00:00,2025-09-01T06:45:00+00:00,FORA,0.0,FORA,0.0,True,0.0,2025-09-01T06:30:00+00:00,2025-09-01T06:30:00+00:00,True,db,db,
01/09/2025,Europe,EURUSD,1.0.2,2025-09-01T07:00:00+00:00,2025-09-01T06:45:00+00:00,FORA,0.0,FORA,0.0,True,0.0,2025-09-01T06:30:00+00:00,2025-09-01T06:30:00+00:00,True,db,db,
29/08/2025,America,XAUUSD,1.0.3,2025-08-29T13:30:00+00:00,2025-08-29T13:15:00+00:00,VENDA,-5.5,VENDA,-5.5,True,0.0,2025-08-29T13:00:00+00:00,2025-08-29T13:00:00+00:00,True,db,db,
29/08/2025,America,XAUUSD,1.2.3,2025-08-29T13:30:00+00:00,2025-08-29T13:15:00+00:00,VENDA,-3.0,VENDA,-3.0,True,0.0,2025-08-29T13:00:00+00:00,2025-08-29T13:00:00+00:00,True,db,db,
29/08/2025,Asia,USDJPY,1.0.1,2025-08-29T00:00:00+00:00,2025-08-28T23:30:00+00:00,VENDA,-1.0,VENDA,-1.0,True,0.0,2025-08-28T23:15:00+00:00,2025-08-28T23:15:00+00:00,True,db,db,
29/08/2025,Asia,USDJPY,1.2.1,2025-08-29T00:00:00+00:00,2025-08-28T23:30:00+00:00,VENDA,-1.0,VENDA,-1.0,True,0.0,2025-08-28T23:15:00+00:00,2025-08-28T23:15:00+00:00,True,db,db,
29/08/2025,Europe,EURUSD,1.2.2,2025-08-29T07:00:00+00:00,2025-08-29T06:45:00+00:00,FORA,-0.5,FORA,-0.5,True,0.0,2025-08-29T06:30:00+00:00,2025-08-29T06:30:00+00:00,True,db,db,
29/08/2025,Europe,EURUSD,1.0.2,2025-08-29T07:00:00+00:00,2025-08-29T06:45:00+00:00,COMPRA,1.5,COMPRA,1.5,True,0.0,2025-08-29T06:30:00+00:00,2025-08-29T06:30:00+00:00,True,db,db,
28/08/2025,America,XAUUSD,1.0.3,2025-08-28T13:30:00+00:00,2025-08-28T13:15:00+00:00,FORA,0.0,FORA,0.0,True,0.0,2025-08-28T13:00:00+00:00,2025-08-28T13:00:00+00:00,True,db,db,
28/08/2025,America,XAUUSD,1.2.3,2025-08-28T13:30:00+00:00,2025-08-28T13:15:00+00:00,COMPRA,2.0,COMPRA,2.0,True,0.0,2025-08-28T13:00:00+00:00,2025-08-28T13:00:00+00:00,True,db,db,
28/08/2025,Asia,USDJPY,1.2.1,2025-08-28T00:00:00+00:00,2025-08-27T23:30:00+00:00,FORA,0.0,FORA,0.0,True,0.0,2025-08-27T23:15:00+00:00,2025-08-27T23:15:00+00:00,True,db,db,
28/08/2025,Europe,EURUSD,1.2.2,2025-08-28T07:00:00+00:00,2025-08-28T06:45:00+00:00,FORA,0.0,FORA,0.0,True,0.0,2025-08-28T06:30:00+00:00,2025-08-28T06:30:00+00:00,True,db,db,
28/08/2025,Europe,EURUSD,1.0.2,2025-08-28T07:00:00+00:00,2025-08-28T06:45:00+00:00,FORA,0.0,FORA,0.0,True,0.0,2025-08-28T06:30:00+00:00,2025-08-28T06:30:00+00:00,True,db,db,
27/08/2025,America,XAUUSD,1.2.3,2025-08-27T13:30:00+00:00,2025-08-27T13:15:00+00:00,FORA,-1.0,FORA,-1.0,True,0.0,2025-08-27T13:00:00+00:00,2025-08-27T13:00:00+00:00,True,db,db,
27/08/2025,America,XAUUSD,1.0.3,2025-08-27T13:30:00+00:00,2025-08-27T13:15:00+00:00,VENDA,-1.0,VENDA,-1.0,True,0.0,2025-08-27T13:00:00+00:00,2025-08-27T13:00:00+00:00,True,db,db,
27/08/2025,Asia,USDJPY,1.2.1,2025-08-27T00:00:00+00:00,2025-08-26T23:30:00+00:00,FORA,0.0,FORA,0.0,True,0.0,2025-08-26T23:15:00+00:00,2025-08-26T23:15:00+00:00,True,db,db,
27/08/2025,Asia,USDJPY,1.0.1,2025-08-27T00:00:00+00:00,2025-08-26T23:30:00+00:00,FORA,0.0,FORA,0.0,True,0.0,2025-08-26T23:15:00+00:00,2025-08-26T23:15:00+00:00,True,db,db,
27/08/2025,Europe,EURUSD,1.2.2,2025-08-27T07:00:00+00:00,2025-08-27T06:45:00+00:00,FORA,0.5,FORA,0.5,True,0.0,2025-08-27T06:30:00+00:00,2025-08-27T06:30:00+00:00,True,db,db,
27/08/2025,Europe,EURUSD,1.0.2,2025-08-27T07:00:00+00:00,2025-08-27T06:45:00+00:00,VENDA,-1.5,VENDA,-1.5,True,0.0,2025-08-27T06:30:00+00:00,2025-08-27T06:30:00+00:00,True,db,db,
26/08/2025,America,XAUUSD,1.0.3,2025-08-26T13:30:00+00:00,2025-08-26T13:15:00+00:00,VENDA,-2.0,VENDA,-2.0,True,0.0,2025-08-26T13:00:00+00:00,2025-08-26T13:00:00+00:00,True,db,db,
26/08/2025,America,XAUUSD,1.2.3,2025-08-26T13:30:00+00:00,2025-08-26T13:15:00+00:00,FORA,0.0,FORA,0.0,True,0.0,2025-08-26T13:00:00+00:00,2025-08-26T13:00:00+00:00,True,db,db,
26/08/2025,Asia,USDJPY,1.2.1,2025-08-26T00:00:00+00:00,2025-08-25T23:30:00+00:00,COMPRA,2.0,COMPRA,2.0,True,0.0,2025-08-25T23:15:00+00:00,2025-08-25T23:15:00+00:00,True,db,db,
26/08/2025,Asia,USDJPY,1.0.1,2025-08-26T00:00:00+00:00,2025-08-25T23:30:00+00:00,FORA,0.0,FORA,0.0,True,0.0,2025-08-25T23:15:00+00:00,2025-08-25T23:15:00+00:00,True,db,db,
26/08/2025,Europe,EURUSD,1.2.2,2025-08-26T07:00:00+00:00,2025-08-26T06:45:00+00:00,FORA,0.0,FORA,0.0,True,0.0,2025-08-26T06:30:00+00:00,2025-08-26T06:30:00+00:00,True,db,db,
26/08/2025,Europe,EURUSD,1.0.2,2025-08-26T07:00:00+00:00,2025-08-26T06:45:00+00:00,FORA,0.0,FORA,0.0,True,0.0,2025-08-26T06:30:00+00:00,2025-08-26T06:30:00+00:00,True,db,db,
25/08/2025,America,XAUUSD,1.2.3,2025-08-25T13:30:00+00:00,2025-08-25T13:15:00+00:00,COMPRA,2.5,COMPRA,2.5,True,0.0,2025-08-25T13:00:00+00:00,2025-08-25T13:00:00+00:00,True,db,db,
25/08/2025,America,XAUUSD,1.0.3,2025-08-25T13:30:00+00:00,2025-08-25T13:15:00+00:00,COMPRA,2.5,COMPRA,2.5,True,0.0,2025-08-25T13:00:00+00:00,2025-08-25T13:00:00+00:00,True,db,db,
25/08/2025,Asia,USDJPY,1.0.1,2025-08-25T00:00:00+00:00,2025-08-24T23:30:00+00:00,FORA,0.0,FORA,0.0,True,0.0,2025-08-22T23:45:00+00:00,2025-08-22T23:45:00+00:00,True,db,db,
25/08/2025,Asia,USDJPY,1.2.1,2025-08-25T00:00:00+00:00,2025-08-24T23:30:00+00:00,FORA,0.0,FORA,0.0,True,0.0,2025-08-22T23:45:00+00:00,2025-08-22T23:45:00+00:00,True,db,db,
25/08/2025,Europe,EURUSD,1.2.2,2025-08-25T07:00:00+00:00,2025-08-25T06:45:00+00:00,COMPRA,2.0,COMPRA,2.0,True,0.0,2025-08-25T06:30:00+00:00,2025-08-25T06:30:00+00:00,True,db,db,
25/08/2025,Europe,EURUSD,1.0.2,2025-08-25T07:00:00+00:00,2025-08-25T06:45:00+00:00,FORA,0.0,FORA,0.0,True,0.0,2025-08-25T06:30:00+00:00,2025-08-25T06:30:00+00:00,True,db,db,
22/08/2025,America,XAUUSD,1.2.3,2025-08-22T13:30:00+00:00,2025-08-22T13:15:00+00:00,VENDA,-2.0,VENDA,-2.0,True,0.0,2025-08-22T13:00:00+00:00,2025-08-22T13:00:00+00:00,True,db,db,
22/08/2025,America,XAUUSD,1.0.3,2025-08-22T13:30:00+00:00,2025-08-22T13:15:00+00:00,VENDA,-1.0,VENDA,-1.0,True,0.0,2025-08-22T13:00:00+00:00,2025-08-22T13:00:00+00:00,True,db,db,
22/08/2025,Asia,USDJPY,1.0.1,2025-08-22T00:00:00+00:00,2025-08-21T23:30:00+00:00,FORA,0.0,FORA,0.0,True,0.0,2025-08-21T23:15:00+00:00,2025-08-21T23:15:00+00:00,True,db,db,
22/08/2025,Asia,USDJPY,1.2.1,2025-08-22T00:00:00+00:00,2025-08-21T23:30:00+00:00,FORA,0.0,FORA,0.0,True,0.0,2025-08-21T23:15:00+00:00,2025-08-21T23:15:00+00:00,True,db,db,
22/08/2025,Europe,EURUSD,1.2.2,2025-08-22T07:00:00+00:00,2025-08-22T06:45:00+00:00,VENDA,-1.5,VENDA,-1.5,True,0.0,2025-08-22T06:30:00+00:00,2025-08-22T06:30:00+00:00,True,db,db,
22/08/2025,Europe,EURUSD,1.0.2,2025-08-22T07:00:00+00:00,2025-08-22T06:45:00+00:00,FORA,0.5,FORA,0.5,True,0.0,2025-08-22T06:30:00+00:00,2025-08-22T06:30:00+00:00,True,db,db,
21/08/2025,America,XAUUSD,1.2.3,2025-08-21T13:30:00+00:00,2025-08-21T13:15:00+00:00,FORA,1.0,FORA,1.0,True,0.0,2025-08-21T13:00:00+00:00,2025-08-21T13:00:00+00:00,True,db,db,
21/08/2025,America,XAUUSD,1.0.3,2025-08-21T13:30:00+00:00,2025-08-21T13:15:00+00:00,VENDA,-1.0,VENDA,-1.0,True,0.0,2025-08-21T13:00:00+00:00,2025-08-21T13:00:00+00:00,True,db,db,
21/08/2025,Asia,USDJPY,1.0.1,2025-08-21T00:00:00+00:00,2025-08-20T23:30:00+00:00,VENDA,-1.0,VENDA,-1.0,True,0.0,2025-08-20T23:15:00+00:00,2025-08-20T23:15:00+00:00,True,db,db,
21/08/2025,Asia,USDJPY,1.2.1,2025-08-21T00:00:00+00:00,2025-08-20T23:30:00+00:00,VENDA,-1.0,VENDA,-1.0,True,0.0,2025-08-20T23:15:00+00:00,2025-08-20T23:15:00+00:00,True,db,db,
21/08/2025,Europe,EURUSD,1.2.2,2025-08-21T07:00:00+00:00,2025-08-21T06:45:00+00:00,FORA,-0.5,FORA,-0.5,True,0.0,2025-08-21T06:30:00+00:00,2025-08-21T06:30:00+00:00,True,db,db,
21/08/2025,Europe,EURUSD,1.0.2,2025-08-21T07:00:00+00:00,2025-08-21T06:45:00+00:00,FORA,0.5,FORA,0.5,True,0.0,2025-08-21T06:30:00+00:00,2025-08-21T06:30:00+00:00,True,db,db,
20/08/2025,America,XAUUSD,1.0.3,2025-08-20T13:30:00+00:00,2025-08-20T13:15:00+00:00,FORA,0.0,FORA,0.0,True,0.0,2025-08-20T13:00:00+00:00,2025-08-20T13:00:00+00:00,True,db,db,
20/08/2025,America,XAUUSD,1.2.3,2025-08-20T13:30:00+00:00,2025-08-20T13:15:00+00:00,COMPRA,4.0,COMPRA,4.0,True,0.0,2025-08-20T13:00:00+00:00,2025-08-20T13:00:00+00:00,True,db,db,
20/08/2025,Asia,USDJPY,1.2.1,2025-08-20T00:00:00+00:00,2025-08-19T23:30:00+00:00,COMPRA,2.0,COMPRA,2.0,True,0.0,2025-08-19T23:15:00+00:00,2025-08-19T23:15:00+00:00,True,db,db,
20/08/2025,Asia,USDJPY,1.0.1,2025-08-20T00:00:00+00:00,2025-08-19T23:30:00+00:00,COMPRA,2.0,COMPRA,2.0,True,0.0,2025-08-19T23:15:00+00:00,2025-08-19T23:15:00+00:00,True,db,db,
20/08/2025,Europe,EURUSD,1.2.2,2025-08-20T07:00:00+00:00,2025-08-20T06:45:00+00:00,FORA,0.0,FORA,0.0,True,0.0,2025-08-20T06:30:00+00:00,2025-08-20T06:30:00+00:00,True,db,db,
20/08/2025,Europe,EURUSD,1.0.2,2025-08-20T07:00:00+00:00,2025-08-20T06:45:00+00:00,FORA,0.0,FORA,0.0,True,0.0,2025-08-20T06:30:00+00:00,2025-08-20T06:30:00+00:00,True,db,db,
19/08/2025,America,XAUUSD,1.2.3,2025-08-19T13:30:00+00:00,2025-08-19T13:15:00+00:00,COMPRA,2.0,COMPRA,2.0,True,0.0,2025-08-19T13:00:00+00:00,2025-08-19T13:00:00+00:00,True,db,db,
19/08/2025,America,XAUUSD,1.0.3,2025-08-19T13:30:00+00:00,2025-08-19T13:15:00+00:00,FORA,0.0,FORA,0.0,True,0.0,2025-08-19T13:00:00+00:00,2025-08-19T13:00:00+00:00,True,db,db,
19/08/2025,Asia,USDJPY,1.0.1,2025-08-19T00:00:00+00:00,2025-08-18T23:30:00+00:00,FORA,0.0,FORA,0.0,True,0.0,2025-08-18T23:15:00+00:00,2025-08-18T23:15:00+00:00,True,db,db,
19/08/2025,Asia,USDJPY,1.2.1,2025-08-19T00:00:00+00:00,2025-08-18T23:30:00+00:00,FORA,0.0,FORA,0.0,True,0.0,2025-08-18T23:15:00+00:00,2025-08-18T23:15:00+00:00,True,db,db,
19/08/2025,Europe,EURUSD,1.2.2,2025-08-19T07:00:00+00:00,2025-08-19T06:45:00+00:00,VENDA,-1.5,VENDA,-1.5,True,0.0,2025-08-19T06:30:00+00:00,2025-08-19T06:30:00+00:00,True,db,db,
19/08/2025,Europe,EURUSD,1.0.2,2025-08-19T07:00:00+00:00,2025-08-19T06:45:00+00:00,VENDA,-1.0,VENDA,-1.0,True,0.0,2025-08-19T06:30:00+00:00,2025-08-19T06:30:00+00:00,True,db,db,
18/08/2025,America,XAUUSD,1.2.3,2025-08-18T13:30:00+00:00,2025-08-18T13:15:00+00:00,COMPRA,3.0,COMPRA,3.0,True,0.0,2025-08-18T13:00:00+00:00,2025-08-18T13:00:00+00:00,True,db,db,
18/08/2025,America,XAUUSD,1.0.3,2025-08-18T13:30:00+00:00,2025-08-18T13:15:00+00:00,COMPRA,3.0,COMPRA,3.0,True,0.0,2025-08-18T13:00:00+00:00,2025-08-18T13:00:00+00:00,True,db,db,
18/08/2025,Asia,USDJPY,1.0.1,2025-08-18T00:00:00+00:00,2025-08-17T23:30:00+00:00,VENDA,-1.0,VENDA,-1.0,True,0.0,2025-08-15T23:45:00+00:00,2025-08-15T23:45:00+00:00,True,db,db,
18/08/2025,Asia,USDJPY,1.2.1,2025-08-18T00:00:00+00:00,2025-08-17T23:30:00+00:00,COMPRA,2.0,COMPRA,2.0,True,0.0,2025-08-15T23:45:00+00:00,2025-08-15T23:45:00+00:00,True,db,db,
18/08/2025,Europe,EURUSD,1.2.2,2025-08-18T07:00:00+00:00,2025-08-18T06:45:00+00:00,FORA,0.5,FORA,0.5,True,0.0,2025-08-18T06:30:00+00:00,2025-08-18T06:30:00+00:00,True,db,db,
18/08/2025,Europe,EURUSD,1.0.2,2025-08-18T07:00:00+00:00,2025-08-18T06:45:00+00:00,COMPRA,1.5,COMPRA,1.5,True,0.0,2025-08-18T06:30:00+00:00,2025-08-18T06:30:00+00:00,True,db,db,
15/08/2025,America,XAUUSD,1.2.3,2025-08-15T13:30:00+00:00,2025-08-15T13:15:00+00:00,VENDA,-2.0,VENDA,-2.0,True,0.0,2025-08-15T13:00:00+00:00,2025-08-15T13:00:00+00:00,True,db,db,
15/08/2025,America,XAUUSD,1.0.3,2025-08-15T13:30:00+00:00,2025-08-15T13:15:00+00:00,VENDA,-4.0,VENDA,-4.0,True,0.0,2025-08-15T13:00:00+00:00,2025-08-15T13:00:00+00:00,True,db,db,
15/08/2025,Asia,USDJPY,1.2.1,2025-08-15T00:00:00+00:00,2025-08-14T23:30:00+00:00,FORA,0.0,FORA,0.0,True,0.0,2025-08-14T23:15:00+00:00,2025-08-14T23:15:00+00:00,True,db,db,
15/08/2025,Asia,USDJPY,1.0.1,2025-08-15T00:00:00+00:00,2025-08-14T23:30:00+00:00,FORA,0.0,FORA,0.0,True,0.0,2025-08-14T23:15:00+00:00,2025-08-14T23:15:00+00:00,True,db,db,
15/08/2025,Europe,EURUSD,1.2.2,2025-08-15T07:00:00+00:00,2025-08-15T06:45:00+00:00,VENDA,-1.0,VENDA,-1.0,True,0.0,2025-08-15T06:30:00+00:00,2025-08-15T06:30:00+00:00,True,db,db,
15/08/2025,Europe,EURUSD,1.0.2,2025-08-15T07:00:00+00:00,2025-08-15T06:45:00+00:00,FORA,0.0,FORA,0.0,True,0.0,2025-08-15T06:30:00+00:00,2025-08-15T06:30:00+00:00,True,db,db,
14/08/2025,America,XAUUSD,1.2.3,2025-08-14T13:30:00+00:00,2025-08-14T13:15:00+00:00,FORA,1.0,FORA,1.0,True,0.0,2025-08-14T13:00:00+00:00,2025-08-14T13:00:00+00:00,True,db,db,
14/08/2025,America,XAUUSD,1.0.3,2025-08-14T13:30:00+00:00,2025-08-14T13:15:00+00:00,COMPRA,1.0,COMPRA,1.0,True,0.0,2025-08-14T13:00:00+00:00,2025-08-14T13:00:00+00:00,True,db,db,
14/08/2025,Asia,USDJPY,1.2.1,2025-08-14T00:00:00+00:00,2025-08-13T23:30:00+00:00,VENDA,-1.5,VENDA,-1.5,True,0.0,2025-08-13T23:15:00+00:00,2025-08-13T23:15:00+00:00,True,db,db,
14/08/2025,Asia,USDJPY,1.0.1,2025-08-14T00:00:00+00:00,2025-08-13T23:30:00+00:00,VENDA,-3.0,VENDA,-3.0,True,0.0,2025-08-13T23:15:00+00:00,2025-08-13T23:15:00+00:00,True,db,db,
14/08/2025,Europe,EURUSD,1.2.2,2025-08-14T07:00:00+00:00,2025-08-14T06:45:00+00:00,COMPRA,2.0,COMPRA,2.0,True,0.0,2025-08-14T06:30:00+00:00,2025-08-14T06:30:00+00:00,True,db,db,
14/08/2025,Europe,EURUSD,1.0.2,2025-08-14T07:00:00+00:00,2025-08-14T06:45:00+00:00,COMPRA,3.0,COMPRA,3.0,True,0.0,2025-08-14T06:30:00+00:00,2025-08-14T06:30:00+00:00,True,db,db,
13/08/2025,America,XAUUSD,1.2.3,2025-08-13T13:30:00+00:00,2025-08-13T13:15:00+00:00,COMPRA,2.0,COMPRA,2.0,True,0.0,2025-08-13T13:00:00+00:00,2025-08-13T13:00:00+00:00,True,db,db,
13/08/2025,America,XAUUSD,1.0.3,2025-08-13T13:30:00+00:00,2025-08-13T13:15:00+00:00,COMPRA,2.0,COMPRA,2.0,True,0.0,2025-08-13T13:00:00+00:00,2025-08-13T13:00:00+00:00,True,db,db,
13/08/2025,Asia,USDJPY,1.2.1,2025-08-13T00:00:00+00:00,2025-08-12T23:30:00+00:00,FORA,0.0,FORA,0.0,True,0.0,2025-08-12T23:15:00+00:00,2025-08-12T23:15:00+00:00,True,db,db,
13/08/2025,Europe,EURUSD,1.2.2,2025-08-13T07:00:00+00:00,2025-08-13T06:45:00+00:00,COMPRA,1.5,COMPRA,1.5,True,0.0,2025-08-13T06:30:00+00:00,2025-08-13T06:30:00+00:00,True,db,db,
13/08/2025,Europe,EURUSD,1.0.2,2025-08-13T07:00:00+00:00,2025-08-13T06:45:00+00:00,COMPRA,1.5,COMPRA,1.5,True,0.0,2025-08-13T06:30:00+00:00,2025-08-13T06:30:00+00:00,True,db,db,
12/08/2025,America,XAUUSD,1.2.3,2025-08-12T13:30:00+00:00,2025-08-12T13:15:00+00:00,VENDA,-3.5,VENDA,-3.5,True,0.0,2025-08-12T13:00:00+00:00,2025-08-12T13:00:00+00:00,True,db,db,
12/08/2025,America,XAUUSD,1.0.3,2025-08-12T13:30:00+00:00,2025-08-12T13:15:00+00:00,VENDA,-5.5,VENDA,-5.5,True,0.0,2025-08-12T13:00:00+00:00,2025-08-12T13:00:00+00:00,True,db,db,
12/08/2025,Asia,USDJPY,1.0.1,2025-08-12T00:00:00+00:00,2025-08-11T23:30:00+00:00,FORA,0.5,FORA,0.5,True,0.0,2025-08-11T23:15:00+00:00,2025-08-11T23:15:00+00:00,True,db,db,
12/08/2025,Asia,USDJPY,1.2.1,2025-08-12T00:00:00+00:00,2025-08-11T23:30:00+00:00,COMPRA,2.5,COMPRA,2.5,True,0.0,2025-08-11T23:15:00+00:00,2025-08-11T23:15:00+00:00,True,db,db,
12/08/2025,Europe,EURUSD,1.2.2,2025-08-12T07:00:00+00:00,2025-08-12T06:45:00+00:00,COMPRA,2.5,COMPRA,2.5,True,0.0,2025-08-12T06:30:00+00:00,2025-08-12T06:30:00+00:00,True,db,db,
11/08/2025,America,XAUUSD,1.2.3,2025-08-11T13:30:00+00:00,2025-08-11T13:15:00+00:00,VENDA,-2.0,VENDA,-2.0,True,0.0,2025-08-11T13:00:00+00:00,2025-08-11T13:00:00+00:00,True,db,db,
11/08/2025,Asia,USDJPY,1.0.1,2025-08-11T00:00:00+00:00,2025-08-10T23:30:00+00:00,VENDA,-2.0,VENDA,-2.0,True,0.0,2025-08-08T23:45:00+00:00,2025-08-08T23:45:00+00:00,True,db,db,
11/08/2025,Asia,USDJPY,1.2.1,2025-08-11T00:00:00+00:00,2025-08-10T23:30:00+00:00,FORA,0.0,FORA,0.0,True,0.0,2025-08-08T23:45:00+00:00,2025-08-08T23:45:00+00:00,True,db,db,
11/08/2025,Europe,EURUSD,1.2.2,2025-08-11T07:00:00+00:00,2025-08-11T06:45:00+00:00,FORA,0.0,FORA,0.0,True,0.0,2025-08-11T06:30:00+00:00,2025-08-11T06:30:00+00:00,True,db,db,
11/08/2025,Europe,EURUSD,1.0.2,2025-08-11T07:00:00+00:00,2025-08-11T06:45:00+00:00,FORA,0.0,FORA,0.0,True,0.0,2025-08-11T06:30:00+00:00,2025-08-11T06:30:00+00:00,True,db,db,
08/08/2025,America,XAUUSD,1.0.3,2025-08-08T13:30:00+00:00,2025-08-08T13:15:00+00:00,VENDA,-1.0,VENDA,-1.0,True,0.0,2025-08-08T13:00:00+00:00,2025-08-08T13:00:00+00:00,True,db,db,
08/08/2025,America,XAUUSD,1.2.3,2025-08-08T13:30:00+00:00,2025-08-08T13:15:00+00:00,FORA,1.0,FORA,1.0,True,0.0,2025-08-08T13:00:00+00:00,2025-08-08T13:00:00+00:00,True,db,db,
08/08/2025,Asia,USDJPY,1.2.1,2025-08-08T00:00:00+00:00,2025-08-07T23:30:00+00:00,FORA,-0.5,FORA,-0.5,True,0.0,2025-08-07T23:15:00+00:00,2025-08-07T23:15:00+00:00,True,db,db,
08/08/2025,Asia,USDJPY,1.0.1,2025-08-08T00:00:00+00:00,2025-08-07T23:30:00+00:00,FORA,-0.5,FORA,-0.5,True,0.0,2025-08-07T23:15:00+00:00,2025-08-07T23:15:00+00:00,True,db,db,
08/08/2025,Europe,EURUSD,1.2.2,2025-08-08T07:00:00+00:00,2025-08-08T06:45:00+00:00,FORA,0.0,FORA,0.0,True,0.0,2025-08-08T06:30:00+00:00,2025-08-08T06:30:00+00:00,True,db,db,
08/08/2025,Europe,EURUSD,1.0.2,2025-08-08T07:00:00+00:00,2025-08-08T06:45:00+00:00,FORA,0.0,FORA,0.0,True,0.0,2025-08-08T06:30:00+00:00,2025-08-08T06:30:00+00:00,True,db,db,
07/08/2025,America,XAUUSD,1.2.3,2025-08-07T13:30:00+00:00,2025-08-07T13:15:00+00:00,FORA,-1.0,FORA,-1.0,True,0.0,2025-08-07T13:00:00+00:00,2025-08-07T13:00:00+00:00,True,db,db,
07/08/2025,America,XAUUSD,1.0.3,2025-08-07T13:30:00+00:00,2025-08-07T13:15:00+00:00,FORA,0.0,FORA,0.0,True,0.0,2025-08-07T13:00:00+00:00,2025-08-07T13:00:00+00:00,True,db,db,
07/08/2025,Asia,USDJPY,1.2.1,2025-08-07T00:00:00+00:00,2025-08-06T23:30:00+00:00,VENDA,-2.0,VENDA,-2.0,True,0.0,2025-08-06T23:15:00+00:00,2025-08-06T23:15:00+00:00,True,db,db,
07/08/2025,Asia,USDJPY,1.0.1,2025-08-07T00:00:00+00:00,2025-08-06T23:30:00+00:00,VENDA,-1.0,VENDA,-1.0,True,0.0,2025-08-06T23:15:00+00:00,2025-08-06T23:15:00+00:00,True,db,db,
07/08/2025,Europe,EURUSD,1.2.2,2025-08-07T07:00:00+00:00,2025-08-07T06:45:00+00:00,FORA,0.0,FORA,0.0,True,0.0,2025-08-07T06:30:00+00:00,2025-08-07T06:30:00+00:00,True,db,db,
07/08/2025,Europe,EURUSD,1.0.2,2025-08-07T07:00:00+00:00,2025-08-07T06:45:00+00:00,FORA,0.0,FORA,0.0,True,0.0,2025-08-07T06:30:00+00:00,2025-08-07T06:30:00+00:00,True,db,db,
06/08/2025,America,XAUUSD,1.2.3,2025-08-06T13:30:00+00:00,2025-08-06T13:15:00+00:00,VENDA,-3.5,VENDA,-3.5,True,0.0,2025-08-06T13:00:00+00:00,2025-08-06T13:00:00+00:00,True,db,db,
06/08/2025,America,XAUUSD,1.0.3,2025-08-06T13:30:00+00:00,2025-08-06T13:15:00+00:00,VENDA,-5.5,VENDA,-5.5,True,0.0,2025-08-06T13:00:00+00:00,2025-08-06T13:00:00+00:00,True,db,db,
06/08/2025,Asia,USDJPY,1.0.1,2025-08-06T00:00:00+00:00,2025-08-05T23:30:00+00:00,FORA,0.0,FORA,0.0,True,0.0,2025-08-05T23:15:00+00:00,2025-08-05T23:15:00+00:00,True,db,db,
06/08/2025,Asia,USDJPY,1.2.1,2025-08-06T00:00:00+00:00,2025-08-05T23:30:00+00:00,FORA,0.0,FORA,0.0,True,0.0,2025-08-05T23:15:00+00:00,2025-08-05T23:15:00+00:00,True,db,db,
06/08/2025,Europe,EURUSD,1.2.2,2025-08-06T07:00:00+00:00,2025-08-06T06:45:00+00:00,FORA,0.5,FORA,0.5,True,0.0,2025-08-06T06:30:00+00:00,2025-08-06T06:30:00+00:00,True,db,db,
06/08/2025,Europe,EURUSD,1.0.2,2025-08-06T07:00:00+00:00,2025-08-06T06:45:00+00:00,COMPRA,1.5,COMPRA,1.5,True,0.0,2025-08-06T06:30:00+00:00,2025-08-06T06:30:00+00:00,True,db,db,
05/08/2025,America,XAUUSD,1.2.3,2025-08-05T13:30:00+00:00,2025-08-05T13:15:00+00:00,FORA,0.0,FORA,0.0,True,0.0,2025-08-05T13:00:00+00:00,2025-08-05T13:00:00+00:00,True,db,db,
05/08/2025,America,XAUUSD,1.0.3,2025-08-05T13:30:00+00:00,2025-08-05T13:15:00+00:00,FORA,0.0,FORA,0.0,True,0.0,2025-08-05T13:00:00+00:00,2025-08-05T13:00:00+00:00,True,db,db,
05/08/2025,Asia,USDJPY,1.2.1,2025-08-05T00:00:00+00:00,2025-08-04T23:30:00+00:00,FORA,-0.5,FORA,-0.5,True,0.0,2025-08-04T23:15:00+00:00,2025-08-04T23:15:00+00:00,True,db,db,
05/08/2025,Asia,USDJPY,1.0.1,2025-08-05T00:00:00+00:00,2025-08-04T23:30:00+00:00,FORA,-0.5,FORA,-0.5,True,0.0,2025-08-04T23:15:00+00:00,2025-08-04T23:15:00+00:00,True,db,db,
05/08/2025,Europe,EURUSD,1.2.2,2025-08-05T07:00:00+00:00,2025-08-05T06:45:00+00:00,VENDA,-1.0,VENDA,-1.0,True,0.0,2025-08-05T06:30:00+00:00,2025-08-05T06:30:00+00:00,True,db,db,
05/08/2025,Europe,EURUSD,1.0.2,2025-08-05T07:00:00+00:00,2025-08-05T06:45:00+00:00,COMPRA,1.0,COMPRA,1.0,True,0.0,2025-08-05T06:30:00+00:00,2025-08-05T06:30:00+00:00,True,db,db,
04/08/2025,America,XAUUSD,1.2.3,2025-08-04T13:30:00+00:00,2025-08-04T13:15:00+00:00,COMPRA,2.0,COMPRA,2.0,True,0.0,2025-08-04T13:00:00+00:00,2025-08-04T13:00:00+00:00,True,db,db,
04/08/2025,Asia,USDJPY,1.2.1,2025-08-04T00:00:00+00:00,2025-08-03T23:30:00+00:00,FORA,0.0,FORA,0.0,True,0.0,2025-08-01T23:45:00+00:00,2025-08-01T23:45:00+00:00,True,db,db,
04/08/2025,Europe,EURUSD,1.2.2,2025-08-04T07:00:00+00:00,2025-08-04T06:45:00+00:00,FORA,0.0,FORA,0.0,True,0.0,2025-08-04T06:30:00+00:00,2025-08-04T06:30:00+00:00,True,db,db,
01/08/2025,America,XAUUSD,1.2.3,2025-08-01T13:30:00+00:00,2025-08-01T13:15:00+00:00,FORA,-1.0,FORA,-1.0,True,0.0,2025-08-01T13:00:00+00:00,2025-08-01T13:00:00+00:00,True,db,db,
01/08/2025,America,XAUUSD,1.0.3,2025-08-01T13:30:00+00:00,2025-08-01T13:15:00+00:00,FORA,0.0,FORA,0.0,True,0.0,2025-08-01T13:00:00+00:00,2025-08-01T13:00:00+00:00,True,db,db,
01/08/2025,Asia,USDJPY,1.2.1,2025-08-01T00:00:00+00:00,2025-07-31T23:30:00+00:00,FORA,0.0,FORA,0.0,True,0.0,2025-07-31T23:15:00+00:00,2025-07-31T23:15:00+00:00,True,db,db,
01/08/2025,Asia,USDJPY,1.0.1,2025-08-01T00:00:00+00:00,2025-07-31T23:30:00+00:00,FORA,0.0,FORA,0.0,True,0.0,2025-07-31T23:15:00+00:00,2025-07-31T23:15:00+00:00,True,db,db,
01/08/2025,Europe,EURUSD,1.2.2,2025-08-01T07:00:00+00:00,2025-08-01T06:45:00+00:00,VENDA,-2.0,VENDA,-2.0,True,0.0,2025-08-01T06:30:00+00:00,2025-08-01T06:30:00+00:00,True,db,db,
01/08/2025,Europe,EURUSD,1.0.2,2025-08-01T07:00:00+00:00,2025-08-01T06:45:00+00:00,FORA,0.0,FORA,0.0,True,0.0,2025-08-01T06:30:00+00:00,2025-08-01T06:30:00+00:00,True,db,db,
31/07/2025,America,XAUUSD,1.0.3,2025-07-31T13:30:00+00:00,2025-07-31T13:15:00+00:00,COMPRA,2.0,COMPRA,2.0,True,0.0,2025-07-31T13:00:00+00:00,2025-07-31T13:00:00+00:00,True,db,db,
31/07/2025,America,XAUUSD,1.2.3,2025-07-31T13:30:00+00:00,2025-07-31T13:15:00+00:00,COMPRA,2.0,COMPRA,2.0,True,0.0,2025-07-31T13:00:00+00:00,2025-07-31T13:00:00+00:00,True,db,db,
31/07/2025,Asia,USDJPY,1.2.1,2025-07-31T00:00:00+00:00,2025-07-30T23:30:00+00:00,FORA,0.0,FORA,0.0,True,0.0,2025-07-30T23:15:00+00:00,2025-07-30T23:15:00+00:00,True,db,db,
31/07/2025,Asia,USDJPY,1.0.1,2025-07-31T00:00:00+00:00,2025-07-30T23:30:00+00:00,FORA,0.0,FORA,0.0,True,0.0,2025-07-30T23:15:00+00:00,2025-07-30T23:15:00+00:00,True,db,db,
31/07/2025,Europe,EURUSD,1.2.2,2025-07-31T07:00:00+00:00,2025-07-31T06:45:00+00:00,FORA,0.0,FORA,0.0,True,0.0,2025-07-31T06:30:00+00:00,2025-07-31T06:30:00+00:00,True,db,db,
31/07/2025,Europe,EURUSD,1.0.2,2025-07-31T07:00:00+00:00,2025-07-31T06:45:00+00:00,FORA,0.0,FORA,0.0,True,0.0,2025-07-31T06:30:00+00:00,2025-07-31T06:30:00+00:00,True,db,db,
30/07/2025,America,XAUUSD,1.2.3,2025-07-30T13:30:00+00:00,2025-07-30T13:15:00+00:00,FORA,1.5,FORA,1.5,True,0.0,2025-07-30T13:00:00+00:00,2025-07-30T13:00:00+00:00,True,db,db,
30/07/2025,America,XAUUSD,1.0.3,2025-07-30T13:30:00+00:00,2025-07-30T13:15:00+00:00,FORA,-0.5,FORA,-0.5,True,0.0,2025-07-30T13:00:00+00:00,2025-07-30T13:00:00+00:00,True,db,db,
30/07/2025,Asia,USDJPY,1.0.1,2025-07-30T00:00:00+00:00,2025-07-29T23:30:00+00:00,VENDA,-2.0,VENDA,-2.0,True,0.0,2025-07-29T23:15:00+00:00,2025-07-29T23:15:00+00:00,True,db,db,
30/07/2025,Asia,USDJPY,1.2.1,2025-07-30T00:00:00+00:00,2025-07-29T23:30:00+00:00,VENDA,-2.0,VENDA,-2.0,True,0.0,2025-07-29T23:15:00+00:00,2025-07-29T23:15:00+00:00,True,db,db,
30/07/2025,Europe,EURUSD,1.2.2,2025-07-30T07:00:00+00:00,2025-07-30T06:45:00+00:00,VENDA,-3.0,VENDA,-3.0,True,0.0,2025-07-30T06:30:00+00:00,2025-07-30T06:30:00+00:00,True,db,db,
30/07/2025,Europe,EURUSD,1.0.2,2025-07-30T07:00:00+00:00,2025-07-30T06:45:00+00:00,VENDA,-2.0,VENDA,-2.0,True,0.0,2025-07-30T06:30:00+00:00,2025-07-30T06:30:00+00:00,True,db,db,
29/07/2025,America,XAUUSD,1.2.3,2025-07-29T13:30:00+00:00,2025-07-29T13:15:00+00:00,COMPRA,2.0,COMPRA,2.0,True,0.0,2025-07-29T13:00:00+00:00,2025-07-29T13:00:00+00:00,True,db,db,
29/07/2025,America,XAUUSD,1.0.3,2025-07-29T13:30:00+00:00,2025-07-29T13:15:00+00:00,COMPRA,3.0,COMPRA,3.0,True,0.0,2025-07-29T13:00:00+00:00,2025-07-29T13:00:00+00:00,True,db,db,
29/07/2025,Asia,USDJPY,1.0.1,2025-07-29T00:00:00+00:00,2025-07-28T23:30:00+00:00,FORA,-0.5,FORA,-0.5,True,0.0,2025-07-28T23:15:00+00:00,2025-07-28T23:15:00+00:00,True,db,db,
29/07/2025,Asia,USDJPY,1.2.1,2025-07-29T00:00:00+00:00,2025-07-28T23:30:00+00:00,COMPRA,1.5,COMPRA,1.5,True,0.0,2025-07-28T23:15:00+00:00,2025-07-28T23:15:00+00:00,True,db,db,
29/07/2025,Europe,EURUSD,1.2.2,2025-07-29T07:00:00+00:00,2025-07-29T06:45:00+00:00,FORA,0.0,FORA,0.0,True,0.0,2025-07-29T06:30:00+00:00,2025-07-29T06:30:00+00:00,True,db,db,
29/07/2025,Europe,EURUSD,1.0.2,2025-07-29T07:00:00+00:00,2025-07-29T06:45:00+00:00,FORA,0.0,FORA,0.0,True,0.0,2025-07-29T06:30:00+00:00,2025-07-29T06:30:00+00:00,True,db,db,
28/07/2025,America,XAUUSD,1.2.3,2025-07-28T13:30:00+00:00,2025-07-28T13:15:00+00:00,FORA,1.0,FORA,1.0,True,0.0,2025-07-28T13:00:00+00:00,2025-07-28T13:00:00+00:00,True,db,db,
28/07/2025,America,XAUUSD,1.0.3,2025-07-28T13:30:00+00:00,2025-07-28T13:15:00+00:00,COMPRA,1.0,COMPRA,1.0,True,0.0,2025-07-28T13:00:00+00:00,2025-07-28T13:00:00+00:00,True,db,db,
28/07/2025,Asia,USDJPY,1.2.1,2025-07-28T00:00:00+00:00,2025-07-27T23:30:00+00:00,COMPRA,2.0,COMPRA,2.0,True,0.0,2025-07-25T23:45:00+00:00,2025-07-25T23:45:00+00:00,True,db,db,
28/07/2025,Asia,USDJPY,1.0.1,2025-07-28T00:00:00+00:00,2025-07-27T23:30:00+00:00,COMPRA,2.0,COMPRA,2.0,True,0.0,2025-07-25T23:45:00+00:00,2025-07-25T23:45:00+00:00,True,db,db,
28/07/2025,Europe,EURUSD,1.2.2,2025-07-28T07:00:00+00:00,2025-07-28T06:45:00+00:00,FORA,-0.5,FORA,-0.5,True,0.0,2025-07-28T06:30:00+00:00,2025-07-28T06:30:00+00:00,True,db,db,
28/07/2025,Europe,EURUSD,1.0.2,2025-07-28T07:00:00+00:00,2025-07-28T06:45:00+00:00,VENDA,-1.5,VENDA,-1.5,True,0.0,2025-07-28T06:30:00+00:00,2025-07-28T06:30:00+00:00,True,db,db,
25/07/2025,America,XAUUSD,1.0.3,2025-07-25T13:30:00+00:00,2025-07-25T13:15:00+00:00,FORA,0.0,FORA,0.0,True,0.0,2025-07-25T13:00:00+00:00,2025-07-25T13:00:00+00:00,True,db,db,
25/07/2025,America,XAUUSD,1.2.3,2025-07-25T13:30:00+00:00,2025-07-25T13:15:00+00:00,FORA,0.0,FORA,0.0,True,0.0,2025-07-25T13:00:00+00:00,2025-07-25T13:00:00+00:00,True,db,db,
25/07/2025,Asia,USDJPY,1.2.1,2025-07-25T00:00:00+00:00,2025-07-24T23:30:00+00:00,COMPRA,3.0,COMPRA,3.0,True,0.0,2025-07-24T23:15:00+00:00,2025-07-24T23:15:00+00:00,True,db,db,
25/07/2025,Asia,USDJPY,1.0.1,2025-07-25T00:00:00+00:00,2025-07-24T23:30:00+00:00,COMPRA,3.0,COMPRA,3.0,True,0.0,2025-07-24T23:15:00+00:00,2025-07-24T23:15:00+00:00,True,db,db,
25/07/2025,Europe,EURUSD,1.2.2,2025-07-25T07:00:00+00:00,2025-07-25T06:45:00+00:00,VENDA,-2.0,VENDA,-2.0,True,0.0,2025-07-25T06:30:00+00:00,2025-07-25T06:30:00+00:00,True,db,db,
25/07/2025,Europe,EURUSD,1.0.2,2025-07-25T07:00:00+00:00,2025-07-25T06:45:00+00:00,VENDA,-4.0,VENDA,-4.0,True,0.0,2025-07-25T06:30:00+00:00,2025-07-25T06:30:00+00:00,True,db,db,
24/07/2025,America,XAUUSD,1.2.3,2025-07-24T13:30:00+00:00,2025-07-24T13:15:00+00:00,FORA,0.0,FORA,0.0,True,0.0,2025-07-24T13:00:00+00:00,2025-07-24T13:00:00+00:00,True,db,db,
24/07/2025,America,XAUUSD,1.0.3,2025-07-24T13:30:00+00:00,2025-07-24T13:15:00+00:00,FORA,0.0,FORA,0.0,True,0.0,2025-07-24T13:00:00+00:00,2025-07-24T13:00:00+00:00,True,db,db,
24/07/2025,Asia,USDJPY,1.2.1,2025-07-24T00:00:00+00:00,2025-07-23T23:30:00+00:00,VENDA,-2.5,VENDA,-2.5,True,0.0,2025-07-23T23:15:00+00:00,2025-07-23T23:15:00+00:00,True,db,db,
24/07/2025,Asia,USDJPY,1.0.1,2025-07-24T00:00:00+00:00,2025-07-23T23:30:00+00:00,VENDA,-2.0,VENDA,-2.0,True,0.0,2025-07-23T23:15:00+00:00,2025-07-23T23:15:00+00:00,True,db,db,
24/07/2025,Europe,EURUSD,1.2.2,2025-07-24T07:00:00+00:00,2025-07-24T06:45:00+00:00,FORA,0.0,FORA,0.0,True,0.0,2025-07-24T06:30:00+00:00,2025-07-24T06:30:00+00:00,True,db,db,
24/07/2025,Europe,EURUSD,1.0.2,2025-07-24T07:00:00+00:00,2025-07-24T06:45:00+00:00,FORA,0.0,FORA,0.0,True,0.0,2025-07-24T06:30:00+00:00,2025-07-24T06:30:00+00:00,True,db,db,
